username,rating,review_text,date,likes,comments,viewing_type,user_liked
dickgraysonm,10,Best movie ever AHHHHHH,2025-10-12,0,0,rewatch,True
hopeong,10,"The Bayaniverse ends, but the call to action doesn’t.Sitting through the credits, thinking about what it means to love this country—and how difficult it can be. Not just in words, but in what we’re willing to do for it.",2025-10-12,53,0,watch,True
hikariduck,9,Sad to see Mormont finally succumb to greyscale,2025-10-13,37,1,watch,True
dickgraysonm,10,Best movie ever Cris Villanueva did so well in making his part come to life. 10/10,2025-10-13,1,0,watch,True
jornauxdereine,8,"had the privilege to watch this last October 12 and let me just say that i enjoyed it very much.Manuel Quezon was the original politician of the Philippines. he knew how to control the people and how to get what he wants. i do believe he ran as a government official to help the Filipino people and gain independence from the Americans, but once you get a taste of fame, money, and power, those intentions can be easily forgotten. this movie came at the right time as it shows similarities on how our current government looks like. we are in the hands of fickle-minded politicians who only care about themselves. it's upsetting how even 90 years later we are still in the same mess. i always envy how other countries have better transportation systems, better work opportunities, and just better everything just because they were served by people who want real change in their country. still, i would never stop dreaming for real change in our country, and i feel that this movie gives hope to its viewers. amazing performances from everyone in the cast, the message/story was clear, and can't wait to support more Filipino-made movies!!",2025-10-14,4,0,watch,False
reeladvicenet,9,"Source: www.reeladvice.net/2025/10/quezon-2025-movie-review.htmlThe war is over, and now the battle is set in the world of politics. Quezon takes us front and center into the seemingly heroic life of Manuel L. Quezon - a personality Filipinos look up to as a hero, a visionary, and one of the nation’s key founders. But much like its predecessors in the Bayaniverse franchise, the film tackles head-on the sheer humanity and fallibility of Quezon, questioning whether the ends justify the means in the battlefield of power and the making of a young nation.Manuel L. Quezon (Jericho Rosales) has just won the 1935 elections, becoming the first elected Filipino president and the second president of the Philippines. But the journey to win that coveted and historically significant seat wasn’t an easy one, and you don’t get to the top without getting your hands dirty and making a few enemies along the way.On its third outing, the Bayaniverse comes full circle by slowly shifting from the action-packed Heneral Luna to a somber drama in Goyo: Ang Batang Heneral and finally to a full blown political drama in Quezon. The literal battles here are replaced by heated confrontations between Quezon and his contemporaries, showing how he fought and negotiated his way through power by any means necessary. While we can’t say for sure if every revelation in the film is historically accurate, this is far from the textbook version of Quezon we grew up with. This is a human Manuel Quezon up front and center. One who is charming, cunning, and deeply flawed. The film hits hard, especially when viewed against the backdrop of today’s political landscape, reminding us that the people we idolize are often far more complicated than their public images suggests.The film’s chapter-based narrative structure was something we appreciated, breaking down Quezon’s political battles into distinct segments. However, the pacing felt uneven at times, with one chapter taking up a disproportionate part of the runtime. In terms of performances, though, everyone delivered. Mon Confiado stood out as a somber, grounded Emilio Aguinaldo, while Jericho Rosales embodied Quezon’s ambition and deceitful charm perfectly. We found ourselves surprisingly invested in Quezon, and by the time the credits rolled, it hit us hard much like the other Bayaniverse films. Like before, it left questioning whether the struggles we face today were shaped by the same heroes we’ve long revered. As a potential bookend to the franchise, Quezon closes the trilogy in the way we hoped it would which is powerful, reflective, and important for Filipinos.",2025-10-13,3,0,watch,False
_mrc,9,"sayang it would have been better (more realistic) if it was tj trinidad who portrayed as MLQ kasi sila talaga ang magka doppelganger (and both mestizo pa) nonetheless, jericho rosales pulled it off naman",2025-10-15,5,0,watch,False
philbertdy,8,"I think it's really best to now see all three films as one long project, all of it built around the deconstruction of the national hero. It is through that lens that the character of Joven finally makes sense, the trilogy's audience surrogate who attaches himself to these larger-than-life figures, only to witness their downfall. Joven believes in the Great Man: in the singular figures that will lead our nation out of the darkness. The film openly exposes that idea as foolhardy at best, because these Great Men are just people, too. And they're all deeply flawed individuals that just get their dirty laundry swept under the bed precisely because they feel like they could be our saviors.This third film is practically a farce, with Rosales' Manuel L. Quezon treating nationhood as a rigged game where only he can come out on top. He blatantly lies to his friends when it's convenient to do so, and accumulates power through every dirty trick in the politician's playbook. He is the Ur-TRAPO, basically creating the systems that would make TRAPOs an inescapable reality in the Philippines.Rosales is terrific here, his Quezon constantly performing for whoever's in front of him. He projects being a loyal ally, or a mentor, or a friend, or indeed the great savior of the Philippines. He plays that big, while in private moments Quezon is all vulnerability: a man who sees how delicate the house of cards he's built is, and worries about whether his health will allow him to see his dreams come to fruition.I do think the film has a tendency to overexplain, to have characters speaking the subtext out loud. But considering how some people took Heneral Luna, maybe this was always the tack to take. In any case, the film is unequivocal with how it wants us to see Quezon: he is what Chiz Escudero wants to be, and maybe what made Chiz Escudero possible. Welcome to our Sad Republic. Here's the guy that made it happen.",2025-10-15,448,3,watch,True
reyraymundv,8,"One McGuffin in the film is a Philippine peso coin that Quezon offers Joven the first time they meet. Quezon tells Joven, “pasisikatin ko ang pangalan mo,” “I will make your name famous.” It is offered as a symbol of promise. Later in the film, we understand that Quezon is a businessman and how we sees his wits as he steers money into his electoral campaign. Quezon knows how to invest in the hearts of the people he influences. He fully understands the weakness of Filipinos when it comes to “utang na loob” or debt of gratitude. We see this coin move between Quezon and Joven. Joven, who later finds out Quezon’s dirty tricks, returns the coin. In the last act, the coin is returned, becoming a powerful metaphor for the cost Filipinos pay when voting for leaders who manipulate their perception.Quezon is intriguing, comical at times, but otherwise compelling in that you’re hypnotized and drawn to the flipping of Quezon’s coin, who is on one side a hero, and on the other a flawed human being. We see him as a player, incisive in his chess pieces in Philippine politics. But also a sociopath when he deals with his cards in a game of poker with his enemies. The dialogue in the film never lets up, with pacing that keeps you glued to your seat. The film makes you love-hate the man, and Jericho Rosales’ performance stands out, supported by an impressive powerhouse cast.Overall, the film is witty and entertaining. The political play may be on the nose, but should not alienate a regular Filipino moviegoer. And should be able to provide a proper dissection of the politicians we placed in their positions, and a wake-up call to vote better in the next elections.see video version on Tiktok or Instagram @reyraymundv",2025-10-13,25,0,watch,True
rifaaaaaaa,7,I get the hamilton of the ph,2025-10-15,14,4,watch,False
ica_cheng,8,"The Bayaniverse films have always been about showing how these heroes, whom we have put up on a pedestal, are in reality very flawed humans as well. With ‘Quezon’ we not only see a very flawed human, but one that could have possibly set up the many political systems in play today. Jericho Rosales who plays the titular chameleon ‘Quezon’ brings his A game to the role. You can see his range with Quezon’s cunning smiles, and explosive anger. The entire cast is a powerhouse one as well, bringing their own strengths to their characters. Technically, I was impressed by how the film was shot, employing black and white film work to mimic films from the 1930s. The production design was also on point with the props and costumes used, even the set pieces were impressive. The story itself shows how Quezon, who might be seen as a hero, has some skeletons in his own closet, and even had some strings pulled to help his rise to power, the reveal is a treat, and even though this is already history, there was a scene where I had to hold my breath.",2025-10-13,2,0,watch,False
kapengmukha,8,"I had the privilege of watching “Quezon” last Sunday.The film in some way, gave me closure about what our politics are today—though not the good kind of closure.I remember during the last elections, one of my professors was kind enough to ask the whole class how we were holding up. Of course, we felt cheated, beaten. When I returned the question to him, he sighed and said, “Well, sanay na kami.”Watching Quezon, that statement makes even more sense. The film is a mirror—almost like a satire—protesting to our faces what we’ve been enduring for years.We’re all familiar with the Filipino game of politics (brought to life first by our colonizers, if I may add), but seeing it up close through this film is heartbreaking.We are being played by our politicians, and though we feel it deeply today, it’s something that has persisted for years. In this case, even in our very early days of democracy.“Quezon” premieres today in over 260 cinemas nationwide.",2025-10-15,1,0,watch,False
nowxza,10,Casey x Sergie doomed yaoi,2025-10-15,31,0,watch,True
fredsaid,9,"Jericho Rosales was an inspired choice to play the charismatic president, who spoke, argued and cursed with oratorical flair and passion. This film was certainly not romanticized nor haigographic. Rosales played him as domineering, devious, dishonest -- promoting a political culture so toxic that still pervades our government even almost century hence. Rosales's Quezon was fiercely egotistical up to his ultimate declaration of ""I am the Philippines!"" before the final fade to black.Full review: said-fred.blogspot.com/2025/10/review-of-quezon-commonwealth-chameleon.html",2025-10-12,2,0,watch,False
iconstello,10,quezon and sergio my divorced parents,2025-10-15,106,0,watch,False
millimetrs,10,I am the Philippines (derogatory),2025-10-12,4,0,watch,False
urmoviebuddy,10,IT’S TIME WE TAKE A STAND,2025-10-15,0,0,watch,True
inl_iinwyu,10,"I truly have nothing but praise for this film. 10/10, all stars on the board. A compelling movie that doesn’t shy away from the ugly truth, who mixes comedy with drama, all while shedding a new light onto the people we herald as heroes today. From the cinematography to the script, I loved every minute.",2025-10-15,2,0,watch,False
tachyawns,8,"ang sakit lang na hanggang ngayon ay ganito pa rin ang pulitika dito sa pilipinas—tila'y laro lamang para sa kanilang kayang dungisan ang kamay para lang sa kapangyarihan.walang nagbago, magmula kay quezon hanggang ngayong kay marcos at duterte.",2025-10-15,42,0,watch,False
sophiastills,6,message is pretty obvious and heavy-handed. im kinda over the Moralizing script. but i love the stylistic choices. it keeps things fresh. i love when a movie clearly loves movies.,2025-10-15,0,0,watch,False
chuuworld,7,my queen nadia you wouldve loved having letterboxd,2025-10-15,454,1,watch,True
glxoo,8,taena lakas ng chemistry ni quezon at osmeñagago ginagawa ni cong tv diyan hahahahha,2025-10-15,4,0,watch,False
noodlephobia,,quezosmeña?!,2025-10-15,2,0,watch,False
alfalfaaa,7,"parang na-trauma ata si direk sa paggamit ng DDS sa first film nya kaya spinell out nya na ang lahat. O GANITO HA PARA WALANG MISINTERPRETATION MGA HUNGHANG, haha Di lang ako sigurado na ganitong feeling ang kailangan natin ngayon, yung feeling na parang walang makakabali sa kabulukan ng sistema at endemic na sya sa ating bayan. medyo deflation at paralysis naramdaman ko after. minority siguro rin ako na di super persuaded sa acting ni Echo dito. The supports are great tho!",2025-10-15,3,0,watch,False
fuyao,10,thank u nueo for giving us the opportunity to watch this film !!!! very eye opening and relevant. a film EVERYONE should watch,2025-10-15,0,0,watch,False
accnicircle,7,wow jericho rosales dont change ah,2025-10-15,2,0,watch,True
merumoof,7,ako lang ba yung gulat na gulat kay cong??? 😭😭(the concept of a solid north supporter being in a historical film about corruption...),2025-10-15,4,0,watch,False
strawburrish,10,solid north HAHAHAHAHAHAHAHA,2025-10-15,16,0,watch,True
uno_peterson,9,"wthelly CongTV?hope the Magsaysay film happens, however long it would take. Quezon is literally The Philippines",2025-10-15,4,0,watch,True
dreaxvn,8,naligaw ata si congtv,2025-10-15,1,0,watch,False
lxckyme,6,"parang mga aso’t pusa, punyeta!",2025-10-15,1,0,watch,False
sinewhore,10,“sige ako na burat”,2025-10-15,103,1,watch,True
dorcass,10,TW: Cong TV,2025-10-15,45,0,watch,True
niborquinones,7,nakakatawa ampotathese films are fine but I just can’t help but feel like Jerrold Tarog’s talents are being wasted on these? sana iba na humawak ng Magsaysay.,2025-10-15,2,0,watch,False
pelikulastudent,9,"aside from the surprising good performance of jericho rosales as the titular quezon — one who i suspect must have had significant work and training done, in the way he embodied this role — i have to sing praises for the women in this film. in fact, the reason this could not get a full 5-star rating was because i felt the talent of the likes of ana abad santos were wasted as secondary characters - who by the way…",2025-10-15,15,0,watch,False
dicotalvarado,9,"A pretty compelling dissection of the messiness of politics. Mind you there's some bits here I would have loved to have seen pared down-- some speeches here often read as plain and didactic as thesis statements and some visuals come across as painfully obvious. There's a lot of reiteration of the theme of games being played here in the pull for power, even down to, in one scene, a clear chessboard referenced in both dialogue and image in a moment of Quezon's play for power and assembly of political pieces. And to be honest, the whole idea of politics being a game is something that simply comes across as trite (I mean, there is already a biopic out there that exists called Quezon's Game).At the same time, you have to admire the ambition of just implementing those ideas so clearly on levels of craft and storytelling. On the whole this is a sumptuously put together film that manages to make a whole lot of talking deeply delightful. This is especially remarkable considering that A. Dialogue-heavy films can easily bore if pulled off improperly and B. Quezon as a person is a character that, in actuality, should come across as deeply uncompelling due to how awful he actually is as a person-- which the film does not shy away from. To tackle the former, some truly astounding filmmaking is on full display here, really playfully swinging that camera and injecting a constant sense of energy through the movement of visuals. And for the latter, this is simply a sharp, wise, and surprisingly comedic script that really sells in its details. Manuel Quezon ultimately is a mess of a human being, but the film really has a lot of fun examining how this man claimed power instead of resigning to singing praises on who this powerful person is. It becomes truly engaging, even clever as a film that dissects a man who is gifted and unmatched at negotiation and talking but ultimately is still acknowledged as deeply problematic. Other than that, the performances here really do a lot of heavy-lifting as well. Rosales makes a full meal of the material, really exuding effortless and entertaining charm. Confiado controls the screen whenever he appears. Ultimately, this is simply a delight to watch through and through. Which is pretty astounding for a film that is essentially just about a bunch of politicians bickering. Hey, tale as old as time.",2025-10-15,13,0,watch,True
cussyssuc,8,cong tv tuta ng mga tuta,2025-10-15,1,0,watch,False
christian_davao,8,"Quezon (Jerrold Tarog, 2025) culminates the Bayani Trilogy that started with Heneral Luna and Goyo: Ang Batang Heneral. The trilogy examines three historical (and controversial) figures who helped in fleshing out our concept of a nation under tyrannical colonial rule. In this film, Manuel L. Quezon comes alive as a fierce politician who would stop at nothing to fulfill his ambition which is not to serve but to lead. He destroyed reputations and livelihoods of opponents and critics and possible nurtured the budding seeds of patronage politics which is still practiced contemporaneously. He loved the limelight (at some point, even literally), thrived in public attention, and treated the people in his circle depending on how useful they would be for his advancement. Public service is immaterial as long as benefits come pouring in.Jericho Rosales played Quezon with such aplomb and vigor that you couldn't help but be irritated at his antics. He is good. I had initial reservations when he was cast but I realized he was a good fit and he played the role well. He owns the screen every time he is on which could be reminiscent of how the real Quezon chews the scenery whenever he could. The film is a good reminder of how devious politicians could be and how easily can we be blinded by adoration even if we should have known better. If anything, this film posits that politicians come and go but our country remains and therefore, our faith should be placed on people who would serve it the best. Rating: 4/5",2025-10-15,1,0,watch,False
naaureen,10,I LOVE IT,2025-10-15,1,0,watch,True
jansol,8,"The finale (or is it?) to Jerrold Tarog’s ongoing thesis on what it means to be a national hero cleverly frames the retelling of the titular character’s life as a film within a film, one that’s purposefully laden with creative license and narrative freedom — blending truth and fiction to get its themes across (or, depending on your politics, to serve as propaganda or a fluff piece). It’s fitting, then, that the final confrontation between the real-life character and the fictional surrogate who’s been our audience stand-in since the start of this interconnected project takes place inside a movie theater — the very medium through which myths are made.The film — and its film-within-the-film (yes, it gets that meta) — traces Quezon’s journey from his beginnings as part of the revolutionary army, to his days as a lawyer of the people, to his rise from local town governor to the first president of an autonomous Philippine government, free from direct foreign control. Each retelling presents not so much the man himself, but how he wanted to be remembered: as a patriot, a reformist, a visionary — or perhaps just a man intoxicated by the idea of power.We see a Quezon who thirsts not only for independence but also for control — and at times, for affairs and questionable advances — justifying the bending of truths and the moral grayness of politics as necessary evils to “effect real change.” He preaches independence to a populace not yet aware of what it truly means, wielding the idea as a political tool. Even when confronted by findings that autonomy may have come too soon — that corruption and cronyism were inevitable — he presses on, clinging to power in the name of progress.The production design is remarkable, a clear step up in scale and ambition — grand, intricate, and indicative of a much higher budget. Tarog’s decision to divide the film into cinematic “chapters” gives it an epic sweep, though it also makes the storytelling feel jumpy at times, leaving certain emotional and narrative threads unresolved. The script leans a bit too heavily on exposition, and the occasional bursts of humor sometimes undercut the otherwise serious tone.Still, Quezon (2025) succeeds where it matters most: in driving home its central theme — that our so-called national heroes, for all their grandeur and idealism, were also deeply flawed, morally ambiguous men shaped by ambition and compromise. It leaves us with a haunting question that lingers long after the credits roll:Are our political leaders — past and present — truly heroes, or simply the kind of villains we’ve learned to celebrate?",2025-10-15,1,0,watch,False
andreifab,7,"Script was too preachy, didactic, and Araling Panlipunan coded. Gwapo ni Jericho.",2025-10-15,1,0,watch,False
edzelr,8,"Quezon closes the Bayaniverse trilogy with a dark third act leaving the viewers to ponder the lessons of history and how the game of politics is being played, realizing that the pursuit of power can corrupt and victimizes everyone. The mini Quezon campaign movie was a stroke of genius, and becomes a distinct factor deviating from the first two films (Luna and Goyo). Jericho Rosales, Mon Confiado, Iain Glen and the whole cast deliver remarkable performances. Congrats to TBA studios and director Jerrold Tarrog for concluding this trilogy.",2025-10-15,2,0,watch,False
reign_db,9,sumikat na si susan.,2025-10-15,3,0,watch,True
porthwenny_,9,lakas talaga ni CongTV 'no matagal na pala 'to malala pumili ng susuportahan hahaha,2025-10-15,113,1,watch,True
arcstella,8,kaya ka nasa bente pesos lang na barya e,2025-10-15,368,2,watch,False
kaxiana,7,Aglipay as President! Chz,2025-10-15,1,0,watch,False
missyel,4,"walang nagbago, noon mula kay Manuel Luis Quezon hanggang kay Rodrigo Duterte at Bong-Bong Marcos.ang Pilipinas ay parang isang laro lamang, at ang Pilipino ay uto-uto padin sa mga taong ganid sa kapangyarihan. nakakalungkot at nakakasuka tayo.",2025-10-15,67,0,watch,True
bojacksnowman,6,5 stars sana kaso nakita ko pagmumukha ni cong tv,2025-10-15,167,1,watch,True
solstjce,9,"TULDOK NANAY!!!! KUMAIN AT WALANG TIRA-TIRA! NAGSILBI, PUMASLANG!",2025-10-15,12,0,watch,True
