username,rating,review_text,date,likes,comments,viewing_type,user_liked
ianne_elle,9,"Plot: ⭐⭐⭐⭐⭐Acting: ⭐⭐⭐⭐⭐Cinematography: ⭐⭐⭐⭐From Game of Thrones to the game of politics. Hay, the Philippines was doomed from the start.But I love how these series humanizes our so-called “heroes”. It encapsulate how the people on our money are merely just like us. They are not really heroes, just a human, a flawed human, who was only either put into a pedestal by their fellow countrymen or by themselves or both.Looking back into history, parang walang pinagbago ang sitwasyon ng pulitika. Paulit-ulit lang ang mga trapo. Iba-iba lang ng mukha. Kawawa pa rin ang mga Pilipino.Anyway, will surely watch the next installment. Sana sa susunod na pelikula, may pag-asa na ang Pilipinas.",2025-10-20,0,0,rewatch,False
boop123,7,this is one of those films where i have to rewatch it for me to truly appreciate and cinematography and message dkjskks,2025-10-20,0,0,watch,False
rainyclear,8,"Can’t unsee how Quezon (as portrayed by Jericho Rosales) acts and speaks like Chiz Escudero. Quite fitting, since he helped create the blueprint for the politicians (NOT PUBLIC SERVANTS) we have today.",2025-10-20,3,1,watch,False
jeymsronn,8,"bruhh, the guy didn’t serve the system, he seduced it. every move drips with manipulation, wit, and that intoxicating swagger only a fcking true political animal could pull off",2025-10-19,0,0,watch,False
jennaurr,8,"""kadiliman vs kasamaan"" blueprint",2025-10-18,0,0,watch,True
lorenzsioson,,"Simula ngayon di ko na lalagyan stars ang Filipino films.That said, napagod ako sa film na to.",2025-10-20,0,0,watch,False
wreckitralf,9,"Hanggang ngayon, wala pag rin pinagbago ang mga politiko natin sa Pilipinas. Puro kapangyarihan at hindi pagseserbisyo sa bayan yung prioridad nila. Ang daming tema na sobrang naangkop pa rin sa mga nangyayari sa ating gobyerno dito sa ating bansa.",2025-10-19,1,0,watch,True
mariizpepito,8,ibang klase ka talaga tarog!!,2025-10-20,0,0,watch,False
gaaaand,7,"The time jumping could have been better done and the pacing was inconsistent, but mostly slow. A bit too neat and simplified in the theming and storytelling with obvious goal to tie into the ending. Could have developed more naturally. Jericho Rosales was great!",2025-10-20,0,0,watch,False
lasperlorean,7,"Quezon isn’t perfect, but it’s a meaningful addition to Filipino cinema’s take on its heroes. It’ll appeal most to viewers who like their history w/ nuance & aren’t looking for a straightforward hero-story.It doesn’t shy away from showing Quezon’s contradictions: idealism vs self-interest, leadership vs authoritarian streaks. The film invites reflection rather than worship.Heneral Luna started the fire. Goyo showed the cost. Quezon’s the anti hero master stroke that perfectly wraps up the Bayaniverse trilogy. One small gripe: Iain Glen does his best as Leonard Wood, but the accent keeps playing hide & seek w/ the dialogue. He’s commanding, sure, but his Scottish accent slips through just enough to break the illusion. For a film committed to period accuracy, it’s funny how the one thing they didn’t localize was his vowels. Maybe next time, just cast an American & spare Glen the vocal gymnastics.",2025-10-19,19,0,watch,False
meltedkids,8,.,2025-10-20,0,0,watch,True
joshuaadriann_,6,"ika nga ni joven, wala namang masama sa kompromiso, ngunit para kanino? while the film strives to capture the weight and moral complexity of quezon’s leadership, it lacks the firm historical backbone needed to fully ground its narrative. i wished the film had delved deeper into the implications of the american occupation and quezon’s nuanced role within it. jericho rosales really sounded like a politician who takes on charisma and commanding presence to gain people's trust. well, mon confiado is mon confiado. tsaka, di na kailangan yung part ni cong.nevertheless, films like this will always remain vital. they invite us to analyze and confront historical narratives being presented to us. in an era when political figures are often portrayed as heroes of their time, this film serves as a reminder of our responsibility to discern whether their legacies truly served the people’s best interests.",2025-10-15,0,0,watch,False
areatic,10,"Incredible showcase of Quezon’s political mastery. (At some point, I thought this was a love story between him and Osmeña…)",2025-10-15,0,0,watch,False
noid3d,7,"in another life, quezon and osmeña would've loved passing bills and laws together 🥺",2025-10-20,0,0,watch,True
dyawong,8,"Solid 3.8 movie, politics engk 👎",2025-10-20,0,0,watch,True
dc_matts,9,Punyeta,2025-10-15,0,0,watch,False
kuyaed,7,"I have nitpicks with this that I don’t know if it’s a good thing or a bad thing:1. The execution of this was disorienting at first. Because all of a sudden it was theatrical, vaudeville, and full-on period. But when the plot thickens, it suddenly makes sense — On how the politics at the time (let’s face it, until today), is just one big show and performance at stake of actual lives.2. The timejumps was a bit confusing at first. When it jumped from film to life and back out again with no immediately understandable visual cues, it was snapping me out of the world. But again, when the plot thickens, you kinda get the point. This may be my personal issue, but it took me sometime to get to that point.And my most major thing with this:I BOTH LOVE AND HATE, I AM BOTH AMAZED AND DISAPPOINTED, ALL AT THE SAME TIME - On how this reflects to until today. This was basically the birth of a trapo. It says so in the film that this was the game of politics, showcased at large on how it was played, and how it evolved into the game of today. What I hate most is that the main messaging of political idolatry is still a rampant and relevant message that still needs to be relayed to today. And mind you, this was more or less than 80 years ago. How far we’ve gotten yet how slow our progress be.Also, I watched this one alone. And I kinda regret that, which is a RARE reaction I get from watching a film (because I love watching films alone). But this is a discussion me and my friends had before that we may dive deeper into after this film: “Was the Philippines premature to be independent before? Should we have taken more time to be colonized?”. No ill-intent in that question, it is purely a curious question. And one that was once again, sparked by this film.A thinktank, a conversation-igniter, which is how historical films should be. Especially in a country like the Philippines.",2025-10-20,0,0,watch,True
yaemiqo,7,what a good day to be a history student,2025-10-20,0,0,watch,False
seraphyne,8,FUCKING CINEMA ! i love you jericho rosales,2025-10-20,0,0,watch,False
rafiela13,6,joven punyeta bat ka ba nandito!!!,2025-10-20,0,0,watch,False
merno,8,y'all know that leaning forward in chair diagram meme?i'm so so happy to report that a mainstream philippine film was able to make me do that,2025-10-19,3,0,watch,False
cjgohcruz,10,"10 years after Heneral Luna, the Bayaniverse trilogy is finally complete — and Jerrold Tarog delivers the best one yet. Jericho Rosales, while he looks nothing like Quezon, disappears into the character's cunning and charm. We need more films that, rather than glorify and lionize our heroes, instead provoke questions about why our country is the way it is.",2025-10-18,0,0,watch,True
gwenverse,8,"i love film within a film ! < 3 totoo ngang iba siya sa other two bayaniverse films and ang creative ng pagkakakwento nitong Quezon. sana lang hindi siya mag pave ng way ulit sa mga politikong mukha na namang makamasa pero ang gagago naman talaga. 100/10 sa casting (except kay cong pota) lalo na ‘yung patricia mae aquilizan! i labyu polabyu din sa mga friends kong kasama ko manood, imbes na mag debriefing talagang uminom na naman ng alak ba",2025-10-20,5,0,watch,False
saisronan,8,"maraming puliko, kakaunti ang public servant performative male final boss",2025-10-20,0,0,watch,False
jayrlovesmovies,9,"""Quezon"" so great that I already have fan edit ideas set to Taylor's ""Father Figure"" (Quezon v. Aguinaldo) and Charli xcx's ""Girl, so confusing"" (Quezon v. Osmena).Definitely will re-watch this again. Please go see this in cinemas. Don't wait for this to be streaming.",2025-10-19,0,0,watch,True
j0hnnyjpeg,5,*Ang Alamat ng Bente Pesos,2025-10-20,0,0,watch,False
daangbakal,6,quezon (and the movie) struggles to find (it)himself. and aglipay with the partido komunista shouldve won that election.,2025-10-21,0,0,watch,False
luevelt,9,“Serging my frienddd”,2025-10-21,0,0,watch,True
minionatic,9,Fire,2025-10-20,0,0,watch,False
attytwish,8,pogi lol,2025-10-18,0,0,watch,False
andidawis,10,"pardon me. are you aaron burr, sir?",2025-10-18,0,0,watch,True
jamilc,7,three statesmen experience erotic tension,2025-10-21,0,0,watch,False
pixelatedv,10,"an illuminating way to end the trilogy!!!from luna and goyo challenging/questioning the very idea of a hero, the idea now hangs over the viewers with the cunning quezon like a full teacher-student-application cycle. they truly couldnt have problematized a character more positioned inconspicuously than quezon because he’s a walking contradiction of the nationalista party. the party name itself lends him the suspicion, honestly (and as it should be for everyone in a political party). but it’s really his pork barrel, patronage, and gross abuse of power all the more delayed ph independence.i loved studying quezon (admittedly more than rizal) back then and i love now that the film enjoys a layer of experimentation and harkens back to current events. again, quezon was the perfect final man for the trilogy because we see the semblances of his political manipulation and we still feel the context of colonial forces’ strong hold upon us, it’s just wildly more discreet. the film was a transgression in both content and form, which is strikingly reflexive of how history (insofar as it’s PH history involved) ebbs and flows.it’s truly a must watch and i hope this becomes more accessible for Filipinos nationwide.",2025-10-20,1,0,watch,False
latertoletter,9,I love the chess integration very much. That's very smart.,2025-10-20,0,0,watch,False
gastronemius,7,"alexa, what's performative in tagalog?",2025-10-21,0,0,watch,False
selaera_star,9,"Kung ang pulitika ay isang laro ng mga opisyal, bakit ang mga mamamayan ang madalas natatalo?Marami akong gustong sabihin tungkol sa Quezon ni direk Jerrold Tarog pero siguro pagpo-pokusan ko nalang ang matalinong pagkakasulat at paggamit ng mga laro sa pelikulang ito. Ang pinaka obvious ay ang Chess, kung saan ang naglalaban ay ang panig ni Quezon para sa puti, at si Osmeña naman ang sa itim. Isa sa mga paborito kong scene yung nasa isang malaking kwarto sila at tila naglalaro ng Chess para masukat kung sino ba ang mas ma-impluwensiya sa kanila. Sa huli, na checkmate si Osmeña. Talo siya.Pangalawa naman ay ang tila paglalaro nila ng Snakes and Ladders. Maraming scene ang nagaakyat-baba ang mga karakter sa hagdan, madalas ay kapag nabibigo silang makuha ang nais nila, galit silang bumababa, parang natuklaw ng ahas— tingin nila, ipinagkanulo sila ng panahon o ng mga kasamahan. Lahat gustong umakyat ng hagdan, lahat gustong manalo.Huli ang poker. Kanya-kanyang laro ng kani-kanilang mga baraha. Kung sino ang may mas maaalam na baho ng kalaban, siya ang panalo. Sa scene kung saan nagtatalumpati ang mga kandidato, para silang nagpo-poker. Panalo ang kung sinumang may hawak ng pinakamagandang baraha. O hindi kaya, kung sino ang pinakamarunong mang-bluff. Sa huli, kahit hawak ni Miong ang isang magandang alas, pinili niyang hindi ito gamitin. Fold.Sa paglalaro nila ng pulitika, tagasubaybay tayo tulad ni Joven. Mahirap tantsahin kung kanino tayo papanig. Sila-sila rin lang naman ang naglalaro. Hanggang ngayon, tau-tauhan lamang tayo sa bulok na laro ng pulitika. Walang tunay na demokrasya. Ano nga ba ang independensiya? Masarap ba itong kainin?",2025-10-21,9,1,watch,False
carldegs,10,"Wishing for more political dramas as good as this. Also, will use ""Hindi ako kulangot, wag mo akong binibilog"" more often hahaha",2025-10-21,0,0,watch,True
ariishay,8,"banal-banalan kang burat ka!an amazing execution of the story of manuel quezon [casey!], which i appreciated a lot as someone who just freshly took kas 1 and had multiple encounters with the jones law. of course not everything in the movie may be historically accurate, but the artistic touch makes it more digestible by an audience not as familiar with this point of history. although there were lines or executions that seem questionable or out of place, the bigger picture was reallyy commendable.what i like about the film is the morally grey depiction of quezon’s character—no excessive glazing and praising, but also not framing him as an enemy or villain. it leaves you a looot of questions regarding his priorities, morals, and ethics. it was also interesting how they framed aguinaldo’s character—as someone who has always been an aguinaldo despiser lol.cinematically, the shots were beautiful and i love that. it was really well executed and visually pleasing.",2025-10-21,1,0,rewatch,False
stickerunhappy,7,wala man lang pinagkaiba sa mga nangyayari ngayon hdhshahhaahhahahaha,2025-10-21,0,0,watch,False
sylviene,7,"#quesergio would have the wildest ao3 fanfic i swear. tags: bdsm, rivals to lover, alpha omega, male pregnancy, politics kidding aside ! ang ganda ng quezon ! sobrang namangha ako sa storytelling. epektibo ang paraan ng paglalahad ng mensahe at istorya. maraming karakter ang naging instrumento para maipahayag ang napapanahong tema ng pelikula. sila joven, nadia, etc ang kumakatawan sa kabataan at media at ipinakita dito kung gaano makapangyarihan ang media, sa mabuti man o masamang paraan, sa pagpapalaganap ng impormasyon sa madla. isang bagay na tumatak sa akin: hindi alam ng mga pilipino noon ang tunay na kahulugan ng kalayaan. ang takeaway ko dito ay freedom itself is the teacher. para banggg “hindi pa lubos alam ng mga pilipino ang kahulugan ng kalayaan, pero paano natin malalaman kung hindi natin sila bibigyan ng pagkakataon maranasan ito?” gets ba? sana GETSmet mon confiado and benjamin alvez after watching and super bait nila! nagdate kami after watch quezon guys!",2025-10-21,0,0,watch,True
tenshi_wen,10,"This is such a powerful film to be shown in our current time. The potryal of the way politics worked in the past is an almost complete reflection to the present. I love the fact that Quezon isn't shown as a protagonist that you wanted to cheer for all through out. It captures the very idea of politics itself, its not black or white, it is a game in which in order to get what you want, you have to do some underhanded tactics. Quezon himself knew how to play the game. Lets talk about, Aguinaldo next, in this film he is tired and beaten down, he was out of his depth in challenging Quezon. Aguinaldo was characterized in which a part of you will feel sympathy for him, but makes you aware that everything that led to his downfall was through his actions. Overall, the other Characters are well acted and very on the point. As a long time history nerd, I would say this is a 10/10 film.",2025-10-21,0,0,rewatch,True
s4distluv,8,na para bang sila si rhaenyra at alicent,2025-10-21,0,0,watch,True
martitinay,8,Perfect and timely end to the trilogy. love this angle. nothing has changed this whole time. i love nadia my film making queen,2025-10-21,0,0,watch,True
denlebantino,8,"On the critique that Quezon (the film) is vague in its idea of independence:That's exactly part of MLQ's politics: the wielding of power is being the origin or source of a great idea, the new republic as a goal only Cassey can achieve. That is how political campaigns are inspired. That's how devotion to political figures has taken its root. Whatever concept of freedom there is should appear like it's going to come directly from the politician. Independence being perceived as food conveys the idea that it's constantly asked, not fought for, by the masses that wait for 'ayuda' rather than the affirmation of their capacity to hold freedom in their hands. And why is 'independence' or 'new republic' mentioned in the film like a byword? It's because Quezon wears it like a badge. But it serves a more important purpose: It floats as a concept that's never really understood. It remains to be a hollow idea associated with patriotism. So it continues to be talked about because it's never truly experienced. Valid pa rin ang tanong na ""What is a new republic?"" hanggang ngayon. So it's odd to expect the film to define independence for us when what it does is actually more essential.We define it. I trust that we know how to.",2025-10-21,1,0,rewatch,True
upcinema,,"Sabi ni Cinemaster Nadz Amata:Simply an amazing film to end Tarog’s Bayani Trilogy. Quezon harnessed the strengths of its predecessors Heneral Luna and Goyo, producing a film with strong storytelling, great actors, and awesome cinematography. Although he did not physically look like the mestizo Casey, Jericho Rosales delivered an enigmatic performance well-deserving of acting awards. But among its merits, perhaps my favorite thing about Quezon is its pointed delivery of political critique not only towards the current administration but to the long history of corrupted, patronizing, and self-serving Philippine politics.I know for sure that it is not only me who feared that Quezon would end up sanitizing the former president’s image, as films about politicians and heroes tended to do so. But alas, Quezon was not usual biopic that mythologized the man — instead, it demystified him, reintroducing the former President that plastered his and his wife’s name all over his home province and the biggest city in Metro Manila. It was able to effectively deliver Manuel Luis Quezon as the cunning politician, borderline dictator that he is.Alongside his intelligent spiels and populist rhetoric, the film revealed the unapologetic and manipulative character of the 2nd President of the Philippine Republic — the man who laid the formula of political maneuvering for the politicians and would-be presidents after him, proving Alfred McCoy’s view that Quezon’s Commonwealth paved the way for Philippine authoritarianism.I do hope that Tarog continues to develop new historical fiction films in the future. More than ever, we need more films that tackle and communicate our history in interesting ways that provoke the audience to revisit our past and reexamine our stances on our ‘great’ men.",2025-10-21,4,0,watch,False
ahd_movie,8,Quezon is just a mean girl really,2025-10-21,0,0,watch,True
dimmufy,8,"ugh, Jorah Mormont. why are you evil. and echo is so gorgeous omg 😭😭 we also got political yaoi its crazy!! like okay serging and manolo!!",2025-10-21,0,0,watch,False
flameohotman,7,i was so immersed tas boom nakita ko si congtv pota bahahahahha,2025-10-20,1,0,watch,False
aleilina,8,"news flash, quezon was the BLUEPRINT on how to be a TRAPO. fueled by remorseless charisma, endless antics, and 'utang na loob' schemes that never seemed to run out. traditional politics in the country has been forcely ingrained within our culture where filipinos greatly suffered from the power-hungry politicians, presenting it as a fight for independence. what i didn't like about the film is how they didn't emphasize the role americans played, and somewhat leaned towards blaming our own demise to the filipinos itself. but i believe, to put it quite plainly, we have never been truly free from the colonialism. however, as my sister would say, ""take it with a grain of salt"", because even if it is grounded by history, it is still a work of fiction at malaking bahagi pa rin ang artistic values ng direktor at lahat ng naging parte sa pag buo nito.",2025-10-21,1,0,watch,True
soundfables,10,Pumunta ka lang.,2025-10-21,0,0,watch,False
cloudsin_thesky,8,quezmeña is the new mabinaldo i fear,2025-10-19,0,0,rewatch,True
iscbelles,8,"alaws talaga mga pre gaguhan lang talaga pulitiko sa pilipinas simulang-simula pa lang <3 wala namang nagbabago pa <3jerrold tarog you never miss. i really like the direction for this one!! i love that they leaned so much into the theatrics given the time period quezon was in, the vaudeville and old hollywood influences were on full display + rody vera on the screenplay says so much. i had my doubts about jericho at first but i’m glad he proved me wrong and i enjoyed his take on all the powerplays and social games that quezon did in his lifetime.kinda wanna do a rewatch of heneral luna and goyo now + watch this again to see how it all comes together and do a comparison on each film’s visual and narrative style. buhay pa si rusca!!! 🥹 anyway, very excited to see what’s next on jerrold tarrog’s docket 👀 may pa-teaser sa credits yan shea.",2025-10-21,0,0,watch,True
wenkwonkdinky,8,"an anti-bayani film if ever there was one. some nitpicks about the artistic choices made, but the non-linear storytelling was definitely the best choice as it kept me on my toes with connecting all the dots towards Quezon's rise to presidency (and fall from grace).definitely needs a rewatch, dahil crush na crush ko si nadia hernando 😍",2025-10-21,0,0,watch,True
chssbord,9,quezon and sergio shouldve kissed ngl,2025-10-21,0,0,watch,False
talaalat20,8,"felt like my araling panlipunan grade 6 lessons <3 sarap panuorin, sobrang gagaling ng lahat!!!!! mabuhay ang pelikulang pilipino 🤩",2025-10-21,0,0,watch,True
d1sc0rdk1tt3n,10,i’m shaking in my cinema seat as i write this. oh my goodness my life is changed.,2025-10-21,0,0,watch,True
jobkyan,7,maganda,2025-10-21,0,0,watch,False
maalab,10,holy shit guys,2025-10-21,0,0,watch,True
akuoi,7,jericho rosales 🤤❤️,2025-10-21,0,0,watch,False
raffyduffy,8,"Another great interpretation of MLQ’s political life. It has a jumpy storyline, jumping from different timelines in Quezon’s life. Imo it’s not up to par with its prior bayaniverse movies (Heneral Luna goat), but the cinematography, theatrics, and plot delivery are surely Jerrold Tarog’s forte. The acting is also soooo good, Jericho nailed that accent",2025-10-21,0,0,watch,True
joyceyyjoyce,8,Hindi na ata talaga bago ang ang pagiging ganid sa kapangyarihan at pagiging kurakot ng mga pulitiko sa Pilipinas. Ika nga ay one politician after another — and nothing has changed.,2025-10-21,0,0,watch,False
thanatosfiel,10,"What a way to close out the Bayaniverse trilogy. From the ultraviolent chaos of Heneral Luna, to the somber introspection of Goyo, Quezon rounds things off as a psychological thriller-slash-political comedy-slash-drama that’s as ambitious as it is sharp.What I’ve always admired about Jerrold Tarog’s depiction of these historical figures is how human they are. There are no pure heroes here—only flawed men navigating ambition, ego, and nationhood. Quezon, played brilliantly by Jericho Rosales, is a political gamemaster: part statesman, part showman, and wholly cunning. I love that the film doesn’t dwell on textbook achievements, but rather on the intricate dance of manipulation, charm, and power that defined his leadership.Like the best Filipino historical films of recent memory, Quezon reflects its own era back at us—the politics of then echoing the politics of now, for better or worse.And while it’s billed as the end of the Bayaniverse, I hope this isn’t an exclamation point, but a comma—especially after that tantalizing post-credits tease.",2025-10-21,0,0,watch,True
mityardbirds,8,"Here we begin with a shapeshifting exploiter on one hand and a docile, equally ambitious prowler on the other, juggled and brandished to trade barbs and heave vitriol at each other, both would later dismiss as mere politics to justify a much-needed partnership, then finding a common enemy in a chagrined former revolutionary leader and president. The ping-pong exchange of politicking and smear campaigns is its most coruscating part—electrifying to me, actually—a protracted look at our current politics' saddening origin. Quezon—now that there is no need for battle pieces, as that is not Tarog's turf—is the most polished in the entire trilogy, only slightly tarnished by its caricature bits and overreliance on fictional characters. The decision to minimize young Joven's speaking lines saves the entire cast's immaculate efforts from futility.",2025-10-21,0,0,watch,False
lengsungit,10,taena the toxic old man yaoi is strong in this one 😭 nanginig ako no'ng binanggit ni miong si pule...my mabinaldo 😭,2025-10-19,0,0,watch,True
saddleboy,8,"with the state of how things are, maybe heaven run by americans doesn't sound too bad",2025-10-18,0,0,watch,False
turtleduckies,8,quezon at every minor inconvenience: magreresign ako!watched this for grade 9 me who was obsessed with joven & hyperfixated with the bayaniverse,2025-10-21,2,0,watch,False
velvetxt,9,"Ang galing talaga, hanggang ngayon ang kurapsyon ay may kaugnayan sa sistema natin ngayon lalo na sa klima ng ating politiko",2025-10-21,0,0,watch,True
tangerine_c,10,"bro really started the ""businessman"" way of politics.",2025-10-21,0,0,watch,False
lucciaa,,not the emilio aguinaldo victim card,2025-10-21,1,0,watch,False
skillex25,10,Another great film of the bayaniverse. Be sure to wait for the end credit scenes. Can't wait for the next installment.DI KO NI EXPECT CAMEO APPERANCE NI KABAYAN CONG TV HAAHAHAHAHA,2025-10-18,0,0,watch,True
iahkin,,I like it when films don’t take itself too seriously but this one did not take itself seriously at all,2025-10-21,0,0,watch,False
lunisimone,8,gusto ko makakita ng snow,2025-10-21,0,0,watch,True
wrongsquare,8,Film so good it made me sympathetic to Aguinaldo.,2025-10-21,1,0,watch,True
