username,rating,review_text,date,likes,comments,viewing_type,user_liked
cheskaimbuido,8,"pangalan lamang ng nakaupo ang naiba, pero ang korapsyon, maling paggamit ng kapangyarihan, at pagiging sunud-sunuran sa dayuhan ay nandyan pa rin.ang husay ni jericho rosales! kuhang kuha ang istilo ni Quezon. pati na rin si romnick sarmienta, at syempre mon confiado. ang galing galing.sana sa pagtatapos ng bayaniverse trilogy, ay maging bukas naman sa paghahayad ng kwento ng ibang mga bayani. (sana may kababaihan din!)",2025-10-18,0,0,watch,False
joevic,5,excited for the rest of the bayani-verse!!! kudos to the team ganda ng production ng pelikula,2025-10-19,0,0,watch,False
faelvr,9,"being a hero is all about perspective.i greatly enjoyed this film. hence, here are my footnotes:negatives:1. the ""eh yung ____"" ""sa susunod po"" sequencing became overly repetitive.2. wdym third and final installment??? DAGDAGAN. charpositives:1. the first thing i noticed was the characterization of quezon. i applaud the great effort and commitment it took to get the accent, speaking voice, and mannerisms in line. jericho rosales did a fantastic job. i think it's about time to give filipino actors a chance. 2. i appreciate the stance of joven in this movie. his character embodied what it meant to only see one side, to only want to see one side. it highlighted the importance of understanding bias and what it truly means to be a citizen—to weigh both sides and to pick the lesser evil.3. oh emilio aguinaldo you morally grey silly goose. i think the switch of aguinaldo's characterization here greatly emphasizes that things are not black and white. things are not simply good and bad, evil and pure. human as we are, our actions are multiple colors. aguinaldo is an example of that. i want to praise mon confiado for being exemplary. it takes incredible skill to have his character be hated on the first two movies, and be pitied in the next. bravo.4. great cinematography, music, and pacing. i love the use of colors and songs. also great use of creative and artistic freedom.5. what great mirroring. these series of events happened decades ago, yet still apply to our current politics. why do we never learn? why do we allow ourselves to keep being played over and over again? remember: politics is a game to the wealthy, but the lives of the poor. my god, wake up!6. fund the paper. fund the films. fund the art. i so so appreciate the film emphasizing the importance of art and how it can directly influence people's views and opinions about certain topics, nuances, and even people. art is the driving force. art is just as important. and in this modern world where we see art as less, let us be reminded that the beauty of art is the power of human race.history is important. we must continue to learn our past so that we are able to unlearn and re-learn.history is not just the past but the guide to our future.'wag na tayong pauulit-ulit. the present is also the history. today will be yesterday. kaya, now's the time to write the narrative that the future will live. ika nga nila, history repeats itself, diba? mamulat, makibahagi, makiboses!",2025-10-19,7,1,watch,True
filmcirclerjct,8,"A decade ago, Jerrold Tarog asked the Filipino audience what it really meant to be a hero. With his Bayaniverse, he aimed to deconstruct the heroes that we've come to know during our history lessons as kids. In Heneral Luna (2015), he showed us the fiery and passionate patriotism that is willing to do anything to protect our freedom. It introduces the idea of mythmaking, as it positions the entire Philippine–American War into the hands of its protagonist, and by killing off the only person who could have led us to victory, the government simply proved that our biggest enemy was not the Americans but our own Filipino countrymen—ourselves.Goyo: Ang Batang Heneral (2018) breaks this down further, showing us that the hero we glorified all this time was nothing more than a blind fanatic who died a futile death out of his arrogance and lack of experience—all this time, all he had to offer was this confidence and loyalty to his president, and nothing more. Then came 2025's Quezon. As he states in the film:""Ang pagkabayani—it's all about perception"" (Being a hero—it's all about perception).Becoming the hero means you get to decide whose story gets to be told and how it is told.In this third and final installment of Tarog's Bayaniverse, we follow the life of Manuel L. Quezon (Jericho Rosales), who would go on and become the first Filipino elected to head a government of the entire Philippines after 34 years of being governed by American governor generals. All throughout the film, we see him in different stages of his life through different chapters, depicting how he manipulates his way from the bottom to the top, including his conflicted relationships with Sergio Osmeña (Romnick Sarmenta), governor-general Leonard Wood (Iain Glen), and even his former president, Emilio F. Aguinaldo (Mon Confiado).Penned by Tarog and Rody Vera, this concluding chapter of the Bayaniverse trilogy is a fun, engaging, yet biting and farcical take on its titular character's meteoric rise and eventual downfall. Intending to portray the historical figures in the film series often regarded as national heroes as ""flawed characters,"" the film, while showing the achievements they accomplished, also shows their cunning and manipulative tactics to get where they wanted to be.The best comparison I could come up with for Quezon is Orson Welles' 1941 film, Citizen Kane, which also features the rise and fall of its main protagonist (Quezon even opens with a series of silent films, similar to how Citizen Kane introduces its main character through a series of newsreels). It's structured similarly too, told in a nonlinear narrative. Unlike Heneral Luna and Goyo, Quezon is divided into several chapters, with each of these beginning with Quezon headbutting with someone to achieve his goal, highlighting how he played many political games to secure his survival and to maintain his power. Another departure for the film is its setting—while the first two films are set during the Philippine-American War, this latest film explores the period of American political supervision that followed, eventually leading to the founding of the Philippine Commonwealth. It doesn't have the big battle scenes of his first two predecessors and instead focuses on the war they fought within their offices and desks. Unlike its predecessor, whose battles occur in sweeping landscapes and terrains complete with all the explosions and gunfights, Quezon is mostly confined in enclosed spaces and is more dialogue-driven.It's also the most visually imaginative film in the trilogy, as it incorporates a series of silent films to create the myth behind Quezon's heroism. The film creates different tones to emphasize the varying timeline and mood for several sequences: black-and-white color grading for the silent film sequences, a vintage palette look to depict the time of the young Quezon (played by Benjamin Alves), realistic and vibrant three-strip Technicolor for the old Quezon, and a dull and dreary tone for Aguinaldo. This also highlights the difference between the way the public embraced Quezon and Aguinaldo's candidacy—one with color and life, while the other was marred by the death of Andres Bonifacio and Heneral Luna. The film's production design managed to stay true to its milieu too, beautifully captured on camera by Pong Ignacio, who returns from the last two films.Most importantly, the film depicts the evolution of two of the trilogy's most important characters: Joven Hernando and Emilio Aguinaldo. In the film, Joven is played by Arron Villaflor as the young version, while Cris Villanueva is the older one. Unlike in the first two films, where he is depicted as merely an observer for the two titular heroes, here in the third film, he becomes an active participant in the story. However, he is no longer the reliable narrator that he once was, as we realize that he himself has turned a blind eye to Quezon's flaws as an individual and as a politician. On the other hand, the film looks at Aguinaldo with a gentler and softer view, portraying him as this weakened veteran who tries to fight against the giant that Quezon eventually turns out to be in the film, falling victim to his propaganda.And this is where the film's strength lies: with its powerful cast. Mon Confiado delivers a more nuanced turn here as the veteran Emilio Aguinaldo, perfectly complemented by an equally restrained yet compelling performance from Angeli Bayani playing his wife, Maria Agoncillo-Aguinaldo. Arron Villaflor is brilliant as always portraying Joven Hernando, but Cris Villanueva adds another layer of depth to his character. Benjamin Alves also has an interesting part in the film, as he portrays the young Manuel Quezon but also as the actor portraying Quezon within the silent film world, existing on two separate planes and blurring the lines between fiction and reality and between the revised history and actual memory. Of course, Scottish actor Iain Glen deserves a special shoutout for his portrayal of Governor-General Leonard Wood. Karylle also deserves some praise for her understated yet exquisite performance as Aurora Quezon. Romnick Sarmenta also impresses as Sergio Osmeña. But the one who really carries the film from start to finish is none other than Jericho Rosales, with his committed performance as the titular Quezon. Honestly, I was expecting Manuel L. Quezon to have a somewhat full and deep voice, but when I saw the videos of his actual speeches, Rosales nailed his pitch and tone. It's fun to see Rosales as Quezon manipulates his way through politics using one trick after another. He dazzles with his stirring and dedicated turn as the late president, warts and all.Rosales perfectly captures the cunning nature of his character—a two-faced Janus head who uses deception and whispers sweet nothings to charm and manipulate everyone around him like chess pieces. With Quezon, Tarog delivers his ultimate thesis statement: that heroism isn't black or white. We have to understand the grey areas in between. The heroes depicted in his trilogy did a lot of good things that led them to be celebrated as the heroes they are known as now. But like any other human being, they also did some pretty bad things—and Quezon, sadly, did a lot. He inadvertently paved the way for patronage politics, or the spoils system, to take over our government—one that is still prevalent today. His intentions started out as noble—he wants to give the Philippines the independence it has sought after for so many years. But along the way, he realizes that he has to play by the rules, bend some promises, and ultimately lie for what he believes is good for the country. Sadly, the things that he did led him to crave and hold on to his power for as long as he could.Later, Quezon exclaims:""I am the Filipino people. I am the Philippines."" He spent the entire film creating this image of him as the only person who could bring independence to this country—by hook or by crook. But as we see his final image in the film, we all come to the very conclusion that Quezon is nothing but a megalomaniac. He is not the savior he thinks he is. He is but a man.Flawed. Fallible. Mortal.",2025-10-18,2,0,watch,True
migsser,9,"I always had a keen interest in history. I think this started with my likes to learn about what happened before and knowing all these famous people that the cartoons and shows I watched as a kid that keep on referencing, such as Thomas Jerferson, Benjamin Franklin, etc. This was further cemented by the social studies classes we had that focused on historical events of the world and the like. Philippine history was one and this led me to be more appreciative of what we went through as a nation. Naturally, this pushed me to more interested with movies that portrayed this events, even tho they weren't as accurate to what they wanted to represented *Ahem* El Presidente *Ahem* Fast forward to the release of Heneral Luna and Goyo, I was blown by how the films tried to show these people with a degree of understanding that wasn't as seen in previous historical movies portraying Heroes. Luna and Goyo made me feel angry and surprised, respectively. And now with Quezon, rarely do I get to see Philippine cinema being continued like this. One that continues to show how the past can be a reflection of what we are today, especially when it comes to politics. Its dirty, bloody and downright a game to some. I was sceptical at first with the announcement of Jericho taking the role of Quezon. All those worries faded once he got lost into this performance as the convicing, and coniving, president. Past and new characters were also introduced, adding so much to the story and how they all relate to one another. They portrayed well the friendly banters, conversations, and even betrayals. This connectedness and being one in a shared universe is amazing and works well with this film and the films before, even if each one feels different and stands on their own. The Bayaniverse feels like a proper universe and one that I wish for more Filipino films. This is a culmination of trying to define and portray heroes in ways that don't treat them to be outright heroes. No, these are people who are both perpratrators and victims of their own aspirations, dreams, agendas, laurels and even mistakes. This further pushes us to question those who led us before, and even those who lead us in the present. I'm looking forward for more films like this. And judging from the movie, I have a good feeling that there will be more!",2025-10-19,0,0,watch,True
knts,10,MAGANDA! mamaya nalang ang review >.<,2025-10-19,0,0,watch,True
ilipac,7,doomed yaoi in my filipino government?,2025-10-19,0,0,watch,True
gerigravity,8,"Hindi kasing emotionally charged ng Heneral Luna, o kasing tahimik at mapanuri ng Goyo, ngunit may sariling bigat at diin ang Quezon. Dito, ang digmaan ay wala na sa larangan ng putukan; nasa entablado na ng pulitika. At gaya ng lahat ng magagandang palabas, bawat ngiti, bawat pakikipagkamay, at bawat pangako ay may kasamang pinag-ensayuhang pananalita.Jericho Rosales delivers one of his best performances yet: charming, makinis, pero mapanganib. Bilang Manuel L. Quezon, hindi siya ipininta bilang bayani kundi bilang isang politiko na marunong maglaro ng sistema. Hindi niya winawasak ang istruktura ng katiwalian; siya mismo ang bumuo nito. Ang trapo sa katauhan ni Quezon ay isang masalimuot na larawan ng kapangyarihan. Nakakatawa siya sa kanyang karisma ngunit nakakikilabot sa likod ng ngiti, kung saan namamayani ang tuso at mapanlinlang na pag-iisip.Ang direksyon ni Jerrold Tarog ay mas pulido at teatrikal kumpara sa unang dalawang pelikula. Halata ang diin sa blocking, sa staging ng mga eksena, at sa simbolismo. Parang chess match na bawat galaw ay may kapalit. Ang cinematography ay malinis, kulay-aristokratiko, at puno ng simetrya, na tila ipinapakita kung paanong ginawang perpektong entablado ang politika. Ang musical scoring naman ay naglalaro sa pagitan ng dalamhati at panunukso, na tila tugtugin ng isang entablado kung saan ang kapangyarihan ay ginagawang palabas.Hindi ito kasing-sakit ng Heneral Luna o kasing-lalim ng Goyo, ngunit mararamdaman mo ang maruming realidad ng politika. Naroon ang mga kasinungalingang nakabalot sa magarang retorika, at kung paanong ang kalayaan ay maaaring gamitin bilang produkto ng kampanya. Dito mo makikita kung saan nagsimula ang mga siklong hindi pa rin tapos hanggang ngayon: utang na loob, padrino system, at ang walang katapusang pagbilog sa ulo ng taumbayan.Tarog closes the Bayaniverse not with a scream or a whisper but with a smirk. Isang paalala na ang ating bansa ay itinayo hindi lang sa dugo ng mga bayani kundi sa galing ng mga manlalarong marunong tumaya. Sa dulo, hindi mo alam kung matatawa ka o maiiyak, dahil ang pelikulang ito ay parehong kasaysayan at salamin: mapanlinlang, maganda, at masakit tanggapin.Hindi ito aral tungkol sa kabayanihan; ito ay babala tungkol sa kapangyarihan.Sa pagtatapos ng Quezon, tila tayo ay nanonood ng salamin na bumabalik sa ating paningin. Dito natin nakikita na ang politika ay matagal nang pagtatanghal, at ang mga aktor ay nagpapalit lang ng kasuotan. Ang palabas ay nabago na ng panahon, ngunit ang manuskrito ay ganoon pa rin.",2025-10-19,1,0,watch,False
miggyber,9,"Small kwento: We saw Mon Confiado before watching the film kasi may surprise talkback session siguro before our showtime. We asked for a photo, then ang sabi niya sa amin: “Please review the film. Bad or good, it’s okay.”I actually didn’t want to watch Quezon yet kasi gusto ko may talkback. I really wish every screening of Quezon had one. Somehow, it’s not enough that we just witnessed what happened on screen. It’s also important to have a discourse about it.I understand that would be difficult and probably impossible to do for every showing. But it's a nice to have. Jerrold and the cast spent months or even years researching these heroes, and it feels lacking if all that effort just ends in a two-hour movie. I’m sure there were stories cut short or ideas that couldn’t be fully explored. It would’ve been so nice to hear more about it directly from them.So we ended up dissecting the film among ourselves after watching. The first thing we all said was how Quezon made it so easy to understand Manuel Luis Quezon. The film is divided into chapters, and in each one, it’s clear who he’s up against and what they are fighting about. And in every chapter, he always comes out winning.Quezon is unafraid to exhaust all his resources and even resort to dirty tricks to gain the upper hand. He can come up with unorthodox ways to defeat his enemies, and sometimes, he even teams up with them to take down bigger and badder ones. Quezon is just good at what he does. But he also thinks so highly of himself as the savior of the Philippines that it eventually becomes his downfall.It’s all very interesting. Like Luna and Goyo, Quezon is deeply flawed. In our minds, he's a great president for bringing independence to the country. But we all agreed that we never really saw Quezon this way before. It’s also amazing how the old problems in the film mirror the issues we still see in Philippine politics today. Maybe even worse.I’d say Quezon is a must-watch. We had a blast watching it, and it’s even better when you get to talk about it afterward with friends or family.",2025-10-18,0,0,watch,True
ikalabingisa,10,Love you echo napatawa mo aq ng many times,2025-10-19,0,0,watch,True
julesc08,8,the history book on the shelf really DOES repeat itself,2025-10-19,0,0,watch,True
clnrnth,8,"we are slaves of our own feelings (non-verbatim).loved the storytelling. it suits the clown that manuel quezon is. also, stay for the post credit scene—presidente-verse???!! I'm seated!",2025-10-19,0,0,watch,False
itos,8,"watched in a block screening of my tito who plays nieto!!welcome to philippine politics — where everything is a game, and things can get messy. this is such a rich character study on manuel quezon, backed by a generational performance from jericho rosales. quezon really laid out the foundations of how a filipino leader is made; through the manipulation of power and by being really loud. production-wise this is a huge step up from goyo even if there aren’t any war scenes — the PD and the cinematography really leveled up, like wow. slight complaint but i think the choice to use arron villaflor in most of the flashbacks was poor, because it got kind of confusing when we’d have flashbacks with jericho rosales as the old quezon but have arron villaflor as a young joven — though it did click eventually, it could have been much smoother if they just used cris villanueva and used make-up on him to make him a bit younger. but still, a really well-done film… magsaysay movie next? 👀watched in SM Aura cinema, director’s club",2025-10-19,1,0,watch,True
sagestiles,8,"imo (as a history major) best of the trilogy, in terms of depicting the early political arena and padrino system. also, appreciated how it goes into the myth-making of quezon's persona. one of jericho rosales' best performances",2025-10-19,0,0,watch,True
carthegarden,6,kauna unahang trapo sa pinas 4 stars ko sana kaso kasali si cong tv panira ampota,2025-10-19,0,0,watch,False
mrkjsp,10,Best Philippine movie of the year? Yes?,2025-10-19,0,0,watch,False
miiixaaaa,8,not enrile watching his own memories in hd,2025-10-19,22,0,watch,False
1stkenpachi,7,wait we lowkey improved cinematography,2025-10-19,0,0,watch,True
mundane_moron,8,"The third and final film in the Bayaniverse film series, Quezon is an eye opener for every Filipino that only know Manuel L. Quezon in the history books. The film showed Quezon's true color and the tricks and machineries he used to gain political power. If history can tell, mud slinging during the election campaign season has been a part of Philippine politics since time immemorial. It is ingrained in our culture and it will never be removed.Tarog and Vera's screenplay is also impressive. The Bayaniverse is now completed and I hope this does not ends here. Tarog and TBA Studios should continue telling the Philippine history post-World War II. The Bayaniverse is a true testament that Filipinos will spend their hard-earned money in movie theaters if a local film is executed well with great storytelling and screenplay.",2025-10-19,1,0,watch,True
hongweikai,8,"Toxic bayani yaoi and they made it an entire nation's century-old problem: #QueOs;JC Santos, nasa kiffy ko ang independencia. Keep up tayo, #OsRox.[SM City North EDSA]",2025-10-19,130,0,watch,False
eveana,8,this srsly had the best cinematography and editing ever,2025-10-19,0,0,watch,True
latissimusdomsi,6,"Has a very clean TV sheen to it that I don't think matches this kind of period piece. It doesn't help that the acting's pretty uneven, which gives it more of a campy feel rather than a serious biopic. Rosales hams up his Quezon portrayal so much that the ""climactic"" turn just falls flat. It's not without its bright spots though, specifically the crafts and Mon Confiado's Aguinaldo (great continuity between the 3 Tarrog films), both of which save this movie from being an outright disappointment.",2025-10-19,1,0,watch,False
rieyadomi,,pepito my friend,2025-10-19,0,0,watch,False
1vynicole,10,“ano nanaman niluluto mo” 😭☝🏻 sergio x quezon,2025-10-19,1,0,watch,False
zoey_de_leon,10,"I love this movie because this isn't perfect.How these “heroic” figures are portrayed as flawed as they are and just paints the whole message of this Bayaniverse trilogy to look them up not as idols, but because of their principles.You will not root for Quezon because of his apparent manipulation to gain power and you will also not root for Aguinaldo because he is incompetent. You are conflicted as you should be. There are no favorites.What we have left to root for is the normal citizen, Joven, that is genuis as the film's creative liberty that represents us as filipinos and honesty which is all we need and Cris Villanueva's role for me, just blends into another great film he's in about deconstructing the strucuture for a flawed hero that is José Rizal in Bayaning 3rd World. Which is also a film that involves telling the story within a fake film within this movie.I will favor on this over the perfunctory Heneral Luna and this is up to par with another flawed character story in Goyo.",2025-10-19,1,0,watch,False
klyppans,10,"Such an amazing cinematic experience I can't even be sad about the plot. A very inspiring movie for the creatives, but very defeatist for Filipinos 🥲",2025-10-19,0,0,watch,True
