username,rating,review_text,date,likes,comments,viewing_type,user_liked
shenny,8,I cried because this is what Filipino cinema looks like when you give a talented director a sufficient budget 😭🙌,2025-10-17,0,0,watch,False
jancelscinema,8,"A perfect end to Jerrold Tarog’s Bayaniverse! I have so much say, but I can’t piece the words together—poor me. Takeaways:- challenge the narrative, ask the questions. Don’t just conform and absorb, think critically and confront the truths you believe in.- Politicians’ struggle for power and their framed political games only leave the ordinary citizens in vain. In whatever angle you look at it, the ordinary and the poor suffer the consequences.- Quezon mastered the arts of Politics—he is cunning, charismatic, skilled, and pragmatic. A political juggernaut!- whatever Quezon did, he still left a pretty impressive legacy out from his career.- I have so much to say, can’t type it all out! Aaahh. Anyway, a powerful cast and amazing production. Must watch!",2025-10-17,0,0,watch,True
lavendervanilla,10,"rip manuel quezon, you would’ve loved 48 laws of power",2025-10-17,40,0,watch,True
geumuihwanhyang,8,"trapo mula noon, hanggang ngayon",2025-10-17,2,0,watch,False
ukininam,8,"No one is a ""hero"" in this movie, all of them have their ups and downs, you can't really pick a side, which is the reality--or should be--the reality of life.",2025-10-17,0,0,watch,False
lans6969,9,"""Banal banalan kang burat ka"" - Manuel Quezon",2025-10-17,0,0,watch,True
manalojohn,8,"Quezon isn’t just another film. It’s a bridge between the raw, emotional grit of indie cinema and the accessibility of mainstream storytelling. At its core, it’s a story about a protagonist who feels more like an anti-hero. Quezon could easily fit the mold of a Marvel villain, his intentions are clear and rooted in conviction, but he’ll do whatever it takes to achieve them. It’s all about perception, really, and how morality can shift depending on where you stand. Di siya masamang tao. Pero willing siya gawin ang lahat. Para sa kanya or para sa bayan niya? On the technical side, the film shines. The use of parallelism, the sharp direction of Jerrold Tarog, and the deliberate framing from Pong’s cinematography all reflect a meticulous attention to detail. As an aspiring filmmaker and cinephile, you’ll find yourself appreciating every choice they made; nothing feels accidental.The performances are equally impressive. Every actor fully embodies their role, responding naturally to one another. There’s no unnecessary showboating, no scene-stealing, just grounded, organic acting that serves the story.Emotionally, Quezon hits hard. It’s not an easy watch, but it’s a necessary one. The film mirrors the pain and complexity of the times we live in. It feels like an origin story for where we are as a nation today.As a frustrated creative from the Philippines, this is the kind of film that makes you proud. Quezon is proof that we can create something deeply cinematic, intelligent, and emotionally resonant, something that can stand proudly on the international stage.",2025-10-17,0,0,watch,True
taeyomi,10,"1) Being in the “Bayani”-verse is kinda funny when you watch. Is this what we really consider a national hero?2) This is a historical film, so I’m expecting to revisit and just know about the things that have happened during the days I wasn’t even born, but why does the film feel so familiar as if I’ve seen this all before?3) These are the things you don’t learn in school.And I blame all these with the decision-making of Filipinos rooted from how our “leaders” led by example. Dala-dala natin ang kultura at pag-iisip na ito hanggang ngayon. Sobrang nakakalungkot. And even when presented with real change and solution, it’s still not enough for us to realize.I understand now that one review saying this film is meant to be watched in the cinemas, as it will surely give a different feel when just watched on streaming platforms. The Philippines surely is just a whole ass drama that we’re currently living in.The history repeats itself, indeed. Because we never learn.At tangina ha, araw-araw kitang nakikita sa ₱20 mula bata ako tapos ganyan ka pala ka-gago hahaha pota buti naging barya ka nalang hayup",2025-10-17,2,0,watch,True
polalengtot,7,putangina mo rin casey,2025-10-17,0,0,watch,False
n45h,8,Hanggang saan naabot ang 20 pesos mo?,2025-10-17,0,0,watch,False
hacelallyssa,10,"bilang feeling cinephile at critic on the outside, but actually likes almost all films (esp. historical, and by jerrold tarog) ang masasabi ko lang ay: luvette! 📍Rob Galle, ₱209",2025-10-17,0,0,watch,False
knickomotions,7,Great history adaptation! A refresher from what we've learned from school!,2025-10-17,0,0,watch,True
kdynbi,10,tanginamo bakla pag yan sinabi mo-_+,2025-10-17,1,0,watch,False
bezoomny,8,A good reflection of current Philippine politics but I hated how Joven's character is like the catalyst of it all at the cost of accuracy. Plus sometimes the dialogue is too on the nose that it sometimes undermines the themes just so the general audience would get it. A bit more nuance would've helped.,2025-10-17,0,0,watch,False
mrg92,8,dito ko natutunan na first ever filipino performative male pala si quezon tas pede palang gawan ng homosexual subtext ang rivalry ng quezon-osmeña tangina anlakas ng speaker ng sm north tas sobrang lakas pa ng boses ni quezon ang funny wala lang,2025-10-17,1,0,watch,True
tokenzine,8,The world’s a stage,2025-10-17,0,0,watch,True
razejee,8,The couple we failed to protect💔🌾,2025-10-17,1,0,watch,False
audriclol,8,iza calzado kinda giving florence pugh in little women with that iphone face😭🙏,2025-10-17,1,0,watch,True
caspaiiin,7,ang pogi mo i love you jericho rosales my baby,2025-10-17,0,0,watch,False
cinemalandi,4,"Great filmmaking. Great shots. Great music. Great editing. But I felt nothing. Was I supposed to conclude that corruption, manipulation and politics go together since time immemorial? Don't I know that already? Doesn't everyone? And even if I did not, if that was all that I needed to realize by film's end, that was not much. That information could have been good for a documentary to explore and analyze. This drama bored me because it was not dramatic enough. A tragic figure, who doesn't change or is pulled further into sad or wrong choices, has to be set up as someone who seems heroic or as one who is given a chance to change his ways by the middle of the film. For all its freneticism, it droned. I think it wanted to be entertaining like a Scorsese or a Chazelle, but the writing caused a pacing problem. Also wondered if anyone who did not have an idea of who Quezon was would be invested in knowing why this is important to see for any human being. I wish all this technique was used on a good screenplay.",2025-10-17,4,0,watch,False
xxyai,8,not ur typical philippine politics movie !! love how there’s no sides taken in this movie + ang pogi ni jericho rosales,2025-10-17,0,0,watch,False
seine_syen,8,The best movie of the trilogy imo. Jericho Rosales played the anti-hero Quezon so well. It stayed true to its core of reflecting the current political climate of the country whilst humanizing its known political and historical figures.,2025-10-17,0,0,watch,False
filmproflarry,,Quezon is a film. One of the films of 2025.,2025-10-17,0,0,watch,False
wishyoudaskme,6,Juan Ponce Enrile outlived all four.,2025-10-17,1,0,watch,False
cieloregs,,Galeng ni charlie sheen 😍,2025-10-17,0,1,rewatch,True
ajduyac,8,galing ni jericho!!!! jusko!,2025-10-17,0,0,watch,False
iancarloarias,7,one trapo after another,2025-10-17,0,0,watch,False
elijjsz,9,"first of all, I knew nothing about the former president—but DAMN, was he hungry for power. films like these really ground our perceptions of our so-called heroes. the kind of framing that quezon used is still evident in present-day politics, making this a timely discussion. it’s a very thought-provoking movie—it made me question whether the good deeds of our leaders were truly for the people or just for themselves, like mentioned, baka pampabango lang ng kanilang mga pangalan. maybe the…",2025-10-15,0,0,watch,False
erudad,4,"Dude they made Jorah look like an NPC...As a film this was really poorly paced and a chore to watch. Most of it seems to come down to how this was scripted. For a movie that seemed to have a lot it wanted to say about the problems with Filipino governance, it sure pulled its punches.I am an idiot who doesn't know or care much about my country's history, so walking in I was hoping I could learn something definite, or gain a better understanding of our first real President. Instead, I sat through two hours of people suggesting that Quezon wasn't what he seemed, until we saw his camp sell the Philippines literally towards the end of the fucking movie in a throwaway scene. Why the fuck is the Big Bad Thing they used to make Quezon look like a bad guy was having his first wife literally walk plaintively around the assembly hall 💀So many issues, there was a good movie in here somewhere many drafts ago. It just felt like they were scared to piss the wrong person off. Goes to show how even close to a hundred years later it's still the same families and people pulling the strings and making us all dance.",2025-10-17,2,0,watch,False
narutomilkhotel,6,he set a bad(?) precedent,2025-10-17,1,0,watch,False
melvmelv,8,"thank u, diego magallona, for your lectures have prepared me for this very moment",2025-10-17,0,0,watch,False
thonter,8,"""Bayan o sarili, pumili ka?""The Bayaniverse may have ultimately been a series of movies that are (if not for the same cast members/ completely standalone, but the bigger picture it paints is asking us the same question John Arcilla's Heneral Antonio Luna once asked a decade ago: ""Bayan o sarili?""""Heneral Luna"" is about a man who is dedicated to giving the country its rightfully earned freedom, no matter who he has to piss off to get it.""Goyo: Ang Batang Heneral"" is about a man who ultimately takes the fight, despite his selfish and somewhat childish nature.""Quezon"" is about a man who is nothing but a slimy and greedy politician who uses the country's independence as a bargaining chip so he can gain power and keep it for as long as he lives.The movie tells us outright that Quezon is not a good man, nor is he the hero of this story. He is a villain who uses every dirty trick in the book to remain one step ahead. It paints a picture of Quezon that is all too familiar to the everyday Filipino: a politician who plays dirty games to gain sympathy so they can climb higher into power.I love how Joven Hernando, who has always been the audience surrogate, has become a more active participant in the story. He becomes one of Quezon's pawns, another piece he could use to further his agenda. And once Joven reverts to his roots and once again becomes an observer, that's when the rug is pulled from under him.Joven is human. He is just like the ""heroes"" we've followed throughout the trilogy, flawed.Quezon brings the Bayaniverse into a solid finish, bringing back everything that came from Luna and Goyo all so it can ultimately tell the big punchline: Aguinaldo outlived every single one of the people we've followed in this trilogy.The Bayaniverse doesn't treat each and every single one of its focus as a holier-than-thou hero, but rather, humans who are just as flawed as everyone else. And in this landscape where every other biopic in the Philippines is treated like a glorified Wikipedia list, it's a breath of fresh air.Now, nobody knows what happens after this movie, after Bayaniverse. Who knows, maybe the Magsaysay tease could lead into a new trilogy that once again examines the Philippines and how we've become who we are today. Whether that happens or not, I'm glad we got to see these three movies come to life, the long way round. And if this does lead to another trilogy of movies, you know where I'll be.(P.S. Docking one star because the movie's soundtrack is sang by the jootsex guy.)",2025-10-17,0,0,watch,True
matyu,9,𝓲𝓷𝓭𝓮𝓹𝓮𝓷𝓭𝓮𝓷𝓼𝓲𝔂𝓪,2025-10-17,0,0,watch,True
fiinina,8,"One of those movies you are just so incredibly engrossed in that you don’t even realize how long it actually is To utilize a film within a film was amazing to watch because of its simple yet amusing execution, not to mention its accuracy and relevance during that time. To see lessons and personalities I once learned in class brought to life was all the more fun… na para bang napapanood ko na lahat unfold with my own two eyes ! And lastly, to see the mischievous games and calculated steps & agenda that transpire within the government was insane, funny, compelling, nakakagalit, nakakainis, and overall nakakagulo ng isip kasi hindi mo alam sino papanigan mo……. Which is the point. These political leaders are meant to be humanized. They are complex and abundant of fault. Sabi nga ni Quezon, in order to lead the nation in prosperity he needs to get his hands dirty from time to time. Everyone in this cast was remarkable, lalo na sina Jericho Rosales and Romnick Sarmenta. Their performance in this film gave justice to the brilliance of Quezon, as well as Osmeña. All in all, napakahusay talaga. As usual. Everyone watch Quezon. PLEASE. Sobrang importante ng pelikulang ‘to especially in a time where political games and corruption remain to prevail. Hindi siya yung typical bayaniverse movie na puno ng giyera, but this one resonates more with the current times which just justifies how crucial it is to watch this NOW. Ok bye 250 lang ‘to guys student discount :)",2025-10-17,1,0,watch,False
movieman9087,8,Ang ganda. Gusto ko nang panoorin Heneral Luna at Goyo.Damang dama ko na yung moment tas nagpakita si cong tv.,2025-10-17,0,0,watch,True
moonlitkink,7,osmeña and quezon toxic yaoi,2025-10-17,0,0,watch,False
nuemz,8,ph's corruption really goes way way back huh,2025-10-17,0,0,watch,False
saintmardi,8,quezon & osmeña: rage baiter bf x rage baited bf,2025-10-17,1,0,watch,False
dnkrstn,8,Minus 1 star dahil sa jumpscare ni cong,2025-10-17,0,0,watch,True
shoheistp,8,ROMNICK SARMENTA URGHH FAV CHARACTER IDC IDC,2025-10-17,0,0,watch,False
genesisg,,can't rate objectively as im part of the crew but it's undeniable that echo is soooo good,2025-10-17,1,0,watch,True
kindacloudy,8,"RIP Manuel L. Quezon, you would have loved Isk* M0ren0 🤮",2025-10-17,0,0,watch,True
pancitcatron,,🧀n,2025-10-17,0,0,watch,False
m4ndeng,10,first kurakot of the philippines be like:,2025-10-17,0,0,watch,False
carlcervantes,8,"A long, amoral dance between people who enjoy playing dirty games. Beautifully shot and wonderfully acted—as my partner remarked, it was less of a board game and more of a sarswela.The narrarive itself could’ve trimmed a lot of fat. It felt like the makers wanted to provide all relevant facts while at the same time letting the people decide for themselves. I think that if this series hadn’t gotten too meta, too self-conscious about its actual effect on Philippine society, it could’ve really been more courageous and straightforward.Hearing Jericho Rosales speak was jarring at first—having known him as an affable romantic lead—but he dissolves into his playful characterization. Women were also there, but they didn’t really do much to move the story along, or at all participate in it—perhaps a choice in storytelling, and a subconscious tendency that may need to be reflected on.All in all, extremely fun!",2025-10-17,0,0,watch,False
makonoodles,8,"watched with gf sa sine ^^i'm falling in love with these types of historical films, and watching this makes me wanna watch the other two films in the bayaniverse (i dont like this name)it feels like oppenheimer in a way (which i have rewatched like 10 times already) where there are so many historical characters and it just makes me so interested in each character's history (which, of course, every filipino should know about their history). another thing is the use of a fictional character to advance the story or to show another perspective (joven in this movie & alden ehrenreich's character in opp.)definitely wanna rewatch it again sometime in the future",2025-10-17,0,0,watch,False
marknoya,10,The Philippines was in fact not ready for independence,2025-10-17,0,0,watch,True
angelotantuico,8,miserably fails the bechdel test,2025-10-17,1,0,watch,True
cleo_lin_noire,10,manolo & serging doomed yaoi 😩😩,2025-10-17,0,0,watch,True
kimmandia,9,ang ganda ng pelikulang pilipino ̶a̶t̶ ̶a̶n̶g̶ ̶p̶o̶g̶i̶ ̶n̶i̶ ̶j̶e̶r̶i̶c̶h̶o̶ ̶r̶o̶s̶a̶l̶e̶s̶expected the great acting n dialogue but did not expect the wes anderson-esque shots n how well this was scored !! BEST OF THE BAYANIVERSE 10/10,2025-10-17,2,0,watch,False
jcmgwk,8,"ito ba ung ""Kung ano ang puno, siyang ang bunga""",2025-10-17,0,0,watch,False
hanging_asin,7,"in quezon's political game, the public is being played",2025-10-17,0,0,watch,False
yenisastar,10,"i love this trilogy. SO MUCH. its so well researched.the colour grading, the set, the costumes, THE CASTING? Jericho Rosales embodied Quezon. Sobrang galing ni Mon Confiado bilang Emilio Aguinaldo na naiinis ako sakanya. This whole triology really highlights how IMPORTANT the media is and how important neutrality is when it comes to news reporting. Framing really does influence our views and opinions on matters. And finally, this whole triology series is just so timely. It’s really depressing that despite Quezon happening a few decades after the death of Heneral Luna and Goyo, the Philippines was still suffering with the same issue. Actually it has been decades (nearing 100 years) since the Commonwealth period and a century since Heneral Luna’s time and we are still facing the SAME issue now. The Filipinos’ real enemy is not foreign rule. Its their fellow Filipinos who have selfish agendas. So many government officials yet so little government officials that actually serves the public.So… pili ka, Bayan o Sarili?",2025-10-18,0,0,watch,True
mrkchrstn,9,"- clever use of on-screen plot guides through silent black-and-white propaganda films- fast-paced, which reminded me of 90's scorsese with the blockings and cinematography. great change of tempo for suspense- funny most of the time, but gets serious for emphasis.- Romnick Sarmienta should be given credit for his performance.- Nasaan si Archie Alemania? Also, congtv can fuck off- magsaysay movie when???",2025-10-17,0,0,watch,True
yenisastar,10,quezon and osmeña -> master gaslighter x mabilis tumiklop duo,2025-10-18,2,0,rewatch,True
user1511rosie,7,"What a beautifully shot film that screams “sarswela” from start to end. As remarked by my partner, political dramas told by pinoys for pinoys are best presented in a comedic angle with the frequent spoonfeeding just to make sure the audience is caught up. This is personified by Joven’s character with the insistent need to have a third person pov to narrate the story (similar to Himala’s Orly), rather than just showing the events for what they are, otherwise the narrative can’t be controlled. Further amplified in the scene of Wood asking if Filipinos actually understood what “independence” truly meant. Maybe that’s the point of sandwiching humor (today: memes) in the gravity of our political state, it’s still relevant to the sarswela we have in the government today.The theme of storytelling through film does hit a very important mark in this trilogy— how heneral luna influenced the rise of a strongman president, and how it circled back in this third installation portraying the power of politcal alliances, uniteam. Haha. I do want to point out how so filipino movie-coded this is, with, of course, using women’s suffering as a plot device to move men’s story forward! How necessary was it to use a rape case other than as a threat and show the title character as cocky(we already know that), or how it’s scandalous that he’s bigamous (we already know that), or how aurora is complicit to all these. And, at the end, bears nothing to the story. Honestly, all those parts could’ve been cut from the film and it would have still held up. Lastly, I was first distracted looking at Jericho Rosales and not think of Echo the Hunk. By the end of the film he was truly Quezon to me. Anyway, mambo, mambo, magsaysay!",2025-10-17,0,0,watch,False
masvidal,9,"this is a beautifully shot movie, jericho rosales oozes charisma and i thought he's like tommy shelby without the violence",2025-10-17,0,0,watch,False
elijini,8,"watched this w/o seeing goyo first so my views rn may or may not differ after i watched goyo. hearing about the american colonization during my history classes and then watching now in cinemas how it may have played back then really gave me a clearer perspective of the past (esp as a visual learner). really love how these films humanizes our 'heroes' and encourages us to be critical too. maybe i just don't like have the movie framed aguinaldo as the good and better one knowing there were many controversies surrounding him too.visual and sound-wise, the film was just really great!! that stairs scene of sergio and quezon, and then that scene aguinaldo and quezon right after his speech were one of my faves! also, the mambo magsaysay jingle at the end was eerily haunting.",2025-10-17,0,0,watch,False
hyujinnn_,9,"AS A QUEZONIAN, I AM TORN BETWEEN THANKING OR CONDEMNING HIM• Jerrold Tarog, gets na kita! Halimaw sa editing and music!!! Sobrang worth it panoorin sa Director's Club.• Jericho as Quezon is well-portrayed. Had goosebumps sa ending! • Sobrang ganda ng visual![SM City Dasmariñas — Director's Club 1]",2025-10-17,0,0,watch,False
chaichu,9,jericho rosales :),2025-10-17,0,0,watch,False
shineyo,4,2 stars lang kase nakita ko si cong tv (late log suri ✌🏻),2025-10-18,1,0,watch,False
fiorever,7,there will be a quezon x osmeña fanfic somewhere. i know it but i just can’t prove it,2025-10-17,0,0,watch,False
pidyot,8,"A beautifully crafted film about heroism, heroes, and the humanity behind them. Jericho’s portrayal of Quezon is a breath of fresh air: layered and compelling. I especially loved how his Quezon seamlessly shifts depending on who he’s speaking too. “A chameleon” as shared by Leonard Wood if im not mistaken. Also, I finally understood Joven’s character arc from Luna to Goyo to this. Galing! If I had one critique, it would be that the film sometimes leans too heavily on dialogue to explain the history. It borders on overkill, in some parts, methinks. But overall this is a film worth watching! Sadly, very much relevant to our current politics! 🙃",2025-10-17,0,0,rewatch,True
bobranghae,8,old man yaoi,2025-10-18,1,0,watch,False
tarumie,8,ANG GANDA,2025-10-17,0,0,watch,True
allyzxia,9,"RIP, nadia. you would’ve loved being a film student sa UP Diliman",2025-10-18,2,0,watch,True
incendiumrex,6,"Part movie, part video essay on why Manuel L. Quezon sucks. I find that fucking obnoxious and I wonder how historically accurate it even is.It's a movie built for classrooms, I'm afraid.",2025-10-17,3,0,watch,True
thejella,5,I dont understand it..Could be a me problem.,2025-10-18,0,0,watch,False
au6ustfl,9,THE LONG WAIT IS OVEEER,2025-10-18,0,0,watch,False
karljaena,8,"A visual feast paired with a compelling story, nonetheless. Really a fan of directors who edit their own film. I also have nothing but words to say about Jericho on this one.",2025-10-17,0,0,watch,False
sobanova,6,We have many politicians but few public servants… same ass pattern almost a century later.,2025-10-17,0,0,watch,False
yeogioceanview,10,pataasan ng ihi quezon vs everyone,2025-10-17,1,0,watch,True
louvremika,6,kaya pala puro matatanda nanunuod nito sa sinehan,2025-10-18,0,0,watch,False
romxcob,9,loathing...unadulterated loathing,2025-10-15,1,0,watch,True
ulapchua,,Deconstructing quezon as the original Chiz Escudero haha superb movie proud ako sa growth ni Joven,2025-10-18,0,0,watch,True
_lalalee,7,asan na ba kasi ung body and soul,2025-10-18,1,0,watch,False
awrin,8,the kauna-unahang trapo ng naspi!,2025-10-18,0,0,watch,False
jujusining,9,"This is a must-watch movie! It’s very relevant to what’s happening in our country right now. The cast, writing, acting, and cinematography are all SUPERB —they really ate!! The question that really stuck in my mind was, “Bayani nga ba si Quezon?” It’s for you to find out, so watch Quezon! This film also reminds us not to blindly patronize our politicians—real change starts with awareness and accountability.",2025-10-18,0,0,watch,True
veetaminhp,8,Naipakita talaga na kung ano man ang mga isyung pulitikal at panlipunan na mayroon tayo ngayon ay repleksyon ng ating nakaraan. Ang Pilipinas ay nananatiling nakakulong sa kamay ng mga politikong ganid sa kapangyarihan.,2025-10-18,1,0,watch,False
pancake09,7,"“Independence” was mentioned so many times I almost wanted to roll my eyes. At first it was fine, but later it got too obvious. Alright, we get it. Move along. There was also too much explanation, both from the two journalists with Quezon and from the cinema scenes. It would’ve been fun if it were actually funny, but the quips just sounded like plain observations.If this were a book, it would feel like reading in third person with multiple POVs. That can be interesting at first, but it also gets tiring after a while.But it was still a good watch. I think the portrayal of Aguinaldo’s fate was the best.",2025-10-18,0,0,watch,False
haluhoes,8,wahahaha yosi break pa more,2025-10-18,0,0,watch,True
