movie_name,review_text,date,sentiment_label,sentiment_score,topic
Hello Love Goodbye,gusto ko talaga na hindi nagka-second thoughts si joy sa pangarap niya even after meeting ethan because THAT’S HOW IT SHOULD BE!! news flash: hindi pwoah umiikot sa lalaki ang buhay ng mga babae!! [insert jo march’s monologue sa little women],13/05/2022,positive,0.944853961,10
Hello Love Goodbye,Wow very surprised with this movie! One of the only movies i’ve seen katheryn without daniel and it was soooo good! An actual plot with good side characters and stories. It’s not too cringey or corny it’s the right amount,15/05/2022,positive,0.998323262,-1
Hello Love Goodbye,iniyakan,18/05/2022,positive,0.530032039,-1
Hello Love Goodbye,:((((,20/05/2022,negative,0.65312928,0
Hello Love Goodbye,galing talaga ni alden at kathryn umarte,21/05/2022,positive,0.995496392,26
Hello Love Goodbye,walang kupas! ganda talaga. ang pure ng bawat scene at sobrang satisfying ng ending. hindi pilit.,22/05/2022,positive,0.982633293,3
Hello Love Goodbye,kathryn's best movie me thinks,13/09/2021,positive,0.983996212,13
Hello Love Goodbye,"I think ito na ang extent ng pagiging experimental ng Star Cinema, lol.First and foremost, Kathryn Bernardo proved once again that she can evoke whatever emotion she wants from her audience. She acts with her eyes, body language, speech tone, just overflowing with passion! Nakakadala ang performance niya!I don't quite get why every single major family in the film had a member who had some sory of disability. It didn't really contribute anything to the story's development nor was it even explored through dialogue. It felt like an easy excuse to elicit sympathy from the viewers, which is problematic as PWDs have been forever subject to being accessorized in films and tv.Wasn't a fan of Alden's character. Too shallow imo. However, Alden himself did a great job in matching Kathryn's splendid acting! He was decent enough to keep me engaged.Played it safe on the ending. Of course, it had to have even a tinge of a happy ending because it is a mainstream film and lots of Filipinos consider a film bad if it doesn't have a light or a positive-leaning ending. It was building up nicely to an emotional climax but the moment Joy and Ethan had that confrontation scene, everything that followed felt like an attempt to repair the sad atmosphere that it produced. I wish the film maximized that misery and took a full-on drama end. Maybe then it would have more impact.Technicalities were subpar. The film did not look aesthetically pleasing most of the time. Perhaps it wanted to portray the gritty experience of living as a DH in HK, but it could have been better. Score utterly sucked. The audience does not need to hear a full track while the scenes transpire. This is not a music video.Tolerable, for sure. Kathryn carried it.",02/06/2022,positive,0.807970464,-1
Hello Love Goodbye,Wanted to watch this when it was out but watched it now n like ew men r shit asf,03/06/2022,positive,0.668309331,-1
Hello Love Goodbye,still holds my personal record for most tears shed in any film ,04/06/2022,positive,0.937727153,-1
Hello Love Goodbye,napakahusay ni kathryn,05/06/2022,positive,0.856895804,24
Hello Love Goodbye,made me feel Things™,10/06/2022,positive,0.988493145,-1
Hello Love Goodbye,i love corny people,14/06/2022,positive,0.983120918,0
Hello Love Goodbye,I don’t love you too,20/06/2022,positive,0.735006154,-1
Hello Love Goodbye,"""The time stops when you don't use it.""A heartfelt romantic comedy drama set in Hong Kong following the story of Joy and Ethan, two filipino immigrants. Its not a new story, but it blends the hardships, sacrifice, dreams, love & realities of a overseas domestic worker quite empathetically. The pairing of Kathryn Bernardo and Alden Richards was so charming & sweet.Hello, Love, Goodbye‘s message is simple: give yourself the chance to do what you want, get back up from disappointments, be courageous enough to love and choose whether you want to leave or stay. The film doesn’t portray Bernardo and Alden as some people who need your pity—but rather portrays the characters humanely, with stories and experiences that empower them to ultimately choose how to pave their own way for their futures—with or without each other. A warm satisfying drama.(ending made me ugly cry lol)Alden Richards<333333333333",26/06/2022,positive,0.994103611,8
Hello Love Goodbye,"i enjoyed this pero putanginang mga lalaki talaga, apaka problematic mo ethan ??",30/06/2022,negative,0.760499537,-1
Hello Love Goodbye,"I think I've watched this in cinema. Got sad how Kathryn's willing to give everything for her family ay sarili na niyang present at future ang nag suffer. Wala namang masama doon pero somehow kasi naging abusive na 'yung siblings niya and it's bold of them to request unnecessary expensive things knowing na mahirap trabaho ng ate nila abroad at alam nilang nag-iipon siya. Also, duh college students na sila, marunong na 'yan mag-isip. This film portrayed how difficult to be an OFW. You wake up, work, sleep, give money to relatives, repeat. ""Sinisikmura para sa pangarap"". I think this film would have a better ending if it's just focused on Kathryn, no Alden lol. Dagdag intindihin si Alden at ang creepy/pushy ng character niya rito.",30/06/2022,positive,0.691134036,-1
Hello Love Goodbye,"""Mahal na mahal kita, Ethan. Pero sa ngayon, mas mahal ko sarili ko.""EXACTLY JOY SISTER YOU'RE SO SEXYYYYY",02/07/2022,positive,0.972457409,-1
Hello Love Goodbye,ang pogi ni ethan,02/07/2022,positive,0.911743402,-1
Hello Love Goodbye,keri,04/07/2022,positive,0.808137178,0
Hello Love Goodbye,"not this movie weaving a La La Land-esque romantic arc around very visceral Filipino experiences - sacrificial romantic and familial love, OFWs (overseas Filipino workers), the eldest daughter being the pillar of the family, caregiving as profession and responsibility, globally dispersed family, survival mode as the only life mode, moving to the US/Canada in hopes to petition your family to move to be together, corny jokes & jumping photoschoosing yourself feels new in the Filipino cultural consciousness, but I’m here for that healthy individualization I’m not taking points off for the cheesy dialogue and dramatic acting because it’s part of the culture ",04/07/2022,positive,0.908965766,1
Hello Love Goodbye,"I admire Joy so much, a strong Filipina character. Red Flag yung scene na di pinansin ni Tanya si Joy. jahshah",04/07/2022,positive,0.988673747,-1
Hello Love Goodbye,"conceptually, exactly the kind of movie i needed to see when i watched it. but it fell flat, from the unemotional acting to the plot that tried to capture everything while capturing nothing. where does awareness end and glamorization begin?",11/07/2022,negative,0.95244801,15
Hello Love Goodbye,"I like it. I completely understand how this is the PH's highest-grossing film, too: loveteam, hugot, well-produced, plight of the ofw, nuanced enough. It gets it.",11/07/2022,positive,0.998203635,9
Hello Love Goodbye,Enjoyable..Female lead is so cute..,12/07/2022,positive,0.998010099,0
Hello Love Goodbye,a rewatch was warranted,10/07/2022,negative,0.518897355,4
Hello Love Goodbye,"For the december avenue Ang pinaka fleshed out character dito yung ke kathryn. Yung ke aldub parang slinot in lang para mag fit thematically sa arc ni kathryn, saka para mas ”poetic” yung ending. Sayang ang interesting pa naman ni Joy dito. Forda sociopolitical ang peg, kaya daming naka relate na OFW. Oks naman, kahit gasgas na yung formula, complete may mga kaibigan na comedic relief.",14/07/2022,positive,0.951853335,-1
Hello Love Goodbye,This movie made me want to violently sob while scream singing Moira’s soft-pop masterpiece “Ikaw at Ako” so if anyone’s down for a karaoke night hmu,13/07/2022,positive,0.992518544,-1
Hello Love Goodbye,this is my first time watching a movie with my bestfriend,16/07/2022,positive,0.993070185,-1
Hello Love Goodbye,"The last 20 minutes where Joy finally has some self respect for herself really carried this movie because I really hate Ethan lol. The climax between Ethan and Joy was surprisingly good and I actually was impressed in the way that it becomes really self-aware about what I think is the biggest crux for a lot of Filipino romcoms about love being the answer, that love will just solve everything and make all the worlds problems go away. I think…",16/07/2022,positive,0.994649231,12
Hello Love Goodbye,i truly enjoyed this movie because it's very realistic. it's raw and genuine. it's not your typical movie where everything magically falls into place and the female protagonist chooses love over her dreams yet she got her happily ever after. this movie doesn't except its characters from consequences to the decisions they make. joy knows the cards she should play and staying in HK isn't one of them.,17/07/2022,positive,0.997202396,-1
Hello Love Goodbye,sorry i don't love u,22/09/2020,positive,0.799826443,14
Hello Love Goodbye,ses bat love vs career lagi ang no1 selling theme ng filipino cinema cant a girl have it both ??!?!?1/1 bat trip niyo kami laging papiliin nakakaprostate also buti nalang career pinili mo joy kc sasakalin ita pag iniwan mo ung canada para sa isang white guy rip off also alden bat ganon lines mo ang typical,26/07/2022,negative,0.91822499,3
Hello Love Goodbye,this is so beautiful,27/03/2022,positive,0.99704355,-1
Hello Love Goodbye,"ganda naman kaya lang career v love ?? tlga b ueueueueue :""( kabahan ka na man v man and man v nature eme",28/07/2022,positive,0.978484452,-1
Hello Love Goodbye,okay isa lang masasabi ko dito PUTANGINA NI ETHAN,29/07/2022,negative,0.594639063,-1
Hello Love Goodbye,kathryn bernardo & kathryn bernardo only carried the whole film. ethan is shallow & creepy. the jokes & flirty lines gave me second-hand embarrassment.,29/07/2022,positive,0.50086838,12
Hello Love Goodbye,"This film emanates comfort, uncertainty, and self-worth. And that is what Philippine cinema should put out not hundreds of generic cringy-ass rom-com films. Joy, a struggling Filipino DH, who has specific dreams for herself and her family meets Ethan who doesn't exactly know what he wants. A literal manifestation of the 'Grumpy x Sunshine' trope, and I'm here for it. Joy finds comfort in Ethan, even if she isn't exactly looking for a relationship.Amid their emerging relationship, Ethan finds himself filled with uncertainty as his time with Joy comes close to its end. He deeply hopes that Joy will change her mind as he planned everything out for their future. But this is where it gets tricky, Joy has already made up her mind, from the start. She knows what she wants, even Ethan can't change her mind. And I support and understand her. All her life, she has put her family first, and this time she needs to prioritize herself. Ethan does not deserve Joy's half-self if she even chooses to stay, cause she will always have 'what ifs' and that would also be unfair for Ethan.In simple terms, Joy needs to find herself. To feel that she is her own person. Only then will she be able to give herself committedly to Ethan, and he understood that in the end.This is when two persons respect each other's dreams and are both willing to let go of each other to grow individually and come back when they're both ready.Alden & Kath > Kathniel, I still stand by this.",30/07/2022,positive,0.988170743,12
Hello Love Goodbye,One of the best shot Star Cinema films!,31/07/2022,positive,0.993211091,-1
Hello Love Goodbye,"kathryn you are a star !!!! for a movie that caters to the general public's tastes, it's pretty good...",29/07/2022,positive,0.997544706,13
Hello Love Goodbye,Gostei demais de ver a Joy se descobrindo ao longo do tempo (e se permitindo escolher)...,01/08/2022,negative,0.865900099,20
Hello Love Goodbye,idc idc this is one of Kathryn's best,01/08/2022,positive,0.970916092,-1
Hello Love Goodbye,"because I'm a sucker for romance-drama movies <333I want a love like that, too :)Ang galing ng pagdirect nila kay Alden dito, tumaglay talaga galing sa pag-arte. At si Kathryn? Hindi na sorpresa na ipinanganak siya para umarte sa pelikula. SOBRANG PLUS DIN nung Score, most of the time doon ako umiiyak pag nagpapatugtog na yung score ng 'Kung Di Rin Lang Ikaw' <33Cathy Garcia never disappoints",02/08/2022,positive,0.967372477,3
Hello Love Goodbye,hoy kathryn ang galing mo??},02/08/2022,positive,0.500104249,-1
Hello Love Goodbye,i remember watching this film in the premiere and I WAS SOBBING SO HAAARD!! also alden richards is a fine guy tbh & kathryn’s much better when she’s paired with another guy :’) anyway i love this film so much,03/08/2022,positive,0.997379541,-1
Hello Love Goodbye,loving someone in unrealistic way sucks,04/08/2022,negative,0.942350149,5
Hello Love Goodbye,"a kathryn bernardo stan through and throughnot the first time i've seen this so i always knew ethan's character is so problematic, but i guess that's a point to be made so the development can have more depth. a guy who's immature and foolish and always putting his heart above all else, learning that letting go is another form of loving when all he'd ever known is to go for what he can reach if it makes him happy, and a girl that lived her life so small and consuming due to the sacrifices needed to be made at every corner, finding the kind of love that presented her the choice that could be the turning point of everything. in ethan, she found the strength to choose herself. in joy, he found a love that encourages him to be more.it was questionable and doomed from the start, but if i know anything about love, it's that enough of it can really be the euphoria you need in your darkest, heaviest days. at the end, finding each other made them better. and with just that, none of the love was lost.",05/08/2022,positive,0.9903391,12
Hello Love Goodbye,"Choices are for the privileged people only. Yun yung take away ko sa movie na to, and I think that’s very important. Also, I miss my partner. It’s been a year since I said “babalik ako ha” katulad ni Joy. Wishing that things will get better soon.",06/08/2022,positive,0.972239494,-1
Hello Love Goodbye,habo ko ki character ni alden mauragon si kathryn ayon lang mwapz <3,06/08/2022,positive,0.951075196,2
Hello Love Goodbye,tanga,07/08/2022,negative,0.884568751,-1
Hello Love Goodbye,kathryn’s best film me thinks,09/08/2022,positive,0.988077283,13
Hello Love Goodbye,Kathryn carried!!!!,12/08/2022,positive,0.854116142,25
Hello Love Goodbye,4 for their chemistry and kathryn's performance,12/08/2022,positive,0.996778548,22
Hello Love Goodbye,akalain mo pwede palang paghiwalayin ang love team at gumawa ng matinong pelikula in the process sa pinoy cinema,15/08/2022,positive,0.816612065,3
Hello Love Goodbye,mahirap mangibangbansa ayusin ang ekonomiya ahahaalden i can fix yuo,16/08/2022,negative,0.854283273,2
Hello Love Goodbye,holy shit tears to the max,16/06/2022,positive,0.792329669,18
Hello Love Goodbye,Stressed and depressed in Hong Kong ,21/08/2022,negative,0.799019635,23
Hello Love Goodbye,"Philippines' highest grossing film. It's good, for the most part. There's a lot more here than I expected. There's some interesting socio-political and cultural commentary here about Overseas Filipino Workers' economic conditions living in Hong-Kong but it's all wrapped up in an overly melodramatic tone which I don't totally jive with. Kathryn Bernardo—who is fantastic in this btw—singing as badly as I did when playing SingStar on the PS2 is a highlight of this film.",22/08/2022,positive,0.996863961,1
Hello Love Goodbye,"""Kung mahal mo 'ko, bakit pinapapili mo ako?""",22/08/2022,negative,0.884211183,-1
Hello Love Goodbye,"[Buwan Ng Wika Watch #6] I'm honest enough to admit that I'm a lot harsher on Filipino movies than most since, well, I've seen a boat load of trashy ones growing up. That being said, I am trying to give them a fairer shot now but, man, there are a lot of terribly cheesy pick up lines and cringe-inducing flirtation scenes that take place to start this movie. Like, a lot. Once you get past all of that though and…",23/08/2022,positive,0.503444195,1
Hello Love Goodbye,idc about yall the chokehold of this movie on me is different together with my on going hate on alden richard’s character.. men suck,24/08/2022,negative,0.751343608,-1
Hello Love Goodbye,-1 star bc ethan was annoying for the most part at nainis ako sa pagsingit sa sappy theme song… like 100xkathryn was so great in this. nag-work yung pagpapakita ng pretty tourist spots sa bandang dulo bc i went from hating hk to wishing we could go back. hahaha balimbing so much,26/08/2022,negative,0.819142401,-1
Hello Love Goodbye,"Kung ako si Supremo, kakabahan din talaga ako. Potek walang kissing scene but still managed to be nakaka-kilig.",28/08/2022,positive,0.782173395,3
Hello Love Goodbye,0/5,04/09/2022,negative,0.803584039,0
Hello Love Goodbye,"#stoprussiai used to avoid this movie like the plague out of fear that i might get the unnecessary and unsolicited feels, but after several years i am happy to report that i was only able to see the movie for what it was and did not (un)intentionally project my personal experiences into what the film portrayedi could say that my goals are much more defined now, and what i want out of a deeper connection from a person is clearer, one that gives me a certain sense of agency; not marred by deception, mindfuckery, or misguided intentions; nor should it amplify my weaknesses more than my (unfounded) potentialchoosy na kung choosy ;)",04/09/2022,positive,0.98892796,15
Hello Love Goodbye,"Dari judulnya kupikir film ini tentang cinta-cintaan klise dengan latar luar negeri. IH TAPI TERNYATA... Ketampar abis. Heeeeiiii film ini ternyata bagussss. Seenggaknya menurutku.Kathryn Bernardo di sini bener-bener mirip Ayu Ting-Ting. Eh, nggak. Yang bener Kathryn Bernardo di sini bener-bener berpenampilan cewek biasa-biasa aja, yang masuk ke karakternya. Di sini dia berperan jadi Joy, lulusan S1 yang kesulitan dapat kerja. Dia ngerantau ke Hongkong, berpikiran mau kerja apa aja yang penting dapat uang. Karena mau hijrah ke Kanada jadi perawat dan ngeboyong keluarganya hidup sejahtera di sana. Dia nggak ada waktu buat senang-senang, termasuk buat cinta-cintaan. Kerja kerja kerja mulu. Sampai akhirnya ada cowok datang ke dalam hidupnya, pengen deketin dia tapi dia nggak mau nggak mau nggak mau. Nggak bermaksud jual mahal, tapi dia memang nggak punya waktu buat pacaran.Aku suka film ini. Aku tau rasanya jadi Joy, terutama pas dia yang kerja sama orang Hongkong. Aku pernah kerja sama orang Chinese dan keras sih dunia kerjanya. Simple-nya mereka ngomong kayak marah-marah padahal sebenarnya ngomong biasa aja. Ketika ngelakuin kesalahan kecil, mereka bisa marahnya gedeeeeee banget. Aku nggak bermaksud rasis lho ini ya.Interaksinya Joy dan si cowok di mana si cowok nggak gentar deketin. Disuruh pergi ajaaaa nggak pengen pacaran ya bebal tetap aja dekat, ngingatin aku sama ayangku. Dulu dia juga gitu ke aku, ketika aku malasssss banget buat pacaran karena nggak mau sakit hati lagi buang-buang waktu bikin aku selama ini nggak produktif, dia tetap aja maju.Aku mau fokus kerja aja, karena ketika aku galau karena pacar ya bisa ambyar kerjaanku. Singkatnya ini film tentang orang miskin itu nggak bisa milih. Nggak punya pilihan. Termasuk mau pilih wujudin cita-cita atau cinta. Sediiiiiiih. Orang miskin nggak bisa 'egois' ",11/01/2021,negative,0.734311223,-1
Hello Love Goodbye,ewan ko sayo ethan buhat na buhat ni kath :pp,09/09/2022,negative,0.738833368,-1
Hello Love Goodbye,"one of my fav filipino movies ever. i’ve been a kathniel fan since 2012, but it was refreshing to see that kathryn in a romance that’s not just with daniel. it’s proof that she can act and has perfectly good chemistry regardless of who’s the male lead. shit makes me cry every time, i’ll definitely rewatch again some time soon",10/09/2022,positive,0.99805069,-1
Hello Love Goodbye,"Hello, Love, Goodbye had me contemplating on falling in love with the right person but at the wrong timing.",16/09/2022,positive,0.694968522,14
Hello Love Goodbye,"Ang dami kong nabasa at narinig na rave reviews ng pelikula na ito kaya na delay ang panonood ko. And that was one of the worst decision I made. I think I found my most favorite Cathy Garcia Molina movie. This is her best work. And Kathryn, wow! I think I found a new respect to you as an actor.Some of my favorites:1. Cinematography - grabe ang ganda ng pag capture sa Hong Kong and how it tells the story of our domestic helpers2. The setting helped in the storytelling, hindi lang siya background. 3. JOY AND HER CHOICE AS A WOMAN - galit talaga ako sa mga babaeng character sa pelikula ni CGM but Joy gave me so much joy. How she insisted that she needs to decide for herself and her happiness. This is cinema! Chos. Add the scene where the character of Cacai asked the question about women being selfish when she choose herself!Mga not so favorite:- Fat jokes! Talaga ba?- The neverending family struggle. I guess it will not be a star cinema movie if there's no conflict with the family. Kaya nga hindi na resolve na domestic abuse victim ang nanay ni Joy. Because there's too many family drama!!! - Medyo makulit si Ethan when he courted JoyOverall, this was really a great movie. Please Kathryn, continue making this kind of movie and choosing this type of character. You have a new fan in me.",18/09/2022,positive,0.99116677,1
Hello Love Goodbye,saw a bit of myself in ate joy,19/09/2022,positive,0.964687049,-1
Hello Love Goodbye,Don’t talk to me about cinematography until you watch this movie and see the shot with the words “Manila: Delayed” on the flight departures board,18/09/2022,negative,0.541554511,1
Hello Love Goodbye,goodbye po ahahah,23/09/2022,positive,0.962132573,14
Hello Love Goodbye,"patuloy tayong makikibaka para pandayin ang lipunang wala nang joy, mary dale, gina, at sally na kakailanganing maging lakas-paggawa ng ibang bansa para lang mabigay ang pangangailangan ng pamilya at matupad ang mga pangarap.",26/09/2022,positive,0.981100082,-1
Hello Love Goodbye,dapat pala di ko pinanood to kasama ex ko,03/10/2022,negative,0.923162043,-1
Hello Love Goodbye,"I like the ofw representative, but like my aunt rented a bus to watch this. So Richard Alden if you're that hipster to have a letterboxd... I will send you my aunts details.. Pls she won't shut up about u.",06/10/2022,positive,0.949801207,-1
Hello Love Goodbye,has some of the cheesiest lines that will never be said outside of a movie but i’m a sucker nonetheless. love it bc cute but hate it bc it makes me cry,07/10/2022,positive,0.99360317,9
Hello Love Goodbye,binest talaga ni kathryn beh,07/10/2022,positive,0.717535317,2
Hello Love Goodbye,i love how it also shows the hardships the ofw go through when working. :],11/10/2022,positive,0.992437899,-1
Hello Love Goodbye,"Just in awe of Kathryn's acting prowess truly showcasing how she is an acclaimed actor even if she strays out of ""Kathniel"" projects.",13/10/2022,positive,0.994829118,13
Hello Love Goodbye,"this movie gets me. idk how, it just does !!!!",14/10/2022,negative,0.583513558,9
Hello Love Goodbye,This film is a much better version of the rom com formula. It was quite the experience for me and as a Filipino myself this was great.,16/10/2022,positive,0.998018861,1
Hello Love Goodbye,and that's on #feminism  choose urself bae !!,19/10/2022,positive,0.893109918,-1
Hello Love Goodbye,"You will get nothing new here. Everythin was cheesy, fake and unrealistic. Dialogues were so bad. And you know the movie name, so you know the climax.",21/10/2022,negative,0.943202496,-1
Hello Love Goodbye,i like my ethan better this one was kind of a pain in the ass,17/10/2022,positive,0.631456375,6
Hello Love Goodbye,kainis si alden potangina mo,26/10/2022,negative,0.945121586,0
Hello Love Goodbye,"Surprisingly, this is good, and one of my faves from 2019",28/10/2022,positive,0.998044968,-1
Hello Love Goodbye,"Rewatched this film with the fam. Gagi. Hagulgol pa rin iyak ko. I know Ethan has red flags, pero may character development naman sa dulo. I love na hindi lang romance yung focus ng movie but also career life, personal growth, family, etc. Hoping pa rin ako sa Part 2.",30/10/2022,positive,0.996740401,7
Hello Love Goodbye,ouch,30/10/2022,positive,0.511415482,0
Hello Love Goodbye,"I watched this with Audrey. I never thought this would be us after 12 years. We shared blankets, the rain was pouring heavily outside. He told me he never finished this movie before, and I told him I’ve watched it at least 10 times.Audrey, I find comfort in you.Happy Halloween!",30/10/2022,positive,0.995672226,9
Hello Love Goodbye,"""ang choice, para lang sa may pera."" i wonder what it's like to choose the path that i really wanted without having to weigh all the consequences and consider our financial status.",31/10/2022,positive,0.707203031,-1
Hello Love Goodbye,welp after 5 years u actually gave alden a good role and script. well done,03/11/2022,positive,0.990842581,11
Hello Love Goodbye,kathryn bernardo,06/11/2022,positive,0.971629977,16
Hello Love Goodbye,because I'm missing my girlfriend so muchhh,08/11/2022,positive,0.971333742,14
Hello Love Goodbye,not cringe kaya nice,17/08/2019,positive,0.952143312,0
Hello Love Goodbye,enough with the ofw love stories please,13/11/2022,positive,0.938691616,5
Hello Love Goodbye,4-4.5 stars,15/11/2022,positive,0.994324207,-1
