movie_name,review_text,date,sentiment_label,sentiment_score,topic
Hello Love Goodbye,"Filipino movie. This movie was so good. It’s a Filipino Romantic Dramedy. The main character, Joy, is working in hard conditions in Hong Kong to support her family. She meets a boy and romantic dramedy ensues. The movie is about choices, about loving yourself than loving a boy, and going after your dreams. The premise is pretty simple and in terms of Flip movies, there’s nothing really new nor innovative here. It was just done really, really well. I’ve…",13/08/2019,positive,0.997249782,1
Hello Love Goodbye,"was dragged into watching thisplot was your typical OFW storykathryn did her character justice, while alden did a pretty good job in playing the boy next door (but i can't stand the corny pickup lines)expected the dialog to have more depth. turned out to be too cheesy for me",13/08/2019,negative,0.513100386,11
Hello Love Goodbye,I LOVE YOU ALL PERO KINGINA PAANO NAMAN AKO!!,14/08/2019,positive,0.993616939,-1
Hello Love Goodbye,I miss Hong Kong so much I would say a step up from the regular Filipino rom com. There is a lot being said here about OFW’s and the very real struggles that they have.Also enjoyed all the local Titas that I saw the film with. Very glad that these films do get shown here in the US!,14/08/2019,positive,0.997844219,1
Hello Love Goodbye,"watched in a cine filled with filipinos, feels really good laughing and crying with people who know how long distance feels",14/08/2019,positive,0.998114467,1
Hello Love Goodbye,"A surprisingly good but honest Filipino movie about the women who move to Hong Kong to find contract work in the hopes of getting permanent residency, but are unable to fully realize their dreams before then. It's a story about hope, sacrifice, and ultimately finding that little ray of sunshine that can make it all bearable. This is a pretty heavy handed movie that can teach a lot, but also comes with a lot of positivity.",14/08/2019,positive,0.984463453,1
Hello Love Goodbye,The title says it all.,15/08/2019,positive,0.757704496,0
Hello Love Goodbye,"I didn't expect to like the movie this much, yet here we are— it deserves all the praise it's been getting. Some dialogues felt a bit cliché and that acting direction in one scene felt too calculated but the two leads were still great, nonetheless. Kath and Alden played their characters with endearing wit and charm, as their oddities make their interactions raw and believable. What I really like about HLG is that as it goes along it feels riveting on a simplistic scale, it becomes expressive of our own feelings. The theme is on the idea of love (almost didn’t work for me), but the direction pulls in the audience through its characters— I am every bit of Ethan and Joy. I work overseas but I have so much to be thankful for that I am not a breadwinner, no responsibilities aside from myself and I have a job that I wanted for myself. Movies are indeed powerful. This made me more appreciative of the life I have now— it’s good and a privilege, therefore I should not take it for granted. 6/10",15/08/2019,positive,0.997085631,11
Hello Love Goodbye,hahaha pangatlong beses ko na ‘to direk invited na ba ako sa victory party,15/08/2019,negative,0.656433702,10
Hello Love Goodbye,“Sobrang laki ng mundo. Natatakot ako.”“Kaya mo ‘yan.”(Decent review to follow rin kasi I need to collect my feelings muna haha),15/08/2019,positive,0.983932853,2
Hello Love Goodbye,direk cathy tried to make alden richards likeable at least once in his life and she fucking delivered,15/08/2019,positive,0.988415241,19
Hello Love Goodbye,BREAKING NEWS: kathryn bernardo reportedly hospitalized due to sever back pain from carrying the whole movie on her back(but really kath was amazing here star magic pls let her branch out),15/08/2019,positive,0.988324404,25
Hello Love Goodbye,"It is a feeling of mixed emotions watching the movie. Once again, we are reminded of the diaspora of Filipinos or OFW's to well off countries such as Hongkong and Canada to look for better paying jobs, no matter what these jobs are . It is sad because of the extreme difficulties encountered by the OFW's. At the same time, I feel thankful that there are jobs and income to support the families back home.Joy's work in Hongkong is hard - her pay is reduced, she gets a part-time job and runs from the Hongkong police because of it. In the middle of this, she sends home money to the Philippines and finds a friend, Ethan. Happiness finds its own source and with Joy, it is in the Central Park where all the ""kababayans"" provide comfort to one another in the middle of a foreign country with an alienating culture. It is also in Ethan whom she fell in love with.The movie is well directed and masterfully portrays the lives of domestic helpers. Salute to Cathy Garcia-Molina! The script is tight and romantic which clicks with the Filipino audience: ""when you talk to strangers, there is no judgement"" and "" I love you"" (witty remark to mean stay away).Finally, Kathryn Bernardo acts very well, she is the next Bea Alonzo. As for Alden Richards, with his handsome face, he can go places in the film industry.",16/08/2019,positive,0.994714677,1
Hello Love Goodbye,"Walangya, ang ganda?????",16/08/2019,positive,0.985175848,-1
Hello Love Goodbye,"Letter Grade: A (Masterpiece)This is genuinely the biggest surprise in cinematic history for me... now, this might seem utterly ridiculous, for me to call this film a “Masterpiece”—and of course, it really isn’t—but man do all the positives about this film outshine the very small qualms I have about this surprsing, genuine, and heartfelt Filipino romance. I really don’t know if it’s because I was only very slightly intoxicated, or because I’m a 20 year old gay Filipino in a wonderful relationship with my oh so sweet and loving Brazilian boyfriend, or the chemistry of Alden and Kathryn, or the admittedly cheesy but so emotionally-charged well-weitten dialogue, but this film... this film has made me cry more than any other film I’ve ever seen. More than my ultimate favorites, Lord of the Rings, Cloud Atlas, Spirited Away, Cinema Paradiso, Boy and the World... I literally had to turn away from the screen and bawl on my boyfriend’s shoulder in the cinema when that last conversation in the pier between Ethan and Joy. I really don’t know why this film struck me so hard. Maybe it’s all of the reasons I’ve lifted above. Or maybe this film is also just alright if I revisit it in a while... but wow, I really did not expect this reaction out of me going into this at all. By all means it is definitely not a more technically outstanding film than any of my other favorites, but man I’d be lying if I said this film didn’t touch me to my core. What a solid, beautiful film from Cathy. And such nuanced, magnificent performances from Alden and Kathryn. I’m glad this film exists. Definitely my new favorite Filipino film, overtaking That Thing Called Tadhana by MILES.",16/08/2019,positive,0.99492389,1
Hello Love Goodbye,an actually good cgm romcom film. this is cgm slowly getting more woke and i lowkey kinda stan,10/08/2019,positive,0.985898733,-1
Hello Love Goodbye,"you’re not crying, i am",16/08/2019,positive,0.972226918,0
Hello Love Goodbye,"okay, FINE!!! this was pretty cute ",17/08/2019,positive,0.996784806,0
Hello Love Goodbye,well-acted and entertaining for the most part. just too dramatic and cheesy towards the end,16/08/2019,positive,0.942666769,-1
Hello Love Goodbye,ayokong iyakan yung hello love goodbye pero eTO TAYO NGAYON,17/08/2019,negative,0.602434993,-1
Hello Love Goodbye,"Mumblecore drama shows how capitalism crushes people’s agency. Brilliant portrayal of OFW struggles, devoid of state-sponsored Bagong Bayani propaganda. Great performances by leads.",17/08/2019,positive,0.990484715,-1
Hello Love Goodbye,may cringe lang na parts pero ang galing ni kathryn dito,17/08/2019,positive,0.981725991,2
Hello Love Goodbye,"""Aldubyou""""I do note!""",17/08/2019,positive,0.736207724,0
Hello Love Goodbye,"Alden Richards’ character, Ethan, is pushy, creepy and problematic. He will continue sending friend requests even if Joy declined several times already. He will make the radio station talk about Joy in public without her permission. He will use another phone to text Joy anonymously. He will act like a police even if Joy is weeping out of fear. He will squeeze through inside a small room knowing that Joy will be uncomfortable. He will continually send “Need a friend today?” text messages even if Joy has rejected it so many times. I don’t know how a Filipino girl reacts to such moves, but if people consider this as “nakakakilig,” there’s a problem. It almost gave me the same queasy feeling of the stalking problems I saw in Kita Kita and the French film Amélie.Hello, Love, Goodbye is at its best when it tells the story of Kathryn Bernardo’s character, Joy. In some ways, the film manages to outdo similar mainstream Filipino romance films because of Kathryn Bernardo’s stunning performance and the earnest depiction of OFWs (Overseas Filipino Workers). Bernardo, whose acting holds the film together when it was falling apart, effectively evokes a palpable sense of weariness, discontent, and eagerness to alleviate Joy’s situation. Actually, I can do without the La La Land love story if the social commentary was strengthened and expounded more. In a similar vein with Sunday Beauty Queen, the film resonates with Filipinos because of its sensible portrayal of what it is like to work abroad in a job you are overqualified in.But Cathy Garcia-Molina’s picture falls apart as the annoying, melodramatic score continues to play in the background, tackier drone shots are added, and more forced, “hugot” dialogues are delivered by the leads. Sure, this is how cliché-ridden mainstream Filipino romance plays out. But how I wish we get movies that transcend this generic romantic stratagem. Hello, Love, Goodbye fails to offer something new to romance movies as an art form, and it is disappointing since the OFW story and Joy’s arc have so much potential.",17/08/2019,positive,0.750200272,6
Hello Love Goodbye,"Filipino romcoms just can’t shy away with all the cheesiness but as a soon-to-be OFW I feel like I related to Kathryn’s Joy too much in a way that I HAVE to chase this dream. It’s all or nothing. And as my departure draws closer, there are moments when I suddenly become scared and I begin to question all my plans. So this movie really spoke to me in that aspect.",17/08/2019,positive,0.985233486,1
Hello Love Goodbye,takot lang din siguro akong mapag-iwanan,18/08/2019,negative,0.86709094,2
Hello Love Goodbye,"Your typical “troubled boy falls for a bright young girl”-themed romance— “A Walk to Remember” a.k.a. “Grease” a.k.a. “Say Anything”— Cathy Garcia Molina’s “Hello Love, Goodbye” discovers puppy love in its purest form. It has plot and spiels topped with cheddar, mozzarella, parmesan, cottage, and blue cheese. Pairing Kathryn Bernardo and Alden Richards is a genius move. This film showcased how good actor each of them is. Of course, we do not forget the supporting cast because they added extra entertainment and drama. The movie never failed to give a sense of claustrophobic feeling of alienation and loneliness in a developed world— the very reason why I think portrayal of Maymay’s character was so realistic. It is a good movie with great acting, average screenplay, and story topped with layers of clichés from the romantic drama genre.",17/08/2019,positive,0.993957877,8
Hello Love Goodbye,"MY TWITTER REVIEW:The love story of Hello, Love, Goodbye (2019) couldn’t be more formulaic, although I won’t dismiss its sad factor, but I really couldn’t care less for it after the movie ended. What the movie successfully conveys is the sacrifices people make to have a better life,...to make ends meet, even if it means being away from the people you love. The family aspect of the movie really got me, it’s the subplot that actually made me cry. The plight of OFW’s in this film was executed very well—sensitively, with a lot of heart.It made a good depiction of how families want to be together but can’t, the pain and consequences of being away from them, dreams that have to be put on hold and the resilience of OFWs. I loved the movie because of that aspect. Again, as to the love story, not so much.MY FACEBOOK REVIEW:I have to admit that the love story of Hello, Love, Goodbye (2019) didn’t charm my socks off. It couldn’t be more formulaic and to be quite honest, it bored me. (Please don’t attack me )What I loved about it though, and where the film actually succeeds, is its depiction of the life of Overseas Filipino Workers (OFW). It was executed very well—grounded, sensitive, full of heart. It showed how resilient Filipinos are and how we find humor in everything. That in any way that we can, we always find/create families when we’re away from our own.The film conveys how sacrifice can be selfless and also selfish. Selfless in the aspect of going away from your loved ones and braving a new world alone to make ends meet and eventually have a better quality of life. Also, that sacrifice can also be selfish, but not the bad kind (? I hope you get it), when it comes to choosing yourself, choosing your dreams instead of always trying to make the people around you happy.The values of this film resonates, especially in every OFW family, how families always try their best to be together albeit it might not actually happen or whenever it does, it’s going to be a long, long time. That in the end, and this might sound corny, love transcends loneliness, fear or hardship.My favorite scene would be when Kathryn, Kakay and their other friend were watching Vilma Santos’ iconic speech in ‘Anak’ and Kakay sobbingly asks, “Ang pagmamahal ba sa sakripisyo lang naipapakita?” It’s a good question, and my answer is NO. Sacrifices are not requirements in love; we don’t have to sacrifice anything just to show someone we love them but we do it because that’s how we try to make it work with someone we love and it’s necessary.",18/08/2019,positive,0.98856014,8
Hello Love Goodbye,"ok FINE moira dela torre has one good song,,, ‘yung kasama asawa niya,,,mahal na mahal kita joy you deserve the world <3 ikaw ethan uhm gud luck best wishes,,,,,",17/08/2019,positive,0.993693471,-1
Hello Love Goodbye,“Need a friend today?”,16/08/2019,positive,0.885350645,6
Hello Love Goodbye,hetero boys scare tf out of me,18/08/2019,positive,0.726038158,-1
Hello Love Goodbye,"a harrowing point of view of the working class in hong kong. even when sprinkled with some glib and sly humor from time to time, the sense of awareness that this is a very real thing is never lost on me.",18/08/2019,positive,0.7908445,-1
Hello Love Goodbye,Surprisingly lives up to its hype.It was heart warming and wrenching at the same time.I liked that the ending didn’t feel forced. But it felt like an ending that they’d decide to make a shitty second part just because the first one did well.It’s a good romcom + drama for this day and age.,18/08/2019,positive,0.996857047,-1
Hello Love Goodbye,Absolutely perfect. Stunning. I was a giddy child. Fantastic. Wouldn’t change a thing.,17/08/2019,positive,0.997846961,-1
Hello Love Goodbye,So damn adorable to the point my heart hurt. My first Filipino film!,17/08/2019,positive,0.993622363,1
Hello Love Goodbye,"Pati ako nakiki ""yieee""",17/08/2019,negative,0.703907669,0
Hello Love Goodbye,"This movie is beautiful, but it does not shy away from those imperfections. No. 1 is it does not know what it is, is it a movie about the struggles of an OFW or a romance film? When you think about it the romance between the two is like just a segway to give us a tearjerker at the end. No 2 is the transitions of scene to scene, I promise you in every 10 minutes of the film I went from smiling straight into being sad. No 3 is that Joy in this movie is hell about not being allowed to breath in this film, from the first 3 minutes of this film she is already the saddest person i seen on a start of film. Lastly, the supporting characters are floating, they have nothing to do in this film, they are flat and one dimensional, the actors and actresses of those supporting characters disappointed me because none of them stepped out of their comfort zone in acting. BUT I can't take the magic of the story and the power of these two. I praise the director of this film because she wrote the most perfect roles for them and there you have the humor which is always perfect. If only the storytelling gets this movie right, it would probably be my favorite Filipino film of all time",18/08/2019,positive,0.931946695,-1
Hello Love Goodbye,"This was just one from hundreds of thousand stories of ""Why Filipinos are all over the world""""Why in every country there are always Filipinos""And for all the same reason, FAMILY.Its heartbreaking, how the movie tells how selfless OFWs are. They had to earn money,They need to do extra jobs even if its illegal. They have to fight boredom, sadness alone. They'll forget their own happiness andThey will always choose their family.",18/08/2019,positive,0.986171424,1
Hello Love Goodbye,only kathryn bernardo can outdo herself,18/08/2019,positive,0.979722917,16
Hello Love Goodbye,Alas! Nakita ko nanaman ang stellar performance ni Joros as the perpetual bestfriend ng bida pero never naging bida.,19/08/2019,negative,0.914419055,-1
Hello Love Goodbye,Cute movie but it’s like all other filipno love movies.,18/08/2019,positive,0.993954003,1
Hello Love Goodbye,"A heartfilling hello, a heartwarming love, and a heartbreaking goodbye.",19/08/2019,positive,0.922251105,14
Hello Love Goodbye,"Formulaic Filipino comedy love story with a semi predictable ending typical of the Philippines big studio productions. That being said, the acting was descent and it seemed to capture the OFW (Oversea Filipino Worker) life in Hong Kong quite accurately.",18/08/2019,positive,0.968202591,1
Hello Love Goodbye,"“choices are for the rich.”this is rated on a filipino romcom scale. this movie made me so happy fuckkfjfjcjejjdjdjd there is just something abt filipino romcoms and it’s excessive amt of KILIG that gets me so fucking high on my bullshit believeing that love is actually really fucking REAL nandnndbffnjsjdjs i hate this. i can’t be like this. i can’t be watching filipino romcoms anymore getting me to believe this bullshit. LMFAOKSKDOOSJDJDJDJD. SO KILIG. SO KILIG. SOOOOOOOOOOOOOOO KILIG. I’M SO HAPPY. I ENDED UP ALMOST CRYING NANNDJJSJSJSJS. cathy garcia molina films are hit or miss. hit: She’s Dating The Gangster, miss: My Exes And Whys. this time around it was a HIT. cohesive storyline, first of all, which is a factor sooooooo many filipino romcoms lack. it’s usually all over the place, but this was perfectly organized for once, lmfao. also, not too cheesy, but not too 2012 tumblr aesthetic-y. i mean it was the latter, but not to the point where i wanna gouge my eyes out bc every shot is a wannabe brandon woelfel still, ya kno??? it was actually filmed perfectly. like how normal foreign films look and not so cheap made-for-tv lookin shots/camera quality, ya kno?? so u kno filipino production values r going up. also, could’ve loved this completely if there was no fatphobic jokes. LMFAO. fuck. what the fuck @cgm????? also loved how this was all abt self love and letting go and had an openended ending. suuuuuch an improvement from My Exes And Whys. i mean, there was still the reinforcement of misogynistic/patriarchal values, but that’s just a problem w the filipino media/culture as a whole !!!!!!!!! this film was abt how u need to choose urself and love urself before anyone else and i luvd it !!!!!! and not letting a man decide ur life and/or deciding ur life based on a man, and instead letting said man figure his own self out instead of putting his problems on u !!!!!!!!! fuck !!!!!! fucking LUVD IT !!!!!!!!!!!!!!!!!! finally some good fucking FOOOOOOOOOOD !!!!!!!!!i really hope cgm continues in this direction in the rest of her work. bc. fuck. merely thinking abt My Exes And Whys makes me FURIOUS. more self love and (real) independent women plz !!!!! less misogyny !!!!!! THANKS !!!!!!!!!!!!!!!!ALSO, speaking of She’s Dating The Gangster, i was curious to watch this w the lack of daniel padilla. at the beginning i was almost ???!!!!??? at the beginning bc we waited like 6 years or smth ??? for kathniel to kiss ??? and now we got a fucking sex scene of kathryn w alden in their first film together ????? holy fuck !!!!!! but then it didn’t happen and the rest of the film carried on w their non pda ways and i was disappointed again. but SPEAKING OF ALDEN RICHARDS. I’VE NEVER THOUGHT HE WAS CUTE AT ALL. (neither him and daniel are cute. there. i said it. fight me). but HERE ??????? IDK IF IT’S JUST BC HE REMINDED ME OF THE LOVE OF MY LIFE TADASHI HAMADA FROM BIG HERO 6 WHENEVR HE WORE THAT BASEBALL CAP, BUT BIT H ????? I’D DIE FOR HIM NANDNSJJXJSJDJSJS. but i’m 110% sure it was only bc he looked like tadashi w the hat and sweats on and bc of the many kilig moments. in reality, all the dudes who played his best manbun friend and his two brothers were significantly more hot than him. and i luvd it  not that much. but ya kno. i luvd it. ANYWAYSYHSHSHSHSDJSJJSJDHSHSHJJJJJJ ,,,,,,,,,,,, i fucking loved this movie. i fucking love filipino romcoms. i fucking love kilig moments. i fucking love love. i’m fucking back on my bullshit. and i need to fucking calm down. time to watch Blue Valentine (2010) and remember that love isn’t real and doesn’t last. thanks. bye.ps: everyonw in my family always says i look like kathryn bernardo and i deadass do not see it at all like literally 0% like there were a few times furing this film whrnbi thought ??????? do i look like that ?????, maybe i do ??? but the answer is i DON’T !!!!!!!!!!!! if i do look like kathryn bernardo irl and i’m the only one who doesn’t see it, then i’ll just accept it as body/facial dysmorphia ,,,,, but i’m pretty sure that i Don’t and i’m not letting filipinos in the philippines who i’ve nvr actually seen in the flesh tell me differently LMFAOOOOOOOOO ,,,,,,, and /Rest.",18/08/2019,positive,0.989555657,1
Hello Love Goodbye,MA-rami akong issues sa technical aspects laluna sa screenplay at scoring peroMA-tapang ang pagkakakuwento sa buhay ng mga Pilipinong immigrant workers sa Hong Kong atMA-saya akong sumusubok ang Star Cinema na mag-experiment ng ibang approach sa formula nila kaya sa tingin koMA-ganda ang pelikula overall! Also 'di pa ako sure pero bakaMA-ngampanya ako ng Best Actress award for Kathryn sa Urian at FAMAS next year. Ang husay lang niya dito!,19/08/2019,positive,0.994531512,3
Hello Love Goodbye,"There was some well-put stuff in this, like Kathryn's character and the DH in HK representation (sprinkled with Sunday Beauty Queen references), but I just felt so so uninterested watching this. Alden's character is unlikable and even his redemption story arc doesn't make up for his witless appearances in the first half. He just shows up, gives some forced cheesy one-liners and smiles. Kathryn's character on the other hand, is smart, well-helmed by Kathryn Bernardo herself, but pairing this workaholic persistent with her dreams and grounded in reality with the carefree Ethan doesn't make for good chemistry between the two lovers nor ultimately, a satisfying romance.",19/08/2019,negative,0.511736333,11
Hello Love Goodbye,"Kathryn!! Ang galing niya and talagang dalang dala niya yung role bilang DH! And for Alden, medyo cringe pero as the movie goes ma rerealize mo na may effect pala yung personality niya na ganun sa story. Maganda na reality yung pinakita ng movie. HINDI CLICHÉ sa ending to the point na happy pero at first my interpretation was hindi siya happy pero someone told me na Kathryn was happy kasi pauwi na siya and Alden bought the ring kasi alam niya na pauwi na si girl. Overall, ",19/08/2019,positive,0.972768068,3
Hello Love Goodbye,"labas 'to sa formulaic love stories ng Star Cinema, andun pa rin ang pattern pero sa wakas mas naging matalino at praktikal yung bidahigit rin nga sa love story' to e. ganda nung OFW plot, kasi ramdam mo yung pagod, hirap, puyat, inis at lungkot ni Joy at nung nanay niya, ni Ethan at nung mga kasama niyamam, Kathryn snappedt here !!!!ganda rin ng chemistry nila ni Alden kala mo magkakilala na sila ng matagal, sobrang komportable lang panoorinps: yung half star para sa dimples ni Alden",18/08/2019,positive,0.962911069,3
Hello Love Goodbye,Appreciating an OFW story. Chemistry is... Meh.,19/08/2019,negative,0.689744651,22
Hello Love Goodbye,TODO BIGAY!?!?!?!?,19/08/2019,positive,0.525675774,27
Hello Love Goodbye,kathryn bernardo's best performance yet dont @ me +++ her chemistry with alden was surprisingly nice i luvvv it <3,20/08/2019,positive,0.99589169,-1
Hello Love Goodbye,"Kathryn managed to deliver and portray the repetitive, tiring life cycle of a domestic worker.My main complaint against this film is that it will work far better as a drama, more on drama than the romance. The story about relationships in a transitory space deserves a heavier script and narrative. I do commend the production for making this, though.",20/08/2019,positive,0.940071225,-1
