username,date,review_text,rating,source
nomer123,2020-11-01 00:00:00.000,Hayop ka is definitely offensive and vulgar but the lack of enthusiastic profanity and sustained laugh-to-gag ratio made the film flat and blasé. The film has too mature content to be enjoyed by the youth and too immature to be enjoyed by adult audience. It feels like it was written by a group of high school students and produced by their rich parents. The animators did a splendid job.,100.0,ltbx
clnema,2020-11-02 00:00:00.000,"except for the animation, i rlly can't say anything good about this movie",40.0,ltbx
iennejunsay,2020-11-02 00:00:00.000,nasayang yung ganda ng animation dahil sa kwento,40.0,ltbx
kjbulotano,2020-11-02 00:00:00.000,Five stars for the animation. Support the animators. Don't support the DDS.,80.0,ltbx
ronquillo2017,2020-11-02 00:00:00.000,Ang ganda ng art!!! Korny ng story lmaooo pati yung voice acting medyo awkward... pero ang ganda ng animation! Sana magkaroon pa ng mas madaming pelikulang lokal na animated tapos maganda na din story line at writing hehe  kudos din sa mga animators who worked hard on this!!! Nice one!,100.0,ltbx
thevisualbones,2020-11-02 00:00:00.000,"better than Cats, I think",60.0,ltbx
rmc,2020-10-29 00:00:00.000,the 2 stars are for the animation.,80.0,ltbx
pezka,2020-11-02 00:00:00.000,animators this star is for yall!!!,40.0,ltbx
aksn_red,2020-11-02 00:00:00.000,"As much as the visuals aim to impress, this is a film that is boggled down by a lack of substance and sensitivity. It could have tackled important issues (as it was trying to do), but it fails and in doing so, becomes another forgettable film that feels like it only exists in order to show that Philippine animation is improving. Sadly, this film might have just pulled down those hopes instead.",60.0,ltbx
riku_yamazaki,2020-11-02 12:13:14.826,Im not a Furry but-,100.0,ltbx
batumbakal,2020-11-02 12:13:35.439,"Ayos 'yong animation ah. Overall, basura. Sobra-sobra pa 2 stars. Parang ito 'yong cartoons ng mga matatandang nanonood ng ika-anim na utos sa GMA 7.",80.0,ltbx
tuesjays,2020-11-02 00:00:00.000,"Rocketsheep Studios needs to stop hiring shitty writers. This is not going to convince a lot of people to support animation, if the thing that they're animating is crude, disgusting and reminiscent of the problems plaguing local entertainment.This movie is an amalgamation of everything familiar and stereotypical of an afternoon at a local TV channel: homewreckers, cheaters, exaggerated rich-poor conversations, and all the things regular viewers across the country seem to swoon over on the daily. The folks over at Rocketsheep seem to think that this makes for a passable idea in the animation department. Did it work? Yes. Do I like it? FUCK NO.If the goal of this cartoonish re-imagining of a soap opera is to drown it in cutely-drawn pastel-style animation interspersed with clear homages to GMA-7's Astig Authority (afternoon segments where international anime series are dubbed in Tagalog for local audiences), then congratulations, they're going to successfully hook in the support. But to explicitly juxtapose this advocacy of creative animation with the morally replete narratives of your average Philippine soap is just deplorable. What they're doing here, is making a statement that the only way to somehow succeed and get more support from everyone is to just get what already works for the masses. This isn't something I look forward to if the future of the industry is really dictated by the preposterous concept that is this movie.Put it this way, the story can just as easily be inserted as a real-life adaptation in the hands of grubby network executives. If independent studios like Rocketsheep are already behaving in the same manner when it comes to advocating the #SupportLocal mentality, then we have a big problem here.And for the love of god, DO NOT TELL ME THIS BULLSHIT IS SATIRE. Where is the humor? The dialogue is supposed to be funny? Jesus christ, none of the writers here can write for shit. The only way I found myself laughing here was when the animation took center stage over the story itself... which only happens when the film approaches the lewd and sleazy story developments that they're relying on. Everything else was just an entire cringe-fest left and right.",40.0,ltbx
happikuy,2020-11-02 00:00:00.000,"the controversy.the plot per se is very wattpad-ish, telenovela-ish, and full of cliches. i detest as well how they sexualized the anthromorphic characters. the aspirations of this film are somewhat questionable—hoping they're aiming to really critique the depicted themes tho by satirical means. also don't get me started at the problematic cast; i prefer professional voice actors more than them. in spite all of these, this film's good animation doesn't genuinely deserve this problematic plot. cinematography was also greatttt. filipino animators and philippine creative industry truly deserve way better.",100.0,ltbx
noperome,2020-11-01 00:00:00.000,"Ganda ng kwenta, ang pangit ng kwento.",100.0,ltbx
gelabau,2020-11-02 00:00:00.000,Ang ganda nung animation!!! Reminds me of Steven Universe at times.But the storyline (and yung dds na voice actor)? Basura. The puns were funny though.,100.0,ltbx
missingsaga,2020-11-02 00:00:00.000,"Genuinely enjoyed the animation and the references that made in-universe Philippines vibrant and accurate. Unfortunately and unsurprisingly, my enjoyment ends there.Hayop Ka! tries to channel a bomba Zootopia, but bombs (heh) spectacularly. Terrible dialogue and story, and thematically reeks of Duterte's macho bullshit. So many missed opportunities for an actual animated bomba film that channels the hardships and miserable daily life under the current regime... What can you expect from a cast that leads Robin Padilla though? ",80.0,ltbx
gelatin528,2020-11-02 00:00:00.000,Ang landi nila lahat.,100.0,ltbx
sheisthestars,2020-11-02 00:00:00.000,"Visually pleasing! Jokes and puns were nice, though sometimes dialogue felt forced and could be developed. This film could be more refined overall but I appreciate the effort and time to make this film.",100.0,ltbx
leomigraso,2020-11-02 00:00:00.000,I actually liked this. di magets ng iba na it was supposed to be a parody of pinoy bomba cliché plots. ano ba ineexpect niyo disney writing? tangina haters di naman gets.,100.0,ltbx
marshmalexis,2020-11-03 00:00:00.000,"pretty, pretty animation and, in fair, several attempts to hint at our very real social issues were made. but as much as i would like to praise them for attempting to convey in Hayop Ka! what few other filipino filmmakers do these days, their failure to truly commit to becoming a satirical comedy makes me wish they never tried in the first place. 'yan hanap pa ng grant pero gusto lang talaga ""magpatawa"". nothing wrong with wanting to make people laugh, don't get me wrong, pero para pilitin mo na lang na magkabigat ang storya mo (without even making sure to properly represent the people you want to represent) para lang magka-grant at makagawa ng pelikula? dangerous and foolish.",,ltbx
janellemicaela,2020-11-03 00:00:00.000,stars for the animation,100.0,ltbx
entremelement,2020-11-02 17:23:06.189,"Can't say I didn't love the almost-seamless animation. It did show the somewhat grim reality of Filipino internalized misogynism and patriarchy, as well as the melodrama of being the unwilling breadwinner of the family, but there are some things in there (i.e. chastising a woman for wanting a better life for herself and her family) that did not quite sit well with me. Nevertheless, it was a good watch. Crude Filipino green jokes were made and though some of them a bit tasteless, they did make me laugh.",100.0,ltbx
eyan,2020-11-03 00:00:00.000,Bad storytelling. Outstanding visuals.,80.0,ltbx
fearoine,2020-11-03 00:00:00.000,"Thoroughly enjoyed the puns as a member of a wordplay-loving nation but you didn't have to gloss over the toxic aspects (gossip, teenage pregnancy, misogyny) of our culture like that; it's getting such a bad rapNetflix",,ltbx
gelbadoodle,2020-11-03 00:00:00.000,hindi ko alam anong maf-feel sa plot tbh..... parang hindi kasi naempower yung female character tas.... ewan basta malabo yung plot kasi parang i found it hard to emphathize w any of the characters. PERO ANG GANDA NG ANIMATION YUN TALAGA I GUESS sayang lang kasi kulang yung kwento eh :(,100.0,ltbx
igimancer09,2020-11-03 00:00:00.000,1 star para sa creators. Half star kasi natawa ako ng unti. Kung gusto ko lang naman maging furry uulitin ko nalang Zootopia. Okay naman animation pero yung story pang teleserye na hindi mahohook ang nanay ko.,60.0,ltbx
ceptune,2020-11-03 00:00:00.000,"You know all those Filipino children's books we've all read during grade school? Hayop Ka! perfectly captures the warm aesthetic they hold. It really rewards you for speaking Tagalog with its jokes and Easter Eggs, I watched it with English subtitles (I'm not that good in Tagalog) and it's blatant that the translations weren't that good to me, it didn't really capture the full essence of the original dialogue and weakens any non-speaking viewer's experience. I can't blame them though, Tagalog isn't the easiest thing to translate, especially with the contextual jokes used. I'm not fond of the story at all, could've been a lot better. I wanted a lot more awareness to it outside of just a few second scenes on the side. Still, it's a big step for Philippine Animation and I hope we get better things more out of it.",100.0,ltbx
funkykid123,2020-11-02 00:00:00.000,"This is the biggest ""What the Fuck"" movie I have ever seen. Cat woman faces the consequences of her terrible actions. Like the damn main character is such a ... that it makes me laugh every time she burns a bridge. This is so fucking wild. Is this what soap operas are like? Holy shit. I *genuinely* enjoy this trainwreck. This was so captivating I found it hard to look away. A part of me can't believe this movie is even real. What am I? Hoooly shit.",100.0,ltbx
gieselle,2020-11-03 00:00:00.000,i expected more but that's as far as netflix can give,80.0,ltbx
isindu,2020-11-03 00:00:00.000,Must be my first Filipino film. Didn’t know it at first and I was quite surprised it is,80.0,ltbx
aaronlm,2020-11-01 00:00:00.000,"What the. I don’t know kung paano pinipitch yung mga ganitong films.Fifty Shades of Grey, but with a children’s cartoon aesthetic? Complete with an ultra rich attractive man who took his lady to his mansion and flew around in a helicopter? Sad to say that it’s hard to be proud of what my fellow Filipino artists have accomplished when they come up with stories like these.But I am not going to entirely sh!t on the film because this film really did carve out a unique art style, and I really have to commend that. It looked notably distinct- it’s not Japanese nor western. What I really like about Makoto Shinkai’s animated films is that he tries to emulate real world Tokyo; and that is also what I felt like they tried to do in this film with Metro Manila.The storyline, on its very core, is just really pointless. Again, I don’t know how you pitch these films to producers. On top of its ridiculous story, the dialogues are just childish. The way they try to sexualize everything; it’s not even worth a single chuckle, but a facepalm. To complement the annoying childish sexual jokes, we also have the annoying voice acting; even with a cast of well known celebrities.Cheating. Misogyny. Gold Digging. Sex. Sex and sex lahat. Hays. I very much respect the animation and their effort to do something unique; and for that it’s not completely zero.",60.0,ltbx
paojulian,2020-11-04 00:00:00.000,a) Plot/Storyb) Charactersc) Screenplayd) Cinematography - e) Genre/Theme - The animation is nice and fun.,80.0,ltbx
kcsbertis_,2020-11-04 00:00:00.000,the only reason i’ll add this to my fave is because my friends are part of this production HAHAHA,100.0,ltbx
fallenexp,2020-11-04 00:00:00.000,"I feel bad for the animators, the writers ruined this visually appealing cartoon.",80.0,ltbx
lucpucmuc,2020-11-03 00:00:00.000,"Really enjoyed the animation style, designs, background details, even the randomly hilarious fighting and sex scenes. Did not enjoy any of the main characters or care about what they did. They did not have any redeeming qualities about them. Rich guy is a privileged cheating bastard who is against unions, Roger can be sweet but also lazy/irresponsible, and careless when it comes to his partner. Nimfa is exactly what the radio host said, an extremely flawed and guilty person. She…",100.0,ltbx
paciajero,2020-11-04 00:00:00.000,"WTF?! sayang yung animation, ang ganda. Pero sobrang trashy nung story. 1 star for animation. Is it Satire? I don't think so.",40.0,ltbx
polaris21,2020-11-04 00:00:00.000,"Great animation, poor plot and script. The great animation cannot cover the fact that the plot is bland and have already been portrayed in hundreds of Pinoy mainstream movies. Filipinos can do better than this.",80.0,ltbx
geewudd,2020-11-01 00:00:00.000,the art and animation is A++ im really happy a lot of independent artists got to work on it. its a win for a rise in local animated films. but its the way this film's plot and script tried to hit so many marks and missed all of them for me. how do you throw 5000 knives and stab everything but the apple. gives you a feeling of 'so what was the point' by the ending. also that part where piolo pascual was like alam mo kung bat nimfa pangalan mo??? kasi nyMPHOMANIAC KA >>>:(((((((((( GRRRR i wanted to die,80.0,ltbx
yelibean,2020-11-04 00:00:00.000,Ganda ng animation pero ang kalat ng kwento.,80.0,ltbx
josephhh,2020-11-04 00:00:00.000,"Bad writing. Problematic and cringey, naiinis lang ako everytime naririnig ko boses ni Robin. 1 star for the animation, It was splendid but the story was meh. Cute den yung spoof sa local brands, tawang-tawa ako sa Jolibog.",40.0,ltbx
chinawoman,2020-11-04 00:00:00.000,ang ganda talaga ng animation ;_; and JERRY THE FROG pls he was so cute...... but ya that’s it sorry,,ltbx
laalfiler,2020-11-04 00:00:00.000,Ma’am pa-void,40.0,ltbx
_ashtomato,2020-11-04 00:00:00.000,Rold ano to??? Mapapa “hayop” ka talaga,20.0,ltbx
ajsurema,2020-11-04 13:48:28.464,"Let me get this straight first. I haven't watched this movie, and the only way you'll make me see this movie is if my viewing of the movie will not support the movie in any way.I'm writing this review right now to post my stance regarding this movie.I am all for supporting local animation studios, but my support will never come in the form of blind support. We've already heard the stories and news everywhere of Robin Padilla being casted as a character in the movie and while I do not support Robin Padilla in any way, his casting isn't what doesn't sit right with me.What doesn't sit right with me is the fact that Joyce Bernal is one of the producers of the film. For the ill informed, Joyce Bernal is a D/D/S director who is the director behind all of D/utert/e's SONAs (among some other terrible movies that she's also directed). Not only that, but Piolo Pascual is also a producer. While Piolo Pascual hasn't directly come out as a supporter of D/utert/e, he has previously worked with Joyce Bernal on a project in support of D/utert/e, and that makes him an enabler. So, we now have three D/D/S supporters/enablers involved with the movie. THAT'S what doesn't sit right with me. Surely there are other producers or actors they could've approached?I will never support the art or the creative works created by or produced/financed by supporters of this horrible administration and nor bootlickers who try to act ""apolitical"" despite being enablers themselves.Again, I am for the support of the works of local animation studios, but should that support come blindly all in the name of ""support lokal""?",,ltbx
greennerdcinema,2020-11-04 00:00:00.000,"Después de haber aprendido acerca de su controversial estreno en Tailandia además de ser su primer gran largometraje animado me corroía el morbo de verla. Admito que azota temas delicados por lo que a muchos no congeniarán en su totalidad, su trama es sencilla, predecible y básicamente no existe algo de empatía para su protagonista; vaya incluso los amoríos tienen mejor desarrollo... o por lo menos hasta el final.Aún se puede beneficiar de su gran calidad en su dibujo y arte, espero nos den más proyectos por delante. Pese a momentos de sobredramatismo opacando su lado serio, tengo que admitir que fue una agradable hora y once minutos en donde su mundo, uno que otro buen chiste y un maravilloso grupo de actores de voz salvan dicho proyecto.Pero si... ella es una completa Perra!!... ... en el sentido figurado.",100.0,ltbx
finalgirl_,2020-11-01 00:00:00.000,please....rocketsheep.......hire better writers,80.0,ltbx
iamcjreyes,2020-11-05 00:00:00.000,"This raunchy exotica adult animation perfectly embodies the street-smart cadence of a Pinoy conversation and generously sprinkles it with humor and absurdity. Colloquialism at its finest - the script is relatable and funny, the narrative truly Filipino, and the visuals reminds us that this is made in our own country. I was about to comment on the cliché plot of adultery but decided not to ponder on it and just support this local product.",100.0,ltbx
primecruz,2020-11-04 21:05:39.562,"I wasn’t planning on writing reviews when i made a letterboxd account. I just wanted to lurk, read reviews, check out people’s lists, stalk user profiles and yes, read every single review to every movie I directed because i like crying myself to sleep at night. But after watching hayop ka and reading the reviews here, i was compelled to write something. Because i don’t get why people hate it so much. For me, it’s a dark comedy that tackles realities of class and socio-economic disparity in the Philippines. Nimfa’s problem is simple: she’s poor. She has to break her back working as a saleslady to pay for her sister’s tuition and pay rent, she has pares to look forward to during special occasions because that’s all she and her boyfriend could afford, she can’t even go to a motel for some sexy time. This isn’t necessary a problem except for one thing: Nimfa is dissatisfied. She is not happy with her situation. She wants more. But what can she do? She didn’t graduate and it’s very likely that she’ll be a saleslady forever. So can you really blame her when she “falls” for Iñigo? A handsome rich guy who showers her with attention? If you were in her situation, wouldn’t you? I would. So she makes one bad choice after another. Should we hate her for it? What would we rather see? Tanggapin nalang niya yung buhay niyang ganun? Ok lang yang pares ghorl masarap naman. Beauty in poverty ganun? She sees a way out, and she grabs it. I am not entirely happy with her choice but i understand why she did it. Eh sa sawa nang maging mahirap ’yung tao e. The bad choices that Nimfa makes are greatly influenced by her circumstances, circumstances that are forced upon her because she is poor. Yes cliche. Yes lagi nalang mahirap/mayaman storyline but maybe there’s a reason why the boss-katulong trope(the powerful loving the powerless) works so well in our country. Maybe it’s because most of us Filipinos still see that as the only means of escape.And hayop ka lays bare that truth: If you’re poor, falling in love out of economic need is very much a reality. This truth is prevalent in our narratives, even if they aren’t explicitly stated. Some top of mind examples are Laida Magtalas falling in love with sir Miggy(A very special love) or Maya with Sir Chief(be careful with my heart). Fuck i’m old The difference in hayop ka is that it does away with romantics and explicitly states, with ice cold pragmatism: I am in love with you because I am poor, because you are my best option to escape this life. It’s tragic how in the world presented in hayop ka, genuine romantic love is a privilege for the rich.And another note, can i just say that the art direction is fucking gorgeous. Making drawings move is an expensive and time-consuming affair and you have to find ways to get your point across in as few frames as possible. Hayop ka borrows some techniques from Japanese animation which it uses brilliantly and comically. Future animations will surely use this film as a reference.-1 half star lang pala for too much sexual jokes. Not that im offended or anything and i’m totally fine with women exhibiting the same sexual libido and desire as men, it’s just that there were too many and most of them weren’t funny. -1 half star ulit for the ending with empoy the frog. I get that the film had to end on a somewhat lighthearted note, after it literally kicked rich prince charming out the window, mejo corny lang yung promo ng walang ka paris and laughter laughter. Other than that, methinks this is a solid film that illustrates the relationship that exist between class and love. Aesthetically, this is an important milestone in local animation and will surely be used as a peg by future similar project.Tang ina 5 na amf. Dami ko sinabi wala namang babasa. Parang livejournal ko lang noong college. Hayup",100.0,ltbx
babibuntel69,2020-11-01 00:00:00.000,"You Animal! (2020)Directed by : Avid LiongorenRelease Date : October 29,2020Casts : Angelica Panganiban, Robin Padilla, Sam MilbyFilm berkisah mengenai seekor kucing wanita penjual parfum yang bernama Nimfa, dimana ia bermimpi memiliki hidup bagaikan telenovela dimana ia mendapatkan pria kaya dan ganteng. Suatu hari seekor anjing kaya bernama Inigo berbelanja di tokonya, tanpa diduga percikan cinta terjadi diantara mereka. Permasalahannya adalah sebenarnya Nimfa sudah mempunyai kekasih yakni seekor anjing bernama Roger. Maka Nimfa harus memilih antara Roger yang bekerja sebagai petugas kebersihan atau Inigo yang kaya raya.Film ini merupakan film animasi dewasa Netflix pertama dari Negara Filipina dan mempunyai tema yang cukup membumi. Dimana orang orang berusaha untuk keluar dari status social mereka. Disini kita dihadapkan antara mimpi atau kenyataan.Apa yang saya suka dari cerita dalam film ini adalah bahwa di film ini walau animasi namun dramanya cukup dalam dan selingan komedinya membuat tidak terlalu kelam.Komedi dari film ini cukup segar, ibarat melihat animasi aksi jepang, lucu dan gokil! Seperti adegan perkelahian, adegan menghancurkan mobil ala Street Fighter, dll.Untuk animasinya benar benar keren, menggambarkan ciri khas kota mereka. Dari warung, makanan, kendaraan dan lain lain benar benar spesifik.Ingat ini adalah animasi dewasa, sehingga tema dan ada beberapa adegan dewasa.Sebuah animasi yang cukup menarik.Imdb 8/10Score 6/1001/11/20",100.0,ltbx
al3,2020-11-05 01:54:56.215,"i cant believe they made this so overtly furry,,,,,,, anyway animation was cool, would love to see more animation in the country.",100.0,ltbx
bryllefajardo,2020-11-05 00:00:00.000,"Liongoren's Hayop Ka! is a tongue-in-cheek and provocative 2D animated film seen from the perspective of proletariat catwoman Nimfa Dimaano, as she finds herself slowly loosening her morals in desperate exchange of economic indemnity. The film is deceptively simple, but functions intelligently to provide a scathing representation of the cyclical, problematic lives of the working class Filipino: their desensitisation to the methods they cling onto for their own economic benefit, the internalized sexist and especially misogynistic paradigm that remains hegemonic among both Filipino men and women, and how all this disturbingly becomes the mundanity of everyday life in a third-world country. Moreover, although the narrative might simply appear as an animated rehash of what has plagued local TV for years, it cleverly utilizes these teleserye tropes to construct a sociological examination on capitalism's destruction to society; more specifically, to the Filipinos that belong to the lower end of the social strata. Past the painfully realistic reconstruction of the plight of the working class in film, the portrayal on the bourgeoisie is also excellently handled; they're cruel and selfish, despite the already comfortable lives that they live. Hence, the anthropomorphism of these animals becomes a clever display of how capitalism has made literal animals out of us— easily succumbing to carnal desires and almost devoid of empathy.Aside from the thematic complexity of Hayop Ka!, the meticulously beautiful animation is extremely noteworthy as well. Sadly, this film has been misread by most of its viewers— its intelligent writing and thematic complexity ignored due to its vulgar, yet realistically absurd humor. Needless to say, Hayop Ka! is up there thematically, and can even suffice to be the lovechild of two classics that eloquently critique capitalism: last year's Parasite, and 1962 Mexican film The Exterminating Angel. Definitely one of the year's best!",100.0,ltbx
erennoterin,2020-11-03 00:00:00.000,animation was really cool :// kaso yun nga ://,80.0,ltbx
christhefeline,2020-11-05 00:00:00.000,"i liked this better than saving sally, but as much as i wanted to believe that the writers were self-aware enough to make a story that seems to poke fun at typical love triangle/adultery tropes in philippine cinema/telenovelas... the pay-off of this film really broke that optimistic belief in me.the animation is better than saving sally though, so there's that.",80.0,ltbx
zoemei,2020-11-04 00:00:00.000,"the credits sequence was more interesting than the actual movie :[ if this is meant to be satirical, man i really did NOT get that from the way this was written. as with many of the reviews on here i think the animation saved this, but it seems a little wasted on a script prioritizes punchlines over story.",60.0,ltbx
