username,date,review_text,rating,source
kupatea,2020-10-29 00:00:00.000,"Good animation but story writing needs improvement: The animation was fun to watch specially that you don't see that much Filipino animation online.

The thing that I don't like about this movie is that it has too many dirty jokes that aren't that funny, and I think it would've been done better if the jokes were timed right. The story flow was messy, some parts were fast, some parts were slow. I actually found myself watching this movie with a straight face, i guess i was expecting too much since the teasers hyped me up?

Guess the way the story was written isn't my cup of tea. Kudos to those people who worked on this animation! hope to see more animation projects in the future",60.0,imdb
whiteboiii30,2020-11-04 00:00:00.000,"Good Overall: I set my expectations low, when I saw the mainstream local actors were the voice of the characters. Its premise as typical cheap romantic comedy gives me a bad vibes because of reputation of poorly-made-overused plot lines that plagues Filipino mainstream cinema. But I still give it a chance because Filipino animations are not common. I like the cultural references and the catch of the story. I think making it as adult, dark comedy animation film is a great move. In short ""Hayop Ka!"" Exceeds my expectations, 7/10.",70.0,imdb
Lloydee98,2021-01-11 00:00:00.000,"IT'S CLICHED, FUN AND QUITE TOUCHING: During the first half of ""Hayop Ka,"" tons of cliches from filipino teleseryes and movies were shown, including some funny jokes and references. But after an argument scene that features Robin Padilla's terrific voice acting, the film actually got better. Despite being quite annoying during the first half, the character of Nymfa won me over due to her journey and the ending wherein I realized that a lot of Filipinas end up with the same situation.",70.0,imdb
riyandans,2020-10-31 00:00:00.000,"A suprise from SEA: Well the animation is good also VA and character design, but storyline need some improvement i was just get disappointed when how the ending comes like that i just kinda hoping that after credits there is some sort epilogue will explain how Nimfa's life foward. But this movie also need some more audience to watch the movie it's a good movie so tell people to watch this movie.",70.0,imdb
paul_m_haakonsen,2022-01-25 00:00:00.000,"Funny and enjoyable...: When I stumbled upon the 2020 Tagalog animated movie ""Hayop Ka!"", I had no idea what I was getting myself into here. But I read the synopsis for it, and have to say that I was somewhat intrigued, as ""Hayop Ka!"" sounded like something definitely aimed at a more mature audience.

And I will say that writers Manny Angeles, Avid Liongoren and Paulle Olivenza definitely managed to put together a story and plot that was every bit as entertaining as it was enjoyable. So yeah, ""Hayop Ka!"" was a wholesome animated feature for a mature audience. And when I say mature audience I don't mean that it is XXX-rated, but merely that there were references and hits towards lewd nature.

The art style in ""Hayop Ka!"" was strange, but enjoyably so. Initially I was a bit taken aback by the art style, but it quickly grew on me and I came to enjoy the art style that they used here because it was definitely complimenting the story and the message of the movie.

With ""Hayop Ka!"" being an animated movie, a proper voice cast ensemble is a must. And luckily they did have that here. While I am not familiar with Tagalog cinema, then I wasn't familiar with a single voice here. But I will say that the voice acting was good and definitely gave the characters life on the screen.

I found ""Hayop Ka!"" to be an enjoyable surprise of a movie, and definitely is an animated movie that I would recommend for a mature audience that enjoys light-hearted and funny stories. The fact that ""Hayop Ka!"" was told as an animation wasn't really a hindrance in any way.

My rating of director Avid Liongoren's ""Hayop Ka!"" lands on a six out of ten stars.",60.0,imdb
pzct,2020-12-26 00:00:00.000,"You Filthy Animal, Nimfa XD: Hayop Ka - About the female cat known as Nimfa, who has to decide if she wants to be with her macho boyfriend who she's been with for years or a rich gentlemen guy. The movie has it's ups and downs

Pros:

Character Designs and Animations - Let's go ahead and point this out. I thought the designs for the characters were unique. To the point where I can easily identify where these characters came from. Not only that, but the animation was beautiful!! I enjoyed the movement of these characters!

Repeating Premise with a Surprise - It has been done to death Yes. A female that's tired of her broke life so she wants a chance at the richness and luxury. That's pretty much what Nimfa does in this movie. She leaves her ex to join the rich and luxurious life. Except instead of realizing she was better off with her old life, she doesnt get neither men. Her Ex was now taken and she caught her Rich boyfriend cheating. So the premise is repetitive but there was a nice twist for me!

Roger - If I had to say which character stood out to me more, it was definitely Roger. He was the best character to me in the movie. Because he was trying his best to provide for his girl while staying loyal to her. While admittingly, he is at fault for giving her the same repetitive lifestyle she grown tired of, I felt like he didnt deserve to be lied and cheated on. Plus, his design is pretty hot owo Strong Muscular Dog

Radio Host - I forgot his name but the radio show host straight up tells Nimfa all the wrong things she did. It was the best moment because somebody needed to set things straight with her

Cons -

Third Act/Final Act - The film was going pretty solid so far. That was until the third act or the part where Roger was bailed out of jail for destruction to somebody's car and putting someone in the hospital. After that part, I personally felt like the story kind of fell apart. Nimfa does have a guilty mind for the decisions she made, which is understandable. But here is one that I felt like fell apart: Nimfa getting pregnant with Roger's baby. This was when literally Nimfa and Iningo finished having sex on the beach. She was pregnant next day and it was Roger's baby. I was confused because they havent had sex in a while! She was pretty much banging Iningo. Plus, I felt like this was a bit out of place for something like a pregnancy to happen. There are more to it but watch the film. You'll understand why I felt like the third act of the film kind of just fell apart. Not only that but the ending felt so unsatisfying. Since the third act pretty much broke apart, the ending felt unsatisfying

Overall, A solid movie at best. Of course the story is pretty much basic but with a neat rwist. I just felt like the movie was dragged down by the third act of the film",70.0,imdb
rhardo,2020-11-14 00:00:00.000,"It's a good start!: It's a good start! In fact, I can call the whole thing a masterpiece from a creative standpoint. Surprisingly, it was entertaining despite the usual Pinoy the-other-woman trope surrounding the plot (but come on... Filipinos are more than just a Telenovela audience). I have to commend the team behind this project, though, for being bold and for choosing an unconventional direction-we don't get to see a 2D-animated anthropomorphic characters featured in an adult infidelity-driven storyline everyday, do we? Overall, kudos to Rocketsheep Studio for a very fine job! The Philippine animation industry has really come a long way. Keep on!",90.0,imdb
gege-24317,2020-11-01 00:00:00.000,Awesome visuals; weak story: Really impressed w/ the visuals and animation. Story could work a bit better tho.,50.0,imdb
candadhanik,2020-10-31 00:00:00.000,Coolest slice of life comedy!!!: This is the funniest and coolest slice of life comedy that I've ever seen. This is the reality of life. I really loved every details of it. It's a sad and happy story. I laughed a lot with this film and the part where empoy sang almost brought me to tears. Thank you for the filipinos who did this. I hope you continue doing more of this amazing comedy film. That was very entertaining and honest. Great characters. Thank you very much. ,100.0,imdb
titotitomanbaby,2020-11-24 00:00:00.000,The Nutshack is better than this: This is just a furry cartoon with a Philippine teleserye cliche.,10.0,imdb
royhectorkabanlit,2020-11-01 00:00:00.000,"A Must Watch for me: The Movie is pretty good, the dialogue is very witty, and very Filipino. Some or most of the Jokes I'm not sure Foreigners will appreciate as much, like when Nimfa said, ""sa Pares pa talaga nag propose"", LOL.

The Characterizations were also pretty good by everybody in the Cast. The Plot is also very Filipino, like Nimfa supporting her Sister's Education, etc. and it is not as predictable as you might think, there are some surprising twists in the Story also.

Stick around for the Credits, the rest of Nimfa's Story is also shown in Story Board format. And I also loved Empoy's rendition (I think it was Empoy) of Jose Mari Chan's ""Beautiful Girl"" at the end. Overall it is a Must Watch for me.",100.0,imdb
grajalescade,2020-11-07 00:00:00.000,"A strong story but a weak ending: Although the visuals looked so good, the story doesn't reach the Steven Spielberg storyline, but it could have some improvements",50.0,imdb
aumarivero,2020-11-20 00:00:00.000,"Past the Vulgar Theme is a Message: The Theme: Past the dirty jokes and the sex theme of this movie is a filipino masterpiece, no doubt about that. Congratulations to the makers of this film. It's not usual that Filipinos brave an animated movie production like this, so kudos to you guys for that.

The Production: Angelica, Sam and Empoy are personalities fit for their roles. The dubbing could have been improved though. This caveat for me is that there are some scenes where the emotions and interaction of the characters seem so disconnected with each other. Did they record separately? Together? It's not majority of the movie but there are just some scenes that felt like they aren't talking to each other but are just speaking in character by themselves.

But the character design, the vulgarity of the screenplay, I agree that these are great creative routes for marketing purposes. They worked for me.

And I like that this movie was able to feature a pinoy world in a not so cliche way... the saleslady, the pares house, papa george.. seeing filipino icons in an animation is so funny itself. I love these.

The Story: The ending is definitely THE conversation starter. Why did she 'happily' come back to that pares house with jerry? Isn't that place what she's trying to leave for so long? Or was it really roger she's been tired already?

Is the ending a picture of failure? As in going back to square one or zero?

Or is it a depiction of a second chance at love at the same start?

I don't know the answers but I'm happy to be intrigued.

Good job and again congratulations to the team behind this. :)",80.0,imdb
bergenkremer,2021-01-29 00:00:00.000,"Visually pleasant, rather disappointing story-wise: All that is good in this title is it's eye-catching art. Granted, I watched the English dub, so I could have missed a lot of untranslatable jokes throughout the movie, but it seemed that most of them are toilet humour and jokes for 12-year-olds anyway. The whole plot revolves around such trivial and beaten tropes that nothing in the movie strikes me as exciting or unexpected. This title could have tried to be anything else but the cheesy and unoriginal romcom that it is, and with the beautiful art direction it could be more mature and bring more to the table in terms of story and characters. The main plot doesn't grab any stars from the sky, nor does it even try to be original. My takeaway: I would love to see more projects by the animation team behind this movie, but in a title that will actually make me feel something.",50.0,imdb
merylldiola,2021-01-11 00:00:00.000,PLEASE MAKE MORE FILMS LIKE THIS.: Totally love it! Hope they make more . Laughter all the wayy plus the animation style is superb.,100.0,imdb
Frutic,2022-01-26 00:00:00.000,"Nice graphics and amusing characters, but terrible message: The movie has been a pleasant eye candy visually, the characters somewhat enjoyable,though a bit insipid and cliché. But what is the moral of the story? Its OK to cheat? Its OK to laugh and be angry on somebody because he is poor and you want more than that, that you just like him for sex, and insult him for loving you and wanting to be with you? Not saying he was the greatest but the main character was angry at him and laughing at him for unreasonable motives.

Also throwing a fit over something she herself ends up doing, having unprotected sex resulting in a baby?

And happy in the end because..what, she made a new friend? Almost instantly after a rage fuelled cat fight with the rich guy and his""friend""

What is the reason of this movie? I feel sorry for the animators that had to put up with such a dull content. They made me give it 3 stars rating and one more star for some amusing scenes. But it's not saving the movie at all.",40.0,imdb
mikaelquizon,2020-12-28 00:00:00.000,Love it!: A whole lot of pun and the animation is superb! A punny take on classic Pinoy radionovelas brought to life!,100.0,imdb
adriannieva,2020-11-03 00:00:00.000,"New Cover Same Book: Same story line as what other rom-com filipino film already has. A girl torn between a dust poor and extremely rich lover. With animation, you can show more of your imagination that is difficult to perform with live actors but unfortunately they stuck with the usual filipino content.",30.0,imdb
kirkespinar,2020-10-30 00:00:00.000,"Philippine Animation at its best: I loved every single bit of it. From the animation, to the witty dialogue, to the story (you'll like it better once you're aware that it's supposed to be a parody of Filipino teleserye romcom tropes), and even the music. As contrary to what some might have said about it, I actually find it to be pretty woke and progressive, with its not-so-subtle nods to current social issues such as contractualization, police brutality, etc. Like, there was even a scene in the film where you can find a poster with Duterte's face on it depicted as a literal dog; how can you be more woke than that? Politics aside, I really enjoyed the film overall. I hope Hayop Ka! manages to inspire more Filipino creatives to express the wonder of Filipino culture more and to be able to show to the world how amazing Filipino talent can be.",100.0,imdb
ArtSmart-40856,2020-10-30 00:00:00.000,"A visual feast: A visual feast. I have to pause the scenes every once in a while to appreciate every details. Imagine our chaotic metropolis interpreted by impressionist artist exploding with colors and lights. Dark scenes highlighted with glimmering lights inbetween and daytime landscapes so detailed that even captured the tangled electric cables, bumper to bumper traffic, rusty rooftops and most realities in the city we live in and yet somehow so mesmerizing to see in their own way. The same studio that created Saving Sally, you can easily tell their signature style that separates them from other animation studios here and globally. Much like Cartoon Saloon, an animation studio based in Ireland (Song of the Sea, Bread Winner to name a few of their movies) focus on their unique styles of visuals in their story telling. Each cells worthy to be printed, framed and hanged in your living room. Kudos to the talented creatives and artists. You are making a difference indeed.",100.0,imdb
magsirover,2020-10-31 00:00:00.000,"A Rocketsheep exceptional: As what reviewer Artsmart stated. Hayop Ka! (You Animal!) is exactly stands out as a note worthy ""visual feast"". and in addition to this, I would like to sincerely congratulate the makers of this animation. It is truly a great work of art, following ""Saving Sally"". Who would have thought they'd actually release yet, another amazing show. Not to mention, The casting and dubbing for the voices of this was truly exceptional. Although, it is not an animation that can be for all ages. It is a true treat for both Film and animation enthusiast of legal age. If our entertainment could release shows in such feat, I am looking forward to more of these. Please watch Hayop Ka! and support our local art industry.",100.0,imdb
psalmgerhartbecodovargas,2020-10-30 00:00:00.000,Great movie but ruined by a voice actor: Great animation. Good story. The VA's were mostly okay but it was Robin Padilla's voice who ruined the entire mood of the movie. It's creepy and cringey. Hoping they will re-release it with a new VA replacing Binoy's part.,90.0,imdb
jffry-95918,2021-01-08 00:00:00.000,Greatest Filipino Animation: I love everything about this movie! From story to the animation itself! There's more to it than you saw.,100.0,imdb
breadandhammers,2023-05-12 00:00:00.000,"Delightful: A Cat meets and falls in love with the handsome and rich Wolf of her dreams, despite having an ordinary Dog boyfriend. This is a loving send-up of Filipino soap operas, with a touch of raunch and a lot of charm. The film ends with Nimfa getting pregnant with Roger's child, having broken up with both Roger, her dog boyfriend, and Inigo, her wolf boyfriend. She actually has a hinted at romantic relationship with Jerry, the Frog.

What a delightful and funny film. You feel the loving sendup of Filipino soap operas, all carried along with its charming and adorable art style. The film dips into hilarious raunch for a few moments, just enough to spice things up, but is still pretty elevated. A wonderful film. Personally, I don't think of this as a ""dirty"" film.",,imdb
djked,2020-09-26 13:36:05.362,"It's a first, so I'll give this one a try and pretend that I didn't know someone, who is a pathetic excuse for a human being, have voiced one of the characters here. The film's title fits him.",,ltbx
fiel,2020-10-07 00:00:00.000,:/,,ltbx
vxhn,2020-10-29 00:00:00.000,"Ang cute ng pelikulang ‘to! Aliw ako sa mga pun jokes sa mga background—Jolibog, unang kagat, tinapay lahat.",100.0,ltbx
ruke256,2020-10-29 00:00:00.000,"I was pretty much on the bandwagon with this movie, mostly because of the devoted effort that the animators have worked on from Rocketsheep Studio's last film from 2016, Saving Sally, a beautifully made film mixing animated and live-action elements in a seamless polish, only to be pulled down with a standard plot and intolerable characters. So even with my skewed expectations for this film, I still do hope that this would fare better, and...It does, but it does not at the same time. So I may as well start out with the cons before the pros, and these have to do with the story and themes itself and how the tone can clash with the animation. Given that it's rated 18, the themes that it tackles do fit well, but how they are executed is in poor taste, which does remind me of how Saving Sally executes its own mature themes, but at least this film gives these themes a bit more room for discussion, even if it's dealt with in a sour, and sometimes questionable manner. The story is simple yet dramatic and can hit some good moments. I just wished it was a bit longer and does not cut through dramatic scene to dramatic scene so quickly, which made the resolution and ending so spotty, unsatisfying, and utterly rushed. The overall tone can clash with the animation in a consistent way, as some scenes do not mesh well with the hyperbolic nature of the animation, which can make some of the melodramatic scenes to be unfit and oddly uncomfortable with the cinematic and energetic flow of the animation.Pushing the flaws aside, I will say that the animation is excellent all throughout. Smooth, expressive, and gives the characters a lot of personality. The backgrounds are detailed with anthro versions of real-life brands, mottos, and references which gives more attention to detail to the movie. And the performances for the most part are also in their A-game as well, especially Angelica Panganiban.Even despite my mixed feelings for this movie, I still do want to convince everyone to watch the film, because if the film managed to succeed in its streaming sales, then that would determine how many animated films would go down the line in the years to come. And hey, with the animation this good, who wouldn't be excited for more locally animated films such as this one?",100.0,ltbx
christianserdon,2020-10-29 00:00:00.000,"Plotwise, it's cliche. The characters are horrible and even the titular role isn't really admirable nor rootable at the very least. The puns are enjoyable every once in a while, though.Still it's good to see that the country is progressing when it comes to making animated films like this.",80.0,ltbx
janyuan,2020-10-29 00:00:00.000,feel ko magkakasundo si elsa (jowable) tsaka si nimfa kung sakaling magkakilala sila. masyadong uhaw na uhaw sa etits???? ¿?,80.0,ltbx
sanakim,2020-10-29 00:00:00.000,"-super funny like,, i haven't laughed at a movie like this recently!!-shows how you can never escape toxicity in terms of love and friendship-being too ambitious will get you nothing tsk tsk",100.0,ltbx
rafbautista,2020-10-29 00:00:00.000,"I think it’s pretty good. It’s fun to watch, has strong voice acting, and has a well-detailed world. The only problem I have is that the story is a bit basic and that one of the voice actors is R**in P**illa",100.0,ltbx
dennisthemenace,2020-10-29 00:00:00.000,"Commendable for its animation, however, the story is as usual deals with kabit kabit which we’ve already seen so many times in Philippine Cinema. Don’t get me started with that scene with the radio DJ. Ugh.It has its political easter eggs but it was too safe.",100.0,ltbx
helloonasty,2020-10-29 00:00:00.000,"I honestly hate the voice acting and the typical love trope in this movie. The animation however was enjoyable and entertaining, fun and unique to watch and would like to see more from the philippine animation industry.",40.0,ltbx
niborquinones,2020-10-29 00:00:00.000,"Low expectations because Saving Sally is disappointing af lolEntertaining at best, questionable morals at worst. The animation is very good though. Lots of funny sight gags and admirable attention to detail.My namesake can choke on his Jolibog.",100.0,ltbx
_ivanpasia,2020-10-29 06:33:09.945,Honestly not bad when it comes to the execution and look of the whole film. It's a reflection of a story that actually happens in this age. It's aytt,100.0,ltbx
hilarion,2020-10-29 00:00:00.000,Distinctly Pinoy story (and I mean Pinoy with problematic tropes and questionable decisions lol) and AMAZING animation. Pretty much it for me.,100.0,ltbx
philbertdy,2020-10-29 00:00:00.000,"Yeah, I hate this. I guess the film deserves credit for its look, which is genuinely appealing and clearly the work of artists who put a lot of thought into the details of this animal version of the Philippines. The animation is constrained, certainly, but it manages to create a strong sense of movement and action when it needs to. But yeah, I hate it. This story seems to have been inspired by that completely reprehensible call-in radio show where…",40.0,ltbx
pkhysn,2020-10-29 00:00:00.000,"It's THE CLIMB.Again and again, hiwalayan niyo nalang muna kung hindi niyo na gusto bago kayo humanap ng iba. Please lang gyod.P.S Mga animal gyod diay sila. Literally and figuratively.P.S (2) It's the puns and humor for me.",100.0,ltbx
antonioagregado,2020-10-29 00:00:00.000,"“Jolibog, unang kagat, tinapay lahat.”",80.0,ltbx
issavers,2020-10-29 00:00:00.000,typical na toxic romance-infidelity tropes but the stars are bc the animation is pretty,80.0,ltbx
hotgirl,2020-10-29 00:00:00.000,"more local animation pls!! except the infidelity, toxic masculinity, downgrading of janitors, teen mom.witty ng mga names ng lugar! nakisama si nimfa sa welga!!! solid ka gurl",60.0,ltbx
crimsonvanilla,2020-10-29 00:00:00.000,4 stars for the animation,100.0,ltbx
smlda,2020-10-29 00:00:00.000,loved the art!!! but man that plot needed some work,100.0,ltbx
mikaacoco,2020-10-29 00:00:00.000,"Thought I'd support this film as it's a first in the PH. I saw people's dislike for the story and I can definitely see why, but aside from that, the attention to detail is amazing.",80.0,ltbx
dcboy129,2020-10-29 00:00:00.000,"Lol the wasted potential on the story and the use of animation as more than a comedic medium. Would've wanted to see more of it as a unique and cohesive story rather than problematic and stereotypical. Other than that the animation is great, props to all the artists who worked on this. Hoping to see more local animation films in the near future.",100.0,ltbx
prioryofsion,2020-10-29 00:00:00.000,"Nagka mali man tayo sa buhay, maraming tukso at pagsubok man ang dumaan at hindi napag tagumpayan, ito yung mag bibigay sa atin ng mga aral at ng tamang taong mag bibigay ng kasiyahan at kakontentohan natin sa buhay.Sobrang warm and nostalgic ng feeling nitong palabas na ito. Mejo naiiyak na nga ako nung ending scene. Sana hindi ito ang huli ng mga ganitong animation sa pilipinas sana magkaroon pa, sana.",100.0,ltbx
rainyclear,2020-10-29 00:00:00.000,Oks ung animation but Darryl Yap ghost wrote this.Same vibes as Jowable pero di siya magkamayaw sa jowa niya.,80.0,ltbx
yogiieebear,2020-10-29 00:00:00.000,"2/5I’m giving this score for what its animation is though the story isn’t really anything (if so, it’s like a more or less a rewrite of Jowable). The jokes are fun but stales over time, the references over the animation are fun to look at and get a quick laugh.",80.0,ltbx
sensate,2020-10-29 00:00:00.000,kairita at pangit ng boses ni robin. matic cancel kapag dds. dito ako natawa nang bonnga: expensive perfume: Alin Dog,60.0,ltbx
