username,date,review_text,rating,source
00_lvrei,,"apaka-toxic ni primo !!! my heart physically aches for george especially nung di siya nakaabot sa exams just to take care of wasted primo. if there's one thing I learned from this movie, it is to never waste an opportunity to grow just for a man child. sobrang sakit siguro na makita yung friends mo na malapit nang marating yung pangarap niya tapos you are left behind dahil sa mga desisyon mo sa buhay. kahit pa binigyan nila ng redemption arc si primo sa latter part auq pa rin sa kanya yun lang hahahahah !!",80.0,ltbx
holdnogrudge,,"didn’t rewatch this film purposely, people around me just happened to watch this film… nabuhay na naman tuloy yung galit ko kay primo",,ltbx
mijeybu,,,140.0,ltbx
weimawie,,Jusko walang kwenta si primo hahahahahahha nakakaawa si george,80.0,ltbx
maphia,,"This is the best performance of Kathryn Bernardo for me. The way this film depicts real life relationships, especially the long ones, really affects its viewers. Even if I am single, I would relate to their stuggles and story. My favorite Kathniel film of all time for sure.",200.0,ltbx
tanizakixy,,first fight (debate) orange and green shirtpainful fight (rain scene) orange and green shirt still,120.0,ltbx
j0cson,,ang galing umiyak ni kathryn,200.0,ltbx
alvinjames_,,"“Patience.”This is the moral of the movie. George and Primo showed a realistic relationship. It is not always a romantic one, sometimes it can be sad and heartbreaking. They let each other because they are tired — but letting go each other makes them grow and be the person they want to be. It is a matter of staying through thick and thin, through your darkest days. It is all about the patience we have in love. Sometimes we get tired, but it doesn't mean we don't want anymore. We just get tired, but we can rest.Maybe one of the lines that I can forget is, “we cannot survive to a battle if we fight each other, but staying together can conquer the battle.”This is one of the best Filipino movie I've ever watch, and undeniably the best KathNiel film ever produced. No doubt, this movie is the 2nd Highgest Grossing Filipino of all time. A masterpiece.",160.0,ltbx
yanieverse,,wish i didn't cry for this movie but damn fck i did  BOBO MO GEORGE ARGH ANG PANGET NG UGALI MO PRIMOang galing mo talaga umacting miss kath lowbyu so much ikaw ang bumuhat sa pelikulang ito,120.0,ltbx
babybols,,i hate you primo. selfish emo bastard. i cried tho in the end. kathryn REALLY carried this movie my god. what was the point of amsterdam?? darren can stay blind  george shldve been a doctor man why wld she go back to him pucha he is a PESTE!!! i love the gay friend and tita lola ,120.0,ltbx
love_by_aji,,kath carried,80.0,ltbx
trishamariae,,"my brain, randomly: palibhasa kasi alam na alam mo kung paano ako kunin eh!!!! isang ngiti, isang kanta, isang yakap, isang sorry....wala!!!! umiikot na ulit yong mundo ko. matalino akong tao eh, pero pagdating sayo ewan ko, natatanga ako.((TANGINA MO PRIMO!!!))",160.0,ltbx
randallrbjnt,,i need kathryn's monologues tattooed into my eyelids,160.0,ltbx
lugawan,,george naman,,ltbx
queenmimsy,,tanga ni george potah bumalik pa,,ltbx
nuwandaxx,,kathryn bernardo carried this movie so hard she had to take a break and did Hello Love Goodbye aka her best movie,80.0,ltbx
filmandher,,she kinda grew on me…,120.0,ltbx
adillafri,,tell us about the sweet sour of life,120.0,ltbx
sooyoungfilms,,would've been three stars if they didn't end up together.,80.0,ltbx
zannen_,,Kalasag ulan salidaha oy5 kay beautiful people ang mga artistas,200.0,ltbx
kuyaed,,"I liked this more than I expected. My expectations were so much lower than what I got.I just wished they deviated away from romcom because they definitely tried that out a bit for the first act, and for me it feels too forced.When the serious tone went on for the second act until it ended, that mood and pace worked for me better. I feel like they should've just stuck to that. But I get the romcom execution of the first act since they want to engage audience better.Good one to watch if you want a introspection about the sours of life and love. Not a fun one though so expect emotions.",140.0,ltbx
miguelhoraxio,,nakita ko lang sa twitter ayun napapanood tuloy ako,120.0,ltbx
abigailgzmn,,"Love the cold open--contemporary and innovative.Primo's a fucking red flag, egocentrically manipulative as ever. But perhaps Tita Lola was the real antagonist here, charot.Galing ng EO product placement.Very cliché, nakaka-cringe, as always with KathNiel films, but it’s their best films I've watched.I was wondering bakit kailangan umuulan pag may strong heartfelt scene between the two of them. I figured it must be symbolism for George's turmoiled feelings toward Primo. Tulips are definitely a symbolism as well for George's ideal partner. Primo gave him a plastic ones when he was courting her.Background music or the musical scoring can be a little excessive in some scenes, but I realized that commercial local films do be like that. Was it necessary to resolve George and her brother's daddy issue? I don't think that was essential, but the film could've been done without the Amsterdam trip. It could've ended with when they already sold the house. The whole Amsterdam trip and there on was like a second act.Overall, despite being cliche, good execution. Deserve naman ang pagiging batikan ni Direk Cathy Garcia-Molina, time-tested na rin. Subok na ng panahon, ganern.George's mistake was falling in love with Primo's potential.Personally, I resonate with George with her territorial and sungit trait; but damn, she's right, she's dumb and weak when it comes to the fucking guy. I WOULDN'T tolerate Primo's comeback if I were her. Pero feel ko binalikan niya lang din out of convenience and because first and only love. Fave character ko si Mikko dito, the very logical friend.Disappointing ending for me, rupok.",120.0,ltbx
glaii,,would have been better if kath ended up w ME INSTEAD mga lalaki walang kwentang may fragile ego at feeling oppressed,120.0,ltbx
sexual_tryst,,kathryn bernardo carried this,120.0,ltbx
fuzzymachines,,george is crazy i would have never gotten back with him,120.0,ltbx
ayncognito,,darren im sorry but you're up for elimination,100.0,ltbx
toriteriyakidon,,PUTANGINANG PASSION YANSa sinehan ko rin ‘to pinanood for my first viewing. This is my second time watching pero same takeaway pa rin. Yung naka-all caps. Hahaha.,120.0,ltbx
hotgirl,,kuha ni primo galit ko d2 ,20.0,ltbx
aloisaaa,,wag tayo makikipagbalikan sa ex pag sinuka mo yung pagkain siyempre di mo naman kakainin ulit (fuck u primo),80.0,ltbx
anymated,,Peak Kathryn and Daniel <3,200.0,ltbx
lenitude,,sobbed in the theater next to my dad,200.0,ltbx
thecqvalry,,mas magugustuhan ko 'to kung hindi sila nagkabalikan,80.0,ltbx
marlboroasul,,umuwi ka na baby ....,120.0,ltbx
himizuxx,,idk why pinanood ko to pero i like the iconic 'pagod na pagod na ako' scene cuz same george ,140.0,ltbx
katmmercado,,would have been a perfect 5 if kathryn successfully girlbossed through all this liKE WDYM I LOVE YOU AGAIN OVER A 2-YEAR-OLD LETTER....but kathryn really is that girl give her her flowers,120.0,ltbx
kiceonmywristel,,WAHHHHHH AGGAAAAAH :(((But :DDD,200.0,ltbx
pleuie,,i legit cry every time i watch this,,ltbx
edw_rld,,"tears were shed. at pinamukha talaga sa 'kin gaano ako ka-hopeless romantic kasi mAHUHULOG DIN ULIT TALAGA KO  like im herrrrpero tbh, i would be more pissed off sa ending if naipakita how much it meant to george to get into med school and become a doctor instead of being this malabnaw na plot device (im just saying shit omg idk what these mean!)",160.0,ltbx
switchboard3000,,galing ng acting ni Kath grabe,120.0,ltbx
kizimndz,,dapat di mo na binalikan eh ,140.0,ltbx
moonheead,,"not all filipino romance movies should have happy endings (tangina mo primo, george sorry pero ang tanga mo din) Still enjoyed this because of kathniel tho!!this is also a sign na huwag na natin i-gatekeep ang mga artists sa playlist natin hahaha",120.0,ltbx
kyesjolie,,agoi,160.0,ltbx
vntimatchalatte,,agoi (2),160.0,ltbx
kristinacsandra,,tangina mo talaga primo at lintek na passion na ‘yan.,100.0,ltbx
hirokazufilm,,"akala ko naman maganda dahil lagi ko nakikita to sa social media hahahaha daming ingay lang, di naman minsan effective sa scene",,ltbx
coffeeandbed,,para kay kathryn ang three stars,120.0,ltbx
sighquarius,,no bc i’ll also leave a man who can’t clean for shit!,140.0,ltbx
danieiie,,Mahalkita daniel,40.0,ltbx
indieminu,,buhat na buhat ni kathryn,80.0,ltbx
kat426,,primo nanggagalaiti ako !!!! primo naiinlab ako!!!! primo pagod na pagod na ako umiyak!!!,160.0,ltbx
_jackief,,putang INA mo primo sana namatay ka nalang,100.0,ltbx
jaowi,,"PALIBHASA KASI ALAM NA ALAM MO KUNG PAANO AKO KUKUNIN E ISANG NGITI, ISANG KANTA, ISANG YAKAP ISANG SORRY  UMIIKOT NA ULIT YUNG MUNDO K SAU ",160.0,ltbx
valenrie,,pissed me OFF. i want better for george. i want better for women,,ltbx
tamboexit,, TriNoma,,ltbx
nikkibon,,primo why naman ganonBtw pinanood ko to bc of the clip sa twt hahahdhs HENCE !,120.0,ltbx
ami3l,,wala tong inambag sa buhay ko… natakot lang ako sa diabetic retinopathy,80.0,ltbx
meoaui,,"The two stars are solely for Kathryn's PAGOD NA PAGOD NA PAGOD NA PAGOD NA AKO coz daaaamn the delivery is so good I felt thatRemove that scene and I will immediately give this a 0/5 for romanticizing problematic relationships. Primo is everything I don't want in a partner. George has very low self-esteem and lacks self-respect. Sacrificing your future and missing your NMAT exam for a prideful but useless man??? PURE IDIOCY. I can't even side nor feel pity for George. I'm so sorry sweet but you brought this upon yourself. I want to hit her in the head at least just once to wake her up from her own stupidity. I didn't even finish this movie. I stopped watching around the 30-minute mark when I was hinted that they'll surely get back together again. I just hate the ""going blind for love"" trope so much. This is a good portrayal of stupid immature young love, though, I'll give them that. Other than that, the story has no redeeming qualities unless it's rewritten so that Primo and George don't get back together again.",80.0,ltbx
deepdownlow,,"now i get why filipinos eat this film up. shit ass story telling. how did it go from heavy to rom-com real quick? it had all the elements of a drama typical filipinos like: familial issues and relationships, prominent love team, mainstream production company, toxic character traits that make you SEETHE. bernardo carried this film with her acting otherwise it would be absolute trash.",80.0,ltbx
jvderachelle,,george look at me this isn’t u,180.0,ltbx
denveee,,pakapalan ng mukha challenge tapos kalaban mo si primo,,ltbx
sindii,,darren anuba HSHSHSHSHAHAHAHAHAH,,ltbx
jologs2002,,2 stars lang and only bc of kathryn’s performance,80.0,ltbx
iovmono,,TANGINA MO PRIMO,80.0,ltbx
mikowinter,,"As much as I love Kathryn and Daniel's dynamic, holy shit why did they end up back together?? I'm honestly pissed after I got the full context of the film now (Since Twitter showed me a ton of clips from this movie). To think that George would've been in med school the same way Miko is baffles me. Maybe at the end the director wanted to tie everything together by saying that anyone can change and deserves a second…",100.0,ltbx
lrok,,kung aq un di kita gaganunen,140.0,ltbx
jadeandfilms,,"Paalala, wag po nating gawing mundo ang dapat tao lang at TANGINA MO PRIMO BUTI NA LANG POGI KA",120.0,ltbx
calumpagpatrise,,"Trending sa Twitter kaya pinanood ko ulit. Lolz! Sana lahat ng buyers sasabihan mo lang na may ""history"" at ""memories"" yung binebenta mo, bibili na agad. HAHAHA eme",120.0,ltbx
_pol,,"bad acting daniel + fucking useless man child of a character.. however, still giving it 2 stars because 1) kathryn so fucking beautiful 2) shes a good actor. on second thought im giving it 1.5, less .5 because WHAT THE HELL WAS THAT GEORGE?????? self worth much??",60.0,ltbx
phielipino,,ive been to this filipino restaurant in renton w mikey twice and both times they had this movie on. either they watch it every day or it was just meant to be (i still dont actually know the plot this is more for diaristic purposes),,ltbx
wubimeowmi,,hindi ko tinapos pero ire-rate ko parin bakeT????? bwisit na bwisit ako beh. tangina ganto ba gusto niyong representation ng mga babae sa media? nakukuha sa manipulative shit at gaslighting?? sobrang frustrating ugh. gets naman ang goal ay kilig kilig lovestory pero pwede ba yung may substance naman na actually pwede may makuha dito- di lang nila pinush nang malala. sobrang sayang ang huhusay pa naman ng casts1 star ay dahil ang ganda ganda ni kath,40.0,ltbx
sohndroid,,in fairness kuhang kuha ni darren inis ko hajean garcia is so motherprimo na may internalized misogynygeorge na tanga paren hanggang dulo,140.0,ltbx
czyyshdubs,,Honestly it would’ve been better if they didn’t end up together,200.0,ltbx
movielover669,,k lng. ang galing ni kath ,120.0,ltbx
bigloafpedlar,,George should've talked to my mom para hindi na niya binalikan gitaristang ex niya,100.0,ltbx
ypiretriaa,,kinda boringI'll rewatch this in the future,80.0,ltbx
mtburchell,,Very cute if you ignore Primo’s childish and pabigat ways in the first part,160.0,ltbx
byhelleaa,,buhat na buhat ni madam,80.0,ltbx
soobsohn,,yikesssss.... i needed to see this,80.0,ltbx
raelle,,primo >> ,180.0,ltbx
aditheworld,,“ang tanga ni ate girl” lang talaga naisip ko throughout the film,80.0,ltbx
rundomron,,kathryn doing gawad urian acting while darren doing school project acting lol,120.0,ltbx
reintrovert,,"Ok second KathNiel movie I’ve ever watched and I can see na meron nga talagang chemistry itong dalawa. Realistic yung portrayals nung characters in their lives as poor struggling individuals with idealistic aspirations in life, intertwined with their own idealized dreams as a couple & the longevity of their relationship— of which the reality of it turns on them and affects their goals in life. I just wish di sila nakipagbalikan at the last minute, that would’ve been much more impactful imo.",160.0,ltbx
leawieee,,"This would’ve been better if they didn’t end up together,, but it’s a CGM film ofc it’s gonna have a happy ending! Best part: Ms. Odette KhanBad parts: kakapalan ng mukha ni Primo, karupokan ni George, and the insensitiveness of Yohan",120.0,ltbx
takoiyaki,,tang ina mo primo ,120.0,ltbx
etherealalien,,I hate the miscommunication trope…please y’all could’ve just talked,80.0,ltbx
micatsa,,"Realistic, emotional, and heartwarming. I really admire Primo’s character development to fight for his love for George. He was tireless in spite of the actuality that George repeatedly rejected his return in her life, that’s where I deeply feel that Primo’s true love for George kept going and it also kept on growing profusely as the time passed by. In the middle of the story, I was kind of confused by Primo’s behavior which was still blurry about where will they take their future to? I daresay it’s very related to the lives in the present time, especially for couples who want to bring their relationships to an improved or more serious level. I feel like watching real life experiences of a couple who became wise with their life experiences, hence it feels so real. It truly deserves a great rating!",180.0,ltbx
flaeiou,,"huy?? so walay ambag si primo ever since sa mga bayrunon????? yawa if ako ray gabayad sa mga bills, ako pay manghugas, og manghinlo sa balay for how many fucking years??? i'll avoid u like the goddamn plague",40.0,ltbx
sonarchy,,real life doesn't really work that way,80.0,ltbx
nikkoaeris,,"I would actually rate this 5 stars but Primo said memories instead of ""alaala""",140.0,ltbx
jaiiu,,tangina mo primo,40.0,ltbx
abortions,,straight people are so problematic,160.0,ltbx
donnicore,,the unstoppable duo of daniel and kathryn eats again i fear #filipinodrama but i literally disliked primo so bad like he had my sister in the trenches but he redeemed himself…I GUESS.,200.0,ltbx
24framesofjay,,this movie f*cked me up so bad,200.0,ltbx
sayakasaeki,,jusq,60.0,ltbx
krayolabrutal,,wag kayo bumalik sa ex niyo hindi niyo yun deserve lalo ka na george !,100.0,ltbx
molecrs,,i only needed the george angst and nothing more,120.0,ltbx
daxeene,,I HATE YOU PRIMO nagtatampo ako sakanya hindi ko sya maMIMISS !!!,160.0,ltbx
cryellie,,3 IS FOR AMSTERDAM ONLY … primo WTF?!! N GEORGE?? NMAT??? ,120.0,ltbx
triciapestano,,slowly reeling back into my kathniel era <333,200.0,ltbx
ooohbebi,,kung ako yan george di kita gaganyanin,120.0,ltbx
jakeude,,"just gave me a mnemonic of how amazingly terrible filipino romance films are in this current generation+ too much romanticization of failed relationships, can we stop creating redemption arcs for toxic exes already ",20.0,ltbx
aeronoia,,leche nakakapikon si primo,80.0,ltbx
ninjuhhh,,"even now, i still feel that it would have been better if jo and primo didn’t end up together",120.0,ltbx
markewry,,didnt expect to like it,,ltbx
drunkicarus,,"sorry, I can't hate this film because Kathryn Bernardo's performance was so ",160.0,ltbx
lingyuzh,,<3,200.0,ltbx
whitewolfswife,,"letterboxd acc to ni kathryn bernardo. ayan ka na naman e, palibhasa kasi, alam na alam mo kung paano ko kunin e, isang ngiti, isang kanta, isang akap, wala umiikot na ulit mundo ko. matalino akong tao e, pero pag dating sayo, ewan natatanga ko.side note: nakakainis pa rin yung di sya nag-take ng nmat bec of primo … like what the hell",60.0,ltbx
yeeyloo,,katheryne bernardo's acting literally carried the movie,100.0,ltbx
mochimonch,,slayage,180.0,ltbx
channichanyeol,,rewatched !! shuta mas naintindihan ko na every parts ng film na to ngayon… nung una tlg feel ko sobrang tanga ni george sa part na binalikan niya pa si primo. pero parang ngayon narerealize ko na baka gayahin ko rin si george. LOL love can make u so bobo u can’t even predict it.,160.0,ltbx
takiyaki,,I fucking hate primo so much,160.0,ltbx
akosim4k,,"parang ewan, si kathryn lang ok",,ltbx
doraemyeon,,ang lunch ko ay sama ng loob,20.0,ltbx
filmforhim,,good and bad movie,80.0,ltbx
pinkboxed,,could've been better if they didn't end up tgt idk,160.0,ltbx
eisoon,,kung ako yan ok lang kahit red flag si primo basta araw-araw nya kong kakant—[GUNSHOTS],140.0,ltbx
loveyous,,kathyrn carried!!!!!!! tbh the amsterdam part of the film dragged on a bit too much. i feel like they could have paced that better. OH and also the ending...... the final scene ruins the movie sorry,140.0,ltbx
movieofmel,,why did i cry to this movie kathryn ate,120.0,ltbx
amanita222,,she should've left him.,120.0,ltbx
starrybrie,,naboboysit talaga ko sa mga lalake fr. unang una na jan si darren,100.0,ltbx
akosisamimi,,i hate u primo,200.0,ltbx
thewelmon,,"YES. I knew that this movie would probably be hard hitting but not this much. This movie was so freaking good idgaf like yes a little cliché at times but it was the right amount. There were some scenes that were supposed to be serious but I couldn’t help but laugh because I thought it was unserious but overall really good watch, I CRIED IDK",120.0,ltbx
_ryanista,,nagulat ako nung biglang nag-shift yung tone after ng breaking point ni george at primo pero naalala ko na romcom pa nga rin pala to at its core ..,120.0,ltbx
kruwie,,sorry pero tangina corny cringe etc etc nasayang oras ko dito pero sige at least napanood ko na pwede ko nang sabihin sa iba,80.0,ltbx
dianne_0911,,a man does what a man does...ruin everything!i loved it especially kathryn bernardo *twirls around*,200.0,ltbx
drunksaba,,Hindi dapat ninanakaw ng pag-ibig kung sino ka at ang mga nais mong maging.- binuhat ni kathryn- george im sorry lang naaalala kong linya ni daniel padila,120.0,ltbx
mouselamp,,taena bakit ba lagi nalang bad boy si daniel sa mga palabas niya wala bang bago,40.0,ltbx
sheyaa,,kathryn's acting was superb,80.0,ltbx
just_trash,,im folding like a lawn chair rn,160.0,ltbx
just_trash,,the “he loves her more” trope is gonna do it for me every. single. time.,160.0,ltbx
jaimiellekc,,di pantay ng level ng pag-acting si kath pati si daniel HSHAHAHA ang galing ni kath,120.0,ltbx
shawn2573y,,"OK NA EHH PWEDE NA EH, PERO DAPAT HINAYAAN NYO NA LANG NA MATAPOS UNG KWENTO, KUNG SINO MAN NAKAKAKITA NITO, PAGPUPUNTA NA SILA SA AMSTERDAM SARADO NYO NA AGAD UNG LAPTOP NYO",160.0,ltbx
hailwanda,,tangina mo primo,80.0,ltbx
ronnivore,,"Another day, another Star Cinema film forcing us to root for another problematic relationship. And once again, Kathryn Bernardo acted circles around Daniel Padilla. ""The Hows of Us"" does not do justice to her talents.[Watched on Kapamilya Channel]",100.0,ltbx
filmsactress,,kathryn carried,120.0,ltbx
alelielouris,,pakyu primo mamamatay akong galit sayo,80.0,ltbx
bigbossrmos,,A half leap to typical Filipino Rom MoviesThis is KathNiel's best performance which sadly fell to the typical Star Cinema romance trope. The premise of the story is great... the story telling wasn't. The middle section of the film felt irrelevant and could have been removed all together. The saving grace? KathNiel's performance. Kathryn did well .. but this must be Daniel's most impressive acting performance. This is a movie better than it's previous and even future contemporaries... but only for a half leap,120.0,ltbx
gongchay,,Girl boss and a loser…,140.0,ltbx
hijubeng,,GALING NI KATHRYN SHETTANG INA TALAGA PRIMO MATALINO AKONG TAO EH! PERO PAGDATING SAYO EWAN KO NATATANGA AKO,200.0,ltbx
vert04,,ang pangit putangina im so tired of the gaslightingtanginamo rin darren sana ako nalang nagacting haup k man,20.0,ltbx
filmorethe,,"personally, I disliked some of the actors' acting here in the movie. on the other hand, kathryn’s acting was superior and really felt ""true to life."" for some reason, I couldn't watch some of the scenes—I skipped it lol—even though some may say that it's a movie that depicts ""reality."" i wouldn't finish the movie if it wasn't for kath’s portrayal—what I didn't like about her character is that for 7 YEARS of her suffering, she still chose to go…",,ltbx
brimst0ned,,soaper tru lng ng lhat lahat ++ GANDA ACTING NI KATHRYN D2 PLSSS -1 star kse darren nuginagawa m,160.0,ltbx
shereeeeen,,the epitome of romanticizing toxic behaviors,120.0,ltbx
jadabrtlm,,tarantado,100.0,ltbx
nodisaur,,primo ultra mega red flag DAPAT IWANAN,100.0,ltbx
sanahgi,,gusto ko lang naman na makitang maging doctor si george!!,140.0,ltbx
r4zhy26,,My comfort movie. Katniel forever bro  I love them sm they’re literally my parents in another universe,200.0,ltbx
placebos,,BWISET NA PRIMO NA YN AMPOTA..,60.0,ltbx
pileppp,,I remember me and my ex watching all of the kathniel movies (at her request) and this one is by far my favorite idk,120.0,ltbx
abiior_,,"i could never, y'all stay safe though",120.0,ltbx
maurebel,,said it once and i'll say it again !! DI NA DAPAT SILA NAGKABALIKAN SA HULI AND THAT I HAVE QUESTIONS TULAD NG KUNG NATULOY BA MAGING DOKTOR SI GEORGE AT NAGKAROON NANG MAAYOS NA TRABAHO SI PRIMO,60.0,ltbx
autumnvaleriana,,GET A JOB AND STAY AWAY FROM HER,120.0,ltbx
paigebonayao,,nde nmn ata sila umaacting eh,120.0,ltbx
peterpiperpick,,an iba primo?,160.0,ltbx
clarenceken,,"AAAACCCKKKKK GEORGE GREEN FLAG.  primo, amaccana!(MY GRILLFRIENDS REVIEW NOT MINE!!! >:|.....may sarili naman syang letterboxd )",80.0,ltbx
gautamis,,"honestly, the first half was quite good. idk about the amsterdam trip, yt people’s acting made it worse. also i learned a new word today: bakla  (me)",100.0,ltbx
franceisclear,,oo ! pagod na pagod na pagod na ko sa pipelines na ganito !,60.0,ltbx
vi11areal,,"at least aware si george na dating (until the end LMFAO) tanga siya.honestly speaking, this movie will never fail at making me cry ONLY because of kathryn's acting. mothered. carried. other than that, the concept and theme weren't giving. the script was ok, the lines were remarkable, but the concept and theme? paikot-ikot sa romanticization of toxic relationships.",120.0,ltbx
odinofcodin,,Ang lupet. Ang mature.,140.0,ltbx
instantshincup,,they shouldn't have gotten back together,80.0,ltbx
ishidotgeee,,"kathniel never fails to amaze me, watching this in the cinema just made my experience a whole lot better. if i ever have a foreigner friends who wants to watch a filipino romance film, i would definitely suggest this.this movie is exceptionally well written and 'original/unique (for some reason). you can never doubt either both character's performance because they are so good. plus, i'm so sorry to say this but darren? kumanta ka na lang please, your acting sucks.",160.0,ltbx
chrlize,,I just wanted her to be a doctor man ,,ltbx
orion_tanuk1,,...the grass is always greener on the other sideno. the grass is greener where you water it.,,ltbx
trice_ss,,kathryn carried (real),120.0,ltbx
japschae,,ayos lang magpahinga nang magkahiwalay. sana all na lang,200.0,ltbx
pearlsun,,minus one star dahil sabi ng kapatid ko ako si kathryn tas yung ex ko noon si daniel dito ampota ang sakit tuloy nung jeepney scene,160.0,ltbx
clairoll,,"habang ikaw, ayan! patuloy lang sa lintik na passion na yan. PURO PASSION. HINDI TAYO MAPAPAKAIN NG PASSION NA YAN!as a self-proclaimed artist:u can either disappoint ppl around u or be an artist. no in between.",,ltbx
ashreifran,,"THIS IS MY FAVORITE KATHNIEL MOVIE!!! Please the emotions they portrayed made me so emotional, i love how they both grew and learned a lot of lessons together. This also touched my heart~~ #KathnielFanForever hehehehehheheheheheh",200.0,ltbx
sh_gustilo,,san ba ako makaka subscribe ng red flag (premium),180.0,ltbx
kristinaprym,,Panget pero galing parin mag act nila DJ and Kathryn.,100.0,ltbx
stherrm,,cutest movie and the fact that they’re together in real life makes it even better,200.0,ltbx
