username,date,review_text,rating,source
xpumpkinspice,,"The Hows of UsOne of the best KathNiel films for me. It’s one of my feel-good Pinoy movies. I’ve seen it three times, and I just had some realizations about relationships.After rewatching it, I found myself reflecting again on how love can be so complicated. What makes it more meaningful is not just the love itself—but the presence of understanding, respect, and the choice to keep showing up for each other. It’s not always about grand gestures. Sometimes, it’s the quiet assurance, the willingness to stay, and the help you give one another when things get tough that matter the most.Love is not always filled with happy or funny days—there will be real struggles to face. But having a partner who truly gets you, who won’t make you feel like a burden even in your lowest moments—that’s something else. It’s a different kind of feeling when you’re sharing your life with someone who sees your mess and still chooses to stay. That kind of love feels safe. It feels like home.Living together isn’t easy. But what makes it bearable—even beautiful—is when both people make the choice to stay, to fight for the love they share. It should never be one-sided. A relationship thrives when both partners are making an effort. Communication, respect, loyalty, and understanding—these are the pillars that hold love together.Sharing a home means sharing lives, dreams, flaws, and even pain. It’s not just about romance; it’s about commitment. It’s choosing each other every day, even in the midst of exhaustion, misunderstandings, and storms. There will be moments of doubt, words spoken in anger, and days when love feels more like a burden than a comfort—but staying, especially during the storm, is what love truly asks of us.Before entering a lifelong commitment, ask yourself:Are you truly ready to live with someone through the calm and the chaos, the ease and the effort?Are you ready to love, not just in the good times—but especially in the hardest ones?Are you ready to choose them again and again, even when it’s no longer easy?The Hows of Us doesn’t just show us what love looks like—it shows us what it takes. And if you’re with the right person, every hardship turns into something beautiful.",160.0,ltbx
eldian,,matalino akong tao pero ewan ko pagdating sayo natatanga ako,200.0,ltbx
sleepoison,,"""I may not found the reason to stay, but I found a reason to comeback"" ",160.0,ltbx
karubiyun,,"Natatandaan ko to noong una ko tong napanood, kung di ako nag kakamali mga nasa 13 o 14 ako non at sa totoo lang wala akong naramdaman kahit ilang beses ko tong pinanood. Kala ko noon ako yung may problema kase kahit maraming sumakit ang puso sa palabas na ito, hindi pa rin ako umiyak.Ngayong bente na ako, tangina hagulgol ako nang hagulgol. Na para bang kasali ako sa away nila George at Primo, hindi ko alam pero gets ko silang dalawa.",,ltbx
lyanahngrecto,,"how could you give up so easily, how did you not find a reason to stay",200.0,ltbx
fideofideo,,toxic sya masyado pero wow ang acting hehehe ,140.0,ltbx
aur1ne,,grabe iyak ko kaso- ang random ng amsterdam sideplot?- tanginang walang ambag si darren- tangina mo primo- ipagtahimik nyo si primo sa jokes nya tubgkol sa amsterdam pls…..,160.0,ltbx
renzvls,,I love my girlfriend so much,160.0,ltbx
eznupi_,,kms movie,180.0,ltbx
knovve,,"sana makita mo na letter sa ilalim ng ref, raiah",160.0,ltbx
inixou,,pagod na si jo,120.0,ltbx
mrethicall,,"this would not happen irl, just saying",160.0,ltbx
kirsxxten,,Horror film,200.0,ltbx
king_david19,,Cry2 me ani na film huhu,200.0,ltbx
ocdawgz_,,hmmm balikan ko pag may proper opinion na ko sa movie na to,120.0,ltbx
jacaeruss,,hinayaan m na lang sana c primo sa daan..!!!,160.0,ltbx
1ticket4mepls,,okay umacting c kath pag gani2 role nia,160.0,ltbx
aubreyyr,,I cant form a proper opinion for this movie HAHAHA. Oo toxic. Oo gago si Primo. Oo nakakaiyak. Oo nakakakilig. Oo marupok si George and deserves better. Sidenote: I forgot how pogi Daniel Padilla actually is.,140.0,ltbx
marisaya,,May iba na akong papanoorin aside sa She's Dating The Gangster.,140.0,ltbx
sberryshortcake,,Them not ending up together would’ve been the better ending.,100.0,ltbx
trishawithani,,ako ang mas pagod sa inyong dalawa,60.0,ltbx
missdawson,,,,ltbx
filmsiez,,saket pa rin,200.0,ltbx
letterchie,,"lol don't let the same person destroy you again.bitter bc while I was watching this in school, na-jailbooth ako with the girl who ghosted me and started acting like nothing happened. funny!!!!!",80.0,ltbx
mibc670,,umiiyak ,120.0,ltbx
the_berlioz,,"Ang peste kahit gaano kagwapo, peste pa rin yan.Star Cinema really thought they could gaslight us by the sudden shift from heavy drama to romcom-ish. How could I feel kilig when the “batugan na palamunin na makasarili na tine-take advantage ang iniwan na kalahating titulo ng bahay na hindi naman talaga sa kanya in the first place” male lead starts to win back the strong independent female lead who had to give up her dreams once just to clean after his mess. Because I can’t, all I feel is rage and stupidity for George’s side. After going through all of that how can she go back.Napakaunnecessary at forced ng Amsterdam. The reason for going abroad is not even relevant and coherent with the plot of the film. Na para bang gusto lang ng staff and crew na mag abroad.MVP: Mikko ",100.0,ltbx
poliyukii,,"taena mo talaga darren pangit na nga acting, pangit pa ang character ewan ko sayo",120.0,ltbx
embryoasis,,sino nag-ayos ng buhok ni primo? usap lang tayo,120.0,ltbx
elivillamor,,I never get to finish this..,40.0,ltbx
huhuha,,sana ganto rin kami….,200.0,ltbx
eleaouis,,men,140.0,ltbx
sleeppiness,,umuwi k n baby :((((,160.0,ltbx
my_lolita,,"Palibhasa kasi, alam na alam mo kung pa'no 'ko kunin eh!",200.0,ltbx
crys6n,,grabe ka talaga kathh i love her sm,180.0,ltbx
jasminxjewel,,IDC WHAT ANYONE SAYS THIS IS MY FAV KATHNIEL MOVIE HAHAHA,160.0,ltbx
spldrey,,"lowkey hate exes going back together trope but we’ll excuse this one. i can’t blame george for going back to primo kahit ang gago nung lalaki. gets ko why primo left george when he asked if leaving would make her life better. the most important thing is that they became better people, not for the other, but for themselves. pero tangina mo girl i would never miss an exam para sa jowa ko. namamaho na raw sila sa restaurant like omg same kasi hindi ako makalakad nang maayos. ang sakit ng paa ko please awa na lang andami pang event bukas at sa sundayokay seriously tho, ano magandang ointment para sa napasong balat what the freak ang hapdi ng paa ko kapag naglalakad",160.0,ltbx
injelllll,,"In order to win a war... You have to stay together. You don't win a war by fighting each other, you win by fighting together. But in the first place, there should be no war to win, only a journey that you go through. Mas madali kasing umayaw ’pag masakit na, bumitaw ’pag pagod na. Pero ang totoo, ang kailangan niyo lang patience. If you only held on, matututuhan niyo pa rin ang mga ’yan. Mag-ggrow pa rin kayo together. O, look at my plants. Sometimes, they need space to grow at some, they grow better together.INDEED!!!!!",200.0,ltbx
monameei,,"GEORGE ANG RUPOK LANG ??I appreciated Primo's efforts during the time he wanted George back, but I feel like it's not enough. But then again, im not George. I'm proud of them getting through it together again without any resentment towards their previous selves. Even if you do open up to a person of the past again, be cautious and always choose yourself more. Happiness is not limited to relationships, but it applies on how much you love yourself as well.pero hehe ganon din ata ako karupok??? SANA HINDI PO",160.0,ltbx
chomulvr,,"Pag binalik ni Primo yung time ng nmat ni George, doon ako papayag na patawarin siya. nmat yun nmat!!! All the man in George's life failed her, my heart aches for her Okay marupok si George. But do they really love each other o nag ho hold on na lang sila sa memories and unsolved shits nila in the past? Also, ang panget nung binigyan ng ""excuse"" yung pagiging gago ni Primo. Alam niya na nasasaktan niya sa George pero wala siyang ginawa. Tsaka nakakainis lang na kailangan niya magkaroon ng ""traumatic experience"" after niya iwan si George na para bang kailangan siya patawarin kasi may masama rin naman siyang pinagdaanan. Ulol! Pwedeng naransan niya yun pero nasaktan niya pa rin si George. Grabeng panggago yan di ko matanggap yung redemption arc niya. Taena rin ni Yohan HAHAHAHAH sarap batukan eh. Maganda lang talaga yung script, cinematography, tsaka acting ni Kathreen. Sobrang promising din nung unang parts. Di ko lang talaga bet yung ending Inubos nila ang Amsterdam jokes nila dito. Mikko, I was rooting for you ",140.0,ltbx
ririjane,,wala just wanted to rewatch romance na may mabigat na batuhan ng lines. kathryn carried this one!! pero why would you go back??? to the person who destroyed you!!!!!!,140.0,ltbx
dgby,,a 5 stars 5ever. had me in tears at my 10th watch. i have nothing else to add.,200.0,ltbx
laaaines,,"honestly, it's either super tanga mo lang or sobrang mahal mo talaga",200.0,ltbx
renztoicism,,Why are we romanticizing toxic exes anyways?,80.0,ltbx
rebound11,,Filipino classicYou're not a filipino if you haven't watched it yet.,160.0,ltbx
iyhblingit,,My first rom-com movie,160.0,ltbx
ririssante,,tanginamo primo,120.0,ltbx
kyliajoie,,girl why would you take him back,120.0,ltbx
kelcbot,,"she’s so cute i fucking hate him sm, he deadass gave her the brokie hug at one point",140.0,ltbx
pixelayeted,,nakakatangina talaga to panoorin then u realize women experience this in real life. like no shit,80.0,ltbx
useravy,,2 stars sa face card ni kath. pero i really think na hindi niya na dapat binalikan si primo but mehhhhh,80.0,ltbx
xpphases,,hahhaahh bat laging umuulan also tangina mo darren espanto hahha,,ltbx
dandandandan_,,"MATALINO AKONG TAO E, PERO PAGDATING SAYO, EWAN KO, NATATANGA AKO",200.0,ltbx
breadassasin,,"No, this is not a sign to get back with your ex. Kath carried.",140.0,ltbx
mayisheavenly,,saks lang,100.0,ltbx
dxhtskoi,,bakit mo binalikan? smh.,40.0,ltbx
reareads,,girlshutup,140.0,ltbx
babygirlteya,,"of all the people I hate ay mga feeling pavictim na dapat patawarin ka na because you've changed (na para bang ikaw lang ang nasaktan???) and no boundaries on top of that???? nandito pala si darren amp kase sa isip ko ang ending nito is nagend sila nung umalis na si kat sa ulan, walang kwenta pagpunta nila ibang bansa HAHAHAHAHAHA",40.0,ltbx
jamie_4,,bobo,60.0,ltbx
gonexanax,,Hows,200.0,ltbx
unmile,,"movies like this gives me chills bcs like how realistic and relating the plot can be to my life yet when reality hits, it feels like gut punching pain bcs of the guilt i did from the past.",140.0,ltbx
vemod_,,i think kathryn carried all their movies together lol,20.0,ltbx
beansmnr,,"I may not have found a reason to stay, but I found a reason to come back.",160.0,ltbx
motiyacia,,"I remember when I was starting to indulge in Kathniel films, and this ended up being the last movie I watched before they broke up... sobrang sakit talaga.",200.0,ltbx
imvidel,,jo! :( dito ko nakuha yung endearment namin ng ex ko :(wasak din ang puso ko figuratively and literally ,200.0,ltbx
zumihaj,,"hahahahahahahahahahaha can’t deny na umiyak ako, hell this is my guilty pleasure. sana nag exam nalang c george :p",80.0,ltbx
ayatots,,im trapped in a burning restaurant,160.0,ltbx
jajanana_,,the apartment that we won’t share ~ si Jo ay napagod na nga talaga. tabginang pag-ibig yan,140.0,ltbx
elorachin,,tindi rin talaga ng mga linyahan ko dito e,100.0,ltbx
yenooom,,this dude kept licking me bruh ,200.0,ltbx
cherub8_xx,,jo naman....... kailangan nating mag-usap !!!,140.0,ltbx
blackmagicpersn,,i rate this a star for each of the movies in this film,80.0,ltbx
aira00,,"Sila yung couple sa barkada nyo na red flag na yung guy tas dine-defend pa rin at binabalikan kasi 'wala tayong magagawa, mahal ko eh'.",160.0,ltbx
puransu,,Jo,140.0,ltbx
kesiaaldree,,Kathryn the actress that you are. Pero panget pa rin hahahaha stop romanticizing toxic relationships and partners myghad.,80.0,ltbx
machreej,,timeless kathniel movie pero bwiset ka parin primo !!,200.0,ltbx
borbbees,,cant even say i would never miss the nmat for a man kasi nag drop out ako sa college para kay tanginang ex ko all while gumawi ko ang homework para sa kanya,200.0,ltbx
kenborlongan,,"tinanong kita 'ano paborito mong lokal na pelikula' sabi mo 'the hows of us' sabi ko 'ano yun'. pumamewang ka at umiling sa dismaya na para bang gusto mong tanggalin ang pagkapilipino ko. pinaupo mo ako at pinanood natin to. pagpupugay sayo at sa sikmura mong matibay.sabi mo, may iconic na eksena dito -- yung jeep scene na nagkakandarapa si primo sa hulas at lasing, at pilit siyang inaakay ni george kahit pa talikuran niya na yung exam na buong buhay niyang pinaghandaan. lumingon ka ng tingin kasi sabi mo nakalulungkot.pinanood ko ulit to ngayon kasi nakikipag kara-krus ako sa tulog at puyat. sabi mo, may isa pang iconic na eksena dito -- yung monologue ni george na 'pagod na pagod na pagod na ako'. pabiro mong sinabayan bigkasin ni kathryn linya por linya. doon ang pangalawang beses na pumihit ang sikmura ko.napagusapan natin, paano kung ako ang nasa lagay ni primo? babalikan mo ba ako? hindi pa tapos ang tanong pero nasagot mo na ng mariin na oo. sabi mo, hindi ko alam kung anong pambababoy sa pagkatao ang kaya mong gawin sa sarili mo para lang sa akin. hindi ako nakatulog noong gabing iyon dahil lumalampas sa pisngi ko ang ngiti. dumating tayo sa puntong kailangan nating maghiwalay, at hindi rin ako nakatulog noong gabing iyonpinanood ko ulit to ngayon kasi nakikipag kara-krus ako sa mga bukas kong sugat na hindi kumikirot hangga’t hindi tinitingnan. sa totoo lang, gusto ko lang makaramdam ulit.sabi mo tuwing Linggo, malulungkot ka dahil sa atin nakalaan ang araw na iyon at doon mo ako maaalala. tuwing Linggo nagdarasal ako na daanan ka ng matinding kalungkutan at magpapamisa ako sa Quiapo kapag nangyari iyon. tuwing Lunes, hinihintay ko mag Linggo. pero hindi dapat ganoon dahil napupuno ang mga araw ko ng mga ikaw. sayo na tong pelikula mo tangina ka. okei naman 4/5 hehe",160.0,ltbx
acsoul,,para at para lang kay kathryn,40.0,ltbx
p8mcakes,,if toxic was movie,200.0,ltbx
blairrrr,,shabu movie ko,140.0,ltbx
norepinephrine,,sa pinas p tlga kayo nag music career,120.0,ltbx
shanijamii,,never gets old,180.0,ltbx
gabbyeans,,"watched this because it was based on my all time favorite smau and thought i should give the actual movie a try It was good in the beginning, develops the story very well but as it progresses, it becomes increasingly cringe and corny to the point it genuinely becomes unwatchable i know considering the year it was made, the level of cringe is understandable nmn But i just genuinely cant digest it lang",120.0,ltbx
bananacheaps,,"you deserve what you tolerate talaga, yung isa naman kasi bulbulin na hanap pa nang hanap sa tatay",100.0,ltbx
toshieee,,"Primo, I will never not despise you",140.0,ltbx
rilakky,,bury me at the Amsterdam tulip gardens,,ltbx
myowuiii,,ang masasabi ko lang tanginamo primo,160.0,ltbx
sinigngnamatcha,,Pagod na pagod na pagod na rin ako!! hshaha 1000/10 go-to movie kahit break n kathniel. Over sa relate ma,200.0,ltbx
kasiyahan,,sabing ‘wag nang babalik ,100.0,ltbx
rhia_j,,One of Philippines best rom com movie out there personallyThe song Malay ko that primo sings….. punches me to the soul and back,200.0,ltbx
twolifetimes,,same george my life is also currently being ruined by a man who collects vinyls,140.0,ltbx
ashietone,,ano buhhhh[inaccurate date],,ltbx
majybear,,JO!!! JO ANO BA!!!!!,120.0,ltbx
lluver,,Sana makakita rin ako ng letter sa ilalim ng ref,140.0,ltbx
lakemis,,"watching this with oa friends is such a theatrical experience HAHSSHAJAHAHA 10/10 recommend with riko, zeph, kia, & ang",160.0,ltbx
makirell,,Putangina nung first part nakakainis GALING pa talaga kay Daniel Padilla ha,40.0,ltbx
seiiyaa,,passion,200.0,ltbx
ylang2ylang,,I'll always be grateful that this film introduced me to rice lucido hehePugad talaga to ng katangahan pero tuwing marami akong pagsubok sa buhay for some reason ginugusto kong panoorin to so naging comfort film na lang din siya throughout the years...Also hi shm kung mabasa mo to sana alam mong naalala kita nung nag-away si primo at george sa ulan,,ltbx
reiscene,,UGHHHHHHHAHHGGGAGAGGGGG,180.0,ltbx
erinnysilee,,IM SOBBING THE RAIN SCENE ,200.0,ltbx
arvieee,,"""Ginago kana't lahat binalikan mo pa. Wala ehh mahal ko."" - Probably Georgina",80.0,ltbx
holyribs,,ewan ko tangina kaurat huwag niyo babalikan ex niyo lalo na kung kasali sa banda HOY ‘YUNG NMAT BOOK,60.0,ltbx
rhia_j,,How could you not find a reason to stay type shift,200.0,ltbx
chonzii,,"The story is very cliche and problematic. Toxic relationship that will just use emotional dialogue to get you through. This film is really saved by Kathryn Bernardo, she overpowered his love interest. Some plots are rushed or misaligned. Character wise, they're fine, marupok lang talaga.",140.0,ltbx
iuvnna,,ANG MASASABI KO LANG TALAGAA AY PUTANGINA MO PRIMMO,180.0,ltbx
miawpuffs,,WTFFF ily kathryn,120.0,ltbx
elillegallywand,,Kathniel Foreshadowingf,120.0,ltbx
sibylfrau,,STAND UP ???? (i love you kathryn forever),100.0,ltbx
steffjjz,,anong nakakakilig dito bwiset ang red flag nga ni primo!!!!! (now ko lang na-log sa letterboxd kk),160.0,ltbx
hvymetalmachine,,la la land if they locked the fuck in,140.0,ltbx
chanelza,,i just hate primo,120.0,ltbx
isell_,,pagod na pagod na pagod na raw sha,200.0,ltbx
kkooull,,ako rin jo pagod na,160.0,ltbx
vanitasss,,"i cried, gets good rate",140.0,ltbx
stelluh_star,,"I literally watched this a hundred times and I still cry. Maybe I cried a little harder recently cause I saw myself in the same situation. It's different when you're kinda hopeful that a movie will be how your life turns out--specially when it comes to love. There are people you thought you wouldnt accept if they come back, but deep down you know that your heart wants to.",140.0,ltbx
sebdechach08,,made me cry,120.0,ltbx
prodbyzaske,,the hows of 8080,,ltbx
evieginmoko,,wag na kasi dapat balikan yung nanira sa buhay mo sis,140.0,ltbx
pucciyena,,No. Just no. Stop romanticizing this shit.,40.0,ltbx
dalandanyiel,,"ano ba, direk cathy ",200.0,ltbx
yanikatie,,"I AM GEORGE IN THE RS, FUCK ME",160.0,ltbx
iyahnaa_r,,"definitely good. even as a kid, you can understand the depth of it. totally, i didnt hate any character because you can understand every of their flaws. si jo, mahal na mahal nya si primo kaya nya nagawa ng lahat ng yon, totally understandable that love is an illness to a woman with goals. with primo, i still kind of don't understand what made him like that so suddenly. i think that he got insecure of jo, and binabad nya…",200.0,ltbx
yzisacreature,,"A semi-realistic introduction to real-life love, yet I do think this would never happen irl",120.0,ltbx
veronicaxally,,tama ngang love is an illness to a woman with goals dapat 'di na sila nagkabalikan mag-ex na si george at primo for a reason!!!,140.0,ltbx
pyupeo,,jo is me,200.0,ltbx
nybbl,,bahabab tangina,120.0,ltbx
prinbaee,,tangina talaga,120.0,ltbx
cmbynfred,,"The How’s of Us captures the kind of relationship that feels real — messy, painful, and full of the quiet moments that make love worth holding onto. Kathryn Bernardo and Daniel Padilla deliver their best performances yet; their chemistry is raw and mature, showing what it really means to love someone through the highs and lows.It’s not just a romance — it’s a reflection on growing up, on chasing dreams without losing yourself (or the person you love along the way). The emotions are so grounded that you can’t help but see a bit of yourself in Primo and George.Some scenes hurt to watch, but in the best way possible. The How’s of Us reminds us that sometimes love isn’t about staying the same — it’s about growing together, even when it hurts.",160.0,ltbx
pperiwinkle_e,,lines at dialogues ang nagdala sa movie at ang acting-an ng isang kathryn bernardo sagad hanggang buto ang inis ko kay primo leche,120.0,ltbx
dinizi,,tumagos g aray koh,200.0,ltbx
bendapyo_o,,"its a bittersweet film, reminding us that a breakup has a good and melancholic perspective",160.0,ltbx
lancegabg,,corny ni darren nakakapikon,120.0,ltbx
sygloss,,tangina mo pa rin primo,60.0,ltbx
yamieyam,,"tama na tangina (ngl, this one's my guilty pleasure. primo still sucks tho)",140.0,ltbx
i4826s,,"yan tayo sa letters eh, kahit ako makukuha ako sa ganyan ",140.0,ltbx
xoxoher_,,yung wala kana ngang pambayad for medschool tapos nadagdagan pa ng kapatid mo na may diabetes tapos jowa mong punyeta,200.0,ltbx
rafdnwm,,kuhang kuha parin ni primo inis ko,120.0,ltbx
burymychiid,,shibal this life,180.0,ltbx
jearlaina,,"rewatched it again now that it’s almost been two years since their breakup, and woahh, it broke my heart all over again. yk, i really like kaila for deej (I LOVE HER), but honestly, there’s just something about kathniel. nothing will ever compare to them :) #baliknakayoplsnaiiyaknaako.",160.0,ltbx
zurimorinkashi,,"A space is not something you offer. It's something you give freely even if it will break you.It's related to my relationship. I gave up the moment she said she wants a breakup. I gave up easily because in my mind, she already decided. Everything I'll say won't change her decision. I tried but to no avail. Hoping you'll see this, Mary. I still you want back.",120.0,ltbx
chloemaybe,,naks naman,200.0,ltbx
aintymayan,,“what if we held on and rode the tide together?” a line that someday i hope i wont say“makarating din kaya tayo kung nasan tayo ngayon?”,120.0,ltbx
dulwulurma,,w bg movie,120.0,ltbx
deardorathea_,,"It’s a great story, but damn… I’ll be honest — I ain’t staying for a guy like that. Lmao. Also, Primo really needs a grip. If I missed my exam for him, I can’t even imagine — wtf? It’s giving breakup playlist vibes, but instead of a CD and paresan, it’s a vinyl and a bitchass ugly letter. Girl, you deserve way better than that. I hate how it glorifies men’s behavior, making it seem cute to stay up dealing with their mess while you’ve already figured out your own life.",100.0,ltbx
22ndcenturygirl,,sobrang sadboy talaga ni primo nakakairita ,100.0,ltbx
riyoatsuki,,kingina hahahaahwhahah hoy bkt naman aq pinapaiyak ne?kahit maputi… na ang buhok q??,160.0,ltbx
arudorin_,,Fuck my life. Good movie :(,200.0,ltbx
luwinescence,,"it’s not perfect, but it isn’t forgettable either.",140.0,ltbx
herasie,,ang sakit mo jo,140.0,ltbx
tarantulaix,,grabe ka jo,120.0,ltbx
riciacious,,"the dialogue in this IS TOP TIER!! maaalala mo talaga yung scenes, how they played out, what they said and tumatatak talaga siya !! while i do think the movie is too optimistic sa ending and how the romance played out sa second chance i loved how grounded their first breakup felt !! and i especially LOVED the whole thing about passion, felt realistic and human, kasi lahat naman tayo we want na magwork yung passion natin and i totally got both their sides there im js siding more with george talaga, i think maybe sana di siya bumalik but honestly great movie ! will use as reference sa next class play or story making namin HHSHSA",160.0,ltbx
lov07,,"The pain in the movie put a salt into my fresh wound. I was ugly crying the whole time kasi I felt it really. Decided to watch ba naman this after losing the loml hahaha. Storyline is really good, either they get back or not man . Mikko was ahead of the time, he knows, sya fave ko na character there hahaha",180.0,ltbx
junwanyang,,"watching or rewatching a kathniel movie post-break up really hits different. it's november again and it's almost 2 years since they're no longer together then the latest soft launch of 1/2 of them... may kirot pa rin talaga.actually watched this at the cinema and also remember when i first saw the trailer for this film, i was so excited. okay naman siya. siguro nga since it's mainly george's pov and last 10 minutes of it na lang did we got primo's side kaya may mga debate pa rin tungkol sa pangarap nila so di siya balance. i also think na it's definitely the most mature film they have though it indeed got a little draggy. at mas gets ko na rin yung comments about darren now that i have rewatched it  ang awkward nga huhu ",120.0,ltbx
froggypee,,sussss george deserved better than this stupid bum #GetUpSister also that debate scene was soooo painful to watch omg those arguments were so bad,120.0,ltbx
jaioramos,,What is this water coming out of my eyes?? ,140.0,ltbx
shxxam,,I MISS KATHNIEL :(,160.0,ltbx
nieru_kl,,"noong una ko ’to napanood sabi ko hindi naman nila talaga kailangan magbalikan for the film to be good. okay ako sa ending na hindi magiging sila. nung naghiwalay kami ng girlfriend ko, TANGINA DAPAT LANG MAGBALIKAN YAN SILA PRIMO SANA KAMI RIN TANGINA NAMAN",120.0,ltbx
mjlolll,,pagod na rin ako parang si jo,200.0,ltbx
rieriepogi,,magaling pagkakagawa plus points pa chemistry nilaJOOO,200.0,ltbx
keicee,,"love shouldn't feel like you're the only one fighting for something the two of you should be working on togetheryung ba yung pagmamahal mo, primo? how could you give up so easily? how did you not find a reason to stay?sometimes I wonder how love can burn so bright and still end in silence, how someone who once saw forever in you can suddenly forget how to stay.",160.0,ltbx
phrae,,ok next group,120.0,ltbx
girlhood,,nirewatch ko to para lang makapagcomment ng “pota mas pagod pa ko kay jo eh” rn,,ltbx
bad3p,,ewan ko lang but i won’t ever love someone enough to miss my nmat darren sneak putanginahahahaha wag nang uulit pwede,120.0,ltbx
yurei01,,PAGOD NA PAGOD NA PAGOD NA PAGOD NA AKO!!,120.0,ltbx
