username,date,review_text,rating,source
r_u_shaw,,"Words cannot describe this film. amazing, revolutionary and life changing don't even come close to describing the level this movie is on. i watched this movie with friends expecting it to be bad but boy was it different to that......ITS SHIT!!!!!! a funny type of shit BUT STILL SHIT. i would watch it with mates for a laugh but don't actually watch it for enjoyment because you will be disappointed. the funniest part of the film was when i finished it and realised it had actually won awards. its so unbelievably bad and definitely doesn't deserve these awards but it's still funny to laugh at",20.0,ltbx
dj_teves13,,I was forced to watch this on the bus.,20.0,ltbx
_wanderluuust,,at some point you gotta try to make your movie bearable,20.0,ltbx
patapon,,ewan ko ba bakit kumikita ito sa takilya,20.0,ltbx
antonioagregado,,Just logging this,40.0,ltbx
sebastian_a,,genius child....... yeah.... no....... im the kind who enjoys shitty movies for the comedy but this whole film is too annoying to be funny,20.0,ltbx
kainoa,,"Less funny than the first, but a Wenn Deramas film is always great for a light watch.",100.0,ltbx
virgoinfilm_,,same sentiments as the first,60.0,ltbx
aidsaidsaids,,waw best film,200.0,ltbx
shaynesthoughts,,some nice campy filipino fun. i cant find the first one anywhere but it was def more enjoyable than this one,60.0,ltbx
sonicmage42,,This is about on par with Beauty and the Bestie. The story works as is but I think I may have been too tired or something because I wasn't really jiving with the humor this time around. Also this is basically military propaganda.,80.0,ltbx
lehoe,,That bagwa scene *chef's kiss*,80.0,ltbx
anparales,,105 minutes of pure brain rot,,ltbx
ellekaie,,qingina pinanood ko nga pala 'to sa sine kasama kapatid ko nung mmff 2014The Anti-Letterboxd 250 (Filipino Version),,ltbx
julyiea,,tangina talaga nung plants vs. zombies film ang camp teh,120.0,ltbx
peristereon,,imma just laugh of how ridiculous this movie is,,ltbx
captbo,,Heheheh laptrip...,160.0,ltbx
graysonity,,"just who thought of a plant vs. zombies type of battle??? oh yea—""comedy""",,ltbx
elyhealy,,I'm pretty sure I first watched this when I was 18 hahaha whatever it sucks doesn't even give me a good laugh ‿,20.0,ltbx
itsmejanna,,"First part lang yung nakakatawa, idk but that Plants vs. Zombies parody sa first scene reallh made me laugh, the rest MEH",60.0,ltbx
guankuroo,,"napamahal na ako sa bata ehwOw, pEdOpHiLe??!!??gago HAHHAAHHAHAH tanginang script yan",40.0,ltbx
zedstinkd,,"a dissection in the dichotomy about the narcissism of Vice Ganda.This sucks, why is Benjie an asshole and manipulative and MUCH MORE HORNY",80.0,ltbx
danaya_gising,,minsan talaga napapatanong ako bakit hilig ko magsayang ng oras,20.0,ltbx
bedmoss,,Miss Vice when she succumbs to just making movies for sponsorships and money rather than laughs. ,20.0,ltbx
carpihoe,,panget neto pukengina,,ltbx
misterrealist87,,"Somewhat important in Filipino culture... D-don't ask why I know that, I mean I'm Filipino but I dunno why we think of this as our FGF. Even for me.",120.0,ltbx
narniascat,,i cannot,20.0,ltbx
mando_li,,?????????,20.0,ltbx
yand,,she was ahead of us,80.0,ltbx
juness,,So bad yet so fun cause… it’s so bad ,20.0,ltbx
lun4r0c,,ughh,80.0,ltbx
meovvn,,nice,160.0,ltbx
davoarid,,"Oof. I (surprisingly) really liked the first Praybeyt Benjamin movie, but this sequel is dire. My sense is that Vice Ganda was given more creative control this time around (since he had become a huge star between movies), and it's entirely to its detriment, as oh boy does Vice need someone who can rein him in. So instead of the original's narrow focus (on an incredibly horny gay guy who has to pretend to be straight to serve in the military), we get all the dumb Vice Ganda-isms (parodies, pop culture references, that incredibly annoying trend where Filipinos believe simply reciting dramatic speeches verbatim counts as comedy, etc). But even setting that aside, it fails as a comedy sequel just by changing the entire focus of the comedy. Praybeyt Benjamin is funny due to the clash between Ganda's bakla persona and the macho nature of the military. But then on this one the entire plot keeps Vice out of the military, and instead it does the comedy chestnut of ""person who is really bad at taking care of children has to take care of a child."" It's such a weird choice and it doesn't work at all. Also, this does Eddie Garcia so dirty....my man deserves so much better than this!",40.0,ltbx
jonaaaaas_,,push mo yan te,80.0,ltbx
christhe,,sisterakas best vice ganda movie,,ltbx
mihajlogrk,,Best movie I’ve ever watched. Truly amazing. Blew me away. Glory to the Philippines.,200.0,ltbx
nlareu,,Vice Ganda slays all glory to the Philippines mabuhay ang pilipinas ,200.0,ltbx
fieabag,,Hay ewan ko rin hahaha,80.0,ltbx
potatodotcom,,BIMBIIII~ (just imagine it in kris's voice),100.0,ltbx
kendrickclement,,"Praybeyt Benjamin is my favorite Vice Ganda Film, yet.This second film was quite a disappointment.Again, we need some good vibes, it was Christmas back then, Holiday season, so we watched Vice Ganda Film for the good vibes.",60.0,ltbx
notatakenhandle,,generated crickets......unkabogable = mare > girl boy > sisterakas > petrang > amazing,60.0,ltbx
sinenini,,oooo slay i guess … mm ok i watched this in cinemas when i was a kid and when i rewatched it with shobe today i forgot what it was actually about. somehow this was all repressed and i only remembered the zombie subplot  i love direk but also parang nagdagdag lang ng mga “”funny”” celebrities or trendy? ones during this time in hopes of adding to the comedic value when they could have focused more on benjie’s squad dynamics bc they were rly so funny in the first film . as in yun pinakamemorable frfrfr . ngayon ko lang din napansin na jimmy santos was replaced here in his role as benjie’s tatay pala … idk why that makes me sad but it does for some reason (reason: nostalgia),60.0,ltbx
lanidelrey,,I love my people but I have yet to love their movies haha,20.0,ltbx
gyunism,,hindi ko alam kung bakit ko siya pinanood pero ok lang siya siguro hahahahahah amp???,40.0,ltbx
rawrzamyrrh,,i can't believe i'm starting the year with this,40.0,ltbx
zyhh,,tanginang acting yan buti na lang nakakatawa kahit papaano,80.0,ltbx
letusprei,,chaka kasalanan mo alex gonzaga,40.0,ltbx
hwangmiguel,,"Sarah?Miss Minchin?Hindi! Mommy Divine!Halika na, Sarah! Tabe!BWHAHAHAHSJJSJDJSJSJAJSJHDHDHDJDDJDJD TANGINAA",120.0,ltbx
filmusings,,praybeyt benjamin is a gay icon! he served the country and he served while doing it period!!!! sobrang panira nga lang ng movie yung isang chaka na apologist diyan bwisit ka alex gonzaga,100.0,ltbx
vincibles,,Mga kailangan mag acting workshop:- Al*x Gonz*ga- Ser Chief (pogi mo po)- Bimby- yung mga dating lalaki (allegedly) ni meme na bit players,40.0,ltbx
kainoa,,Alex Gonzaga is literally box office poison. She's worse than racumin.,20.0,ltbx
sapph1c,,truly SERVED the country mabuhay ka pilipinas ,60.0,ltbx
peterpiperpick,,kalimutan ko,120.0,ltbx
cinemaniara,,MEH,40.0,ltbx
cromuelized,,"Tzu? Pagkain? Si Kim Chiu di kumakain. Nakita mo ang payat-payat.Guilty-pleasure ko to eh, bakit ba?",40.0,ltbx
eyonine,,v camp lol,80.0,ltbx
akosipatroclus,,"The only aspects redeemable in this film are the songs: Boom Panes! and Push Mo Yan Te. daming eye candy na male actors pero display lang ang role, ang oa ni Alex G, ang boring ni Bimbie. walang malalim na senaryo kung saan dapat magtagpo at magkalapit ang damdamin nina General Chua at Bimbie. walang matibay na senaryo para maghilom mula sa paglaki ng ulo, kapalaluan at pagiging insensitibo nya si Benjie. siningitan ng pangmalakasang litanya sa dulo na ""bakla ako, pero hindi ako bakla lang""para maipakita na kahit macho ang kontrabidang terorista (simbolo ng kalakasan at patriyarka) eh walang hindi kayang pataubin at talunin ang baklang determinado. hahaha chaka ampota, hindi naman kasarian ang problema, kundi kayabangan, magkaiba ang kayabangan sa totoong katapangan.conclusion; failed.",40.0,ltbx
noriyakee,,may scene na nainis ako pero 'di ko na i-eelaborate ,40.0,ltbx
jouleofilms,,un-amazing prabeyt benjamin.,80.0,ltbx
ciubalmarcus,,The line between comedy and absurdity is thick. This lies there like a tanker in a canal.,20.0,ltbx
extrapearl,,#withEury #withJannah,20.0,ltbx
spookyisaac,,plants vs zombies TT WENN V DERAMAS IS A GENIUS.,120.0,ltbx
jjewelr,,Uhm i love this pero mas fresh talaga yung praybeyt benjamin na nauna huhu,200.0,ltbx
unnervingcheese,,fuck you bimbee!!!!!!!!!!!!!!!!!!!!!!,20.0,ltbx
roseyshania,,lost half a star because of bimbee ,180.0,ltbx
pmec,,So phucking lame,40.0,ltbx
1amr4y,,mahal na mahal kita richard yap,200.0,ltbx
moneysignbrit,,bimbee i have some words for u,20.0,ltbx
mcjvtra,,una pa rin,40.0,ltbx
missaendrist,,tumawa naman ako yun ang mahalaga,40.0,ltbx
dlgksmf,,natawa naman ako...,60.0,ltbx
kmiester,,gay ass soldier! its shit though BUT ITS FUNNY SHIT!! (i loved the scene where he was at a bar ignoring the president LMAO),160.0,ltbx
jihyozxc,,kani pd,80.0,ltbx
krst3lviaa,,guilty pleasure,,ltbx
dominantdaddy,,Biiimbs,40.0,ltbx
jeeeyyydiii,,"lol, idk what came into my mind watching this with my sister as a post-Christmas movie but dang, this made me laugh but this is not a movie that I will want to watch for another time. i also mistaken this as the first movie so yeah, disappointed. the fat-shaming jokes are also appalling, gosh!",40.0,ltbx
demara,,this movie is so stupid and unnecessarily long that its funny PANO NAPADPAD SI DAVID LICAUCO DITO AHHWKWMWE,60.0,ltbx
redriosi,,Nawala si kalbo,100.0,ltbx
barterwhite123,,No way dito ko ginastos pamasko ko noon.,,ltbx
ajduyac,,okay lang,120.0,ltbx
krlame,,boom panes boom boom panes,100.0,ltbx
gaeyaju,,i enjoyed every part of this movie,160.0,ltbx
x___xdead,,"this is funny, but still shit",40.0,ltbx
linggg,,There are cringe parts chkancjanxj,60.0,ltbx
kiabodame,,ang weird,40.0,ltbx
aerinaga,,oa gf at nonchalant bf core,60.0,ltbx
tyleero,,keri na,120.0,ltbx
kaiser_indat,,4/10 = BAD,80.0,ltbx
tinapaynitina,,wala kong pake kung gano pa kapangit editing at story line basta nakakatawa. this never fail to entertain me. lalo na’t it always brings out the 2014 xmas szn memories.,160.0,ltbx
chnzo,,yung princess sara and mommy divine joke lang yung naaalala kong nakakatawa d2,,ltbx
tittiana,,mas bet ko ung una,100.0,ltbx
prdgldd,,happy pride month y'all,80.0,ltbx
mulanrayco,,good laugh movie haha ph jokes talaga kanal humor,60.0,ltbx
y0nskiee,,gotta release my anger sa ginawa nya kay axel. Watched this pinoy hot garbage,20.0,ltbx
sipon023,,Funny if you got the mind of an 8 year old.,80.0,ltbx
madielayn,,first movie was better,80.0,ltbx
naouis,,good laugh lng,140.0,ltbx
dukejuke,,very nice ang onti ng mga lalaki very funny very interesting very outstanding very impressive,160.0,ltbx
riri_borja,,The first movie I have ever watched in the cinema.,120.0,ltbx
crucifjd,,push mo yan teh,60.0,ltbx
hachiboquet,,HOLYY SHITT,200.0,ltbx
ginkkmisato,,ewan ko ba antanga tangaaaa,40.0,ltbx
zoey_de_leon,,"David Licauco? Bat ka andito?Anyways, still funny at some times but terrible in many ways.",20.0,ltbx
twigxsie,,I dont understand my country,80.0,ltbx
romji,,mas masarap at mas may appeal na chinito parin si panlasang pinoy kesa kay richard yap,100.0,ltbx
jenaissera,,brat summer real,,ltbx
neongenesisryle,,pota yung plants vs zombies hahahaha,40.0,ltbx
potatoqualityk,,aliw banters ni meme saka richard yap and ewan ko ba pero feeling ko im always ovulating kahit wala naman akong matres kapag nasa screen si richard yap (lalo na ung sando scenes ?!?!?!),80.0,ltbx
urchoiceurmusic,,di ko rin alam bakit ko pinanood,100.0,ltbx
cyorama,,yung cgi talaga nung plants vs. zombies scene eh very kabog,40.0,ltbx
notallen,,gew plants vs zombies ,,ltbx
juulmarri,,bimbee~,160.0,ltbx
sabsilvoza,,oa naman ng mga nag rereview nito malamang chaka siya na movie pero who gaf aliw naman + infair bet ko acting ni alex gonzaga dito,,ltbx
clank_theplank,,Made me remember my 2nd year high school,40.0,ltbx
vanellopea,,CORNYYY,100.0,ltbx
allurio,,diko alam kung maiinis ba ako o matatawa,60.0,ltbx
orchidocean,,This movie is so unserious. LAROOO HAHAHAHAHA. ,120.0,ltbx
riii1aaaa,,bagyo weather starter pack,200.0,ltbx
