username,rating,review_text,date,likes,comments,viewing_type,user_liked
beeyuncuh,1,more like paid in malacanang 😂😂😂😂😂😂😂😂😂😂😂,2022-08-03T22:46:59.709Z,69,2,watch,False
chubbydummy,2,Lol,2022-08-04,0,0,watch,False
sansuui,1,putangina nyo mga pasista,2022-08-04,10,0,watch,False
baboy,1,MOVIE !!! OF !!! THE !!! DECAYED !!!,2022-08-04,378,0,watch,False
angxious,1,Waste of time and money.,2022-08-04,1,0,watch,False
yah1ko,1,I don't need to see this to tell you that this is going to be a dogshit of a film. This is an embarrassment to the Philippine cinema. This is a grave and utter insult to the Philippines. The only reason I rated this 1/2 is because there isn't an option to give this film a zero.,2022-08-04T00:24:21.734Z,6,0,watch,False
hansfrancocruz,1,Ew,2022-08-04,1,0,watch,False
tabitabs,1,Di na kailangan panoorin para i-rate.,2022-08-04T01:21:08.993Z,12,0,watch,False
jerome415,1,The plot is hard to follow. Only portrayed an evil man as evil.,2022-08-04T01:39:54.930Z,0,0,watch,False
kaskiosk,2,"If you are looking for a movie that is not consistent with reality and more like an alternate history type of film, I recommend this. Had the director(s) been historically accurate, this could be taken seriously. Unfortunately that is not the case. Just a good alternate history but not reality. For one, in reality, Mrs. Aquino did not play mahjong with the nuns.",2022-08-02,1,0,rewatch,False
thanguwu,2,"didn’t watch. i just cringe every time this movie creeps in my newsfeed. i have so much hatred for the movie, the cast, and the entire crew.mga marcos pasista, tuta, diktador, at magnanakaw.",2022-08-04,3,0,watch,False
allanglvz,1,"A waste of time.Time only because someone sent a bundle of tickets to our boss just to gave them to us for free. I can provide pictures, if you want. Anyway, let's focus on the content. The content, just like any other Daryl Yap's filmography, is trashy. They didn't even consult several people by making this. Unlike the film ""Katips"", this movie lacks credibility because it didn't even written in the history books. It only serves to distort the history by making the late dictator's name great. Let's give SOME of the artist a half clap for giving their efforts but still I will never ever recommend this to anyone.Not recommended.",2022-08-03,5,0,watch,False
sebastianeros,1,"propaganda film, half of the actors here are total flops. i fucking hate you daryl yap",2022-08-04,13,0,watch,False
1485khal,1,Bunch of stories that are made up and have nothing to do with our history.,2022-08-04T03:30:11.038Z,1,0,watch,False
lapezangel,1,did i watch it? of course not!im jus being petty😁,2022-08-04,20,1,watch,False
blueberryrian,,Imelda Marcos MILF na may kasong 7 counts of graftsi BBM hindi matatawag na DILF maasim ung mukha eh,2022-08-04,44,0,rewatch,False
blueberryrian,,MIM FERDINAND SR X IMELDA KANTOTAN,2022-08-04,17,0,rewatch,False
crypie,,didnt waste my time. historical distortion at its finest.,2022-08-04,2,0,watch,False
28archives,1,"L + ratio + yo mamaop said paid in malacañang and i couldn't agree more :"")) tangina mo darryl yap",2022-08-04,0,1,watch,False
suekii,1,Pangit hindi ko to papanoorin mag finger na lang ako kesa sayangin ko oras ko dito tanginang to ni Darryl Yap eh amaccana accla sakit mo sa puki,2022-08-04,124,6,watch,False
akden,1,"Ang pangit. Kung gusto ko manood ng magnanakaw, tingnan ko nalang yung CCTV.",2022-08-04,181,0,watch,False
sakamoto12,1,This movie sucks. If there was 0 star I'd rate it 0.,2022-08-04,0,0,watch,False
glen_goopio,1,Waste of time. Mas maganda pa ang Thor!,2022-08-04T05:44:29.902Z,0,1,watch,False
lope_emano,1,"Ang sagwa, hindi makatotohanan ang baba ni Imee! Kelangan palitan ng mangga.",2022-08-04T05:54:05.842Z,4,0,watch,False
udrich,1,"Badly-written, lazily-directed and saddled with terrible-pacing, wooden acting and a scattershot plot, Maid in Malacañang is Filipino Film Director Darryl Yap's vanity project whose sole raison d'etre seems be laundering the ignominious reputation of one of history's worst kleptocratic dictators Ferdinand Marcos Sr. along with his equally corrupt family (a reputation surpassed only by Suharto in pilfering his respective nation's coffers).Indeed, the project was concieved with the deposed despot's own unrepentant daughter Senator Imee Marcos serving as its ""creative producer"". With all of these elements at play, one can't help but think this film is just bad propaganda and self-serving hagiography. It brings nothing new to the table nor does it contribute to the advancement of the moviemaking craft. If that's not bad enough, Yap makes amateurish directorial missteps such as telling the story instead of showing it. The only positive the film possess is the fact the producers clearly spent money on its set pieces. With Maid in Malacañang, Yap ascends to the list of ignominious filmmakers such as Leni Riefenstahl and D.W. Griffith but with far less talent. Yap is certainly no auteur.",2022-08-04,47,0,rewatch,False
scar_h,1,"Historical revisionism at it's finest. Literally rewriting history, no wonder Filipinos today believe on myths on how the Marcos era was ""the golden age"".",2022-08-04T06:14:43.015Z,4,0,watch,False
omnyojii,2,"Basically, a propaganda movie to white-washed the dark history of the family of Marcos. It garners dimwitted audience who doesn't read historical records and fanatics of the said family. Like Imelda Marcos' one famous quote from the Kingmaker documentary ""Problem with media is the gun can kill you only up to the grave. Media can kill you beyond the grave"", they sure are very aware of the historical distortion they are doing that's why they hired social media specialist or trolls to divide the people through populism.",2022-08-04,32,0,watch,False
steven_gil,1,Watched the movie. It was a waste of money. Ang bobo ng cast. Darryl Yap sure likes to lick Imee's glory hole! That's how bad it is.,2022-08-04T06:34:22.381Z,0,0,watch,False
lenluntang,1,"Ang panget ng movie, wala man libreng popcorn! Cheapepay! may pa libreng ticket pang nalalaman! Mga bobo!",2022-08-04T06:50:59.977Z,0,0,watch,False
kenaria,1,Mga tanga lang ang nanonood nito. Mga bayarang bobo na umaasa sa libre.,2022-08-02,0,1,watch,False
lenshutup,1,"Cheap walang originality. Tanga nung gumawa, di marunong mag research.",2022-08-04T07:09:43.237Z,0,1,watch,False
s1arrberries,1,shonget,2022-08-04,1,0,watch,False
edzopalacol,3,"As a person who doesn't read, I wasn't a fan of all the text and exposition that cuts frequently throughout the film. It's a basic known rule in filmmaking to ""show, don't tell"". I also don't feel like there's enough story to divide the film into ""chapters"", especially when each chapter felt like lasting only 10 minutes at most.The film tries SO HARD and SO ANNOYINGLY to paint the Marcoses in such a great and kinder light. It tries to portray them as the victims that in retrospect only happened because of the corruption and deceit their family had done in the first place.Artistically it was fine. The direction was atleast dynamic and some effort was put in. Although the choice of a squarish aspect ratio made it all feel too ""compact"". Especially since it was accompanied by having almost all shots indoors and in small rooms.I have no sensible reason whatsoever to endorse anyone to watch this movie. It all really is just an effort to repaint history in favor the Marcoses. Put simply, it's brainwashing.",2022-08-04,4,0,watch,False
quouloicroifray,1,The best movie for idiots.,2022-08-04T08:05:30.652Z,0,1,watch,False
koreijauweuquo,1,ANG PANGET NG MOVIE!!! WAG NA KAYO MANOOD SAYANG PERA NYO DAHIL WALA NAMAN BABA NI IMEE! YUN LANG ANG GUSTO KO MAKITA HINDI PA MAKATOTOHANAN ANG PAG GANAP!,2022-08-03,1,0,watch,False
bozellomeuja,1,"Sa totoo lang hindi maganda ang pelikula. Napaka cheap ng pagkakagawa, parang baba lang ni Imee.",2022-08-04T08:23:02.295Z,9,0,watch,False
nocturnalgf,1,bullshit.,2022-08-04,2,0,watch,False
cannoittiyulei,1,KUMUSTA NAMAN ANG 20 PESOS NA BIGAS??? BAT MAS NA-UNA PANG GUMAWA NG PELIKULA KESA PAG GAWA NG MAY MAKABULUHANG BAGAY.,2022-08-04T08:49:43.532Z,1,0,watch,False
derangedstuff,1,Rich people problems,2022-08-04,1,0,watch,False
inamo_darrylyap,1,shit movie shitter director,2022-08-04T09:00:23.730Z,0,0,watch,False
almariagustin,,"KASINUNGALINGAN. TANGINA MO DARRYL YAP, HIMOD PWET PA SA MGA MARCOS TANGA! MAGSAMA SAMA KAYO SA IMPYERNO.",2022-08-04,6,0,watch,False
crassoullevuhau,1,"NASAAN NA ANG BABA NI IMEE??? HINDI NAMAN MAKATOTOHANAN ANG PORTRAYAL, BARA BARA! WALANG CLASS! PWEH",2022-08-04T09:09:58.211Z,0,1,watch,False
kumikinanginamo,1,ang asim gagi,2022-08-04,0,0,watch,False
cedricbench,1,NEVER AGAIN TO MARTIAL LAW,2022-08-04,0,0,watch,False
mcnutt123,2,Never again to martial law,2022-08-04,0,0,watch,False
daninejane,1,"DOGSHIT. Point of view of the marcoses with a twist para utuin ang mga tao, bobo na nga ang mga pinoy, mas pinabobo pa dahil sa pelikulang to.",2022-08-04T10:26:36.590Z,1,0,watch,False
ktmcjm,1,"he is acting not normal..honestly speaking.. he's showing signs and symptoms of ambivalence...as a nurse...hope I'm wrong..he's smilling, then with all the gifts na binigay SA kanya just like child...pssst Darryl...be back on your self...Baka mabalitaan na lang namin Hindi mo na nalampasan ang fine line NG border Ng reality and insanity.. obsession kills.. delusional of grandeur...check your mental health status po...stay mentally health po...it's over na... eto assessment ko...",2022-08-04,7,2,watch,False
lovetina,1,absolutely fucking not.,2022-08-04,0,1,watch,False
kaniel666,,fangit,2022-08-04T10:38:09.792Z,1,0,watch,False
vonnvincentt,1,"BASURANG PELIKULA BY A BASURANG DIREKTOR STARRING BASURA STARS. 🤮If there's anything lower than a half star rating, that is what this movie deserves.",2022-08-04,1,1,watch,False
rikkusedo,1,tangina moment,2022-08-04T11:05:08.449Z,1,0,watch,False
payatism,1,nge,2022-08-04,0,0,watch,False
iv0ry1,1,gumawa ako ng account para lang irate tong basura na to,2022-08-04,16,0,watch,False
clockfan,1,Propaganda film,2022-08-04T11:21:55.289Z,0,0,watch,False
denielemein,1,damang dama mo yung historical distortion e bat di nila pinagsuot ng prosthetics tong si cristine reyes para sa baba ni imee,2022-08-04,304,0,watch,False
joooise,1,fangittt,2022-08-04,1,0,watch,False
veeana,1,kwento mo yan eh syempre ikaw bida dyan,2022-08-04,36,0,watch,False
lejacobins,1,"Mom dragged me to watch this movie. Here are some of the moments that legit made me gag:1. Imelda: Di na tayo makakabalik ditoBBM: Makakabalik tayo mommy*Zooms into Imelda's shoe that has a tag of IRM 2022*Holy shit2. ""galit sila kasi di tayo galing sa elitistang ankan, galit sila dahil Probinsyano tayo""THAT IS NOT WHY THEY ARE ANGRY.3. Maid speaking: Palamunin lang tayo!Holy shit ate di po kayo palamunin tangina nagtratrabaho nga kayo eh4. At the end of the movie they left the fuckin maids as protesters stormed the palace lmao and Imee Marcos cut a yellow dress of Imelda so their Malacañang staff can disguise themselves as protestors and not get attacked. Fucking kek.5. THE TITULAR ""MAID IN MALACAÑANG"" IS NOT EVEN ONE OF THE ACTUAL MAIDS. IMEE IS THE MAID IN MALACAÑANG HOLY FUCK. SHE WASN'T EVEN IN THE COUNTRY WHEN SHIT HIT THE FAN FOR HER FAMILY AND ONLY WENT TO THE PALACE WHEN MARCOS APPARENTLY CALLED HER BACK. THE ACTUAL MAIDS WERE NOTHING BUT COMIC RELIEF AND THERE TO PUT THE MARCOSES IN AN EVEN HIGHER PEDESTAL.6. Fuckin Robin Padilla shows up out of nowhere towards the end of the movie like a fuckin MCU cameo holy fuck.7. In between ""chapters"" of this movie, they show like text to say what's going on in history which kind of defeats the purpose of what a movie is lol8. The entire movie is like Birth of a Nation but like in the context of Martial Law era.9. Christine Reyes has the same acting of yelling a lot in the movie.In the end, this movie is not gonna help the Filipino people. It's just gonna build up the hegemony machine that they already control, rewriting their inconvenient history to be in favor of their narrative. They preach unity while at the same time demonize their opposition. I legit don't know how this country is gonna be lmao.",2022-08-04,275,3,rewatch,False
migoat,1,didn’t even watch it but fuck this movie,2022-08-04,4,0,watch,False
henriettugh,1,"he is acting not normal..honestly speaking.. he's showing signs and symptoms of ambivalence...as a nurse...hope I'm wrong..he's smilling, then with all the gifts na binigay SA kanya just like child...pssst Darryl...be back on your self...Baka mabalitaan na lang namin Hindi mo na nalampasan ang fine line NG border Ng reality and insanity.. obsession kills.. delusional of grandeur...check your mental health status po...stay mentally health po...it's over na... eto assessment ko...",2022-08-04,69,1,watch,False
clair8,1,Ew i hate uou all,2022-08-04,0,0,watch,False
taxpen,1,made in china birth of a nation,2022-08-04T13:42:31.829Z,0,0,watch,False
huly0,,Putangina! Mas maganda ba ang girl boy bakla tomboy ni Vice Ganda,2022-08-04T14:09:57.800Z,49,0,watch,False
blueberryrian,,Wala kayang nafifeel si daryl na guilt about this movie? sobrang pambabastos talaga ito lalo na sa mga napatay noong martial law. meron kaming teacher na isa sa biktima ng martial law pati na rin ang asawa niya.TANGINA MO DARYL YAP PAG BUMALIK ANG MARTIAL LAW DAPAT IKAW UNA MAGTRY NG ELECTRIC CHAIR,2022-08-04,13,0,rewatch,False
haewons,1,sa letrang B... basura,2022-08-04,4,1,watch,False
yotitsfanny,,TANGINAKA ELLA CRUZ APOLOGIST KANG HAYUP KA LUMAYO-LAYO KA SA BLACKPINK,2022-08-04,14,0,watch,False
imsuperace,7,“Gusto ko lang maging proud ka sa akin dad kasi parang di ka proud sa akin.”,2022-08-04,0,2,watch,False
jammed2,1,dami na ngang problema ng pilipinas dadagdag pa tong pelikulang to KAINIS!!!,2022-08-04,11,0,watch,False
aericarey,,PANGIT PUTANGINA,2022-08-05T00:22:07.048Z,0,0,watch,False
tunapie,,maid in clownery for sure,2022-08-05,0,0,watch,False
blutilelounge,1,loved the movie but was the 15 minute imelda x shoe sex scene necessary?,2022-08-05,24,1,watch,False
bukopie,1,putangina ni darryl yap kelan bang mananahimik tong punyeta na toh nakakabobo lahat ng pinagsasabi niya,2022-08-05T03:04:03.396Z,2,0,watch,False
sabwars,,"Someone tell me where i can illegally watch this bc i don’t wanna waste money on these rich assholes, thanks-",2022-08-05,5,0,watch,False
livingsucks,,Spoiler; PANGET,2022-08-05T04:07:42.907Z,1,0,watch,False
forgeshingles,1,IM MALACAÑANING!!!,2022-08-05T04:50:03.982Z,3,0,watch,False
gnred,1,darryl yap trying hard,2022-08-05,0,0,watch,False
christiee,1,didn’t watch but BOOOOOO,2022-08-04,1,0,watch,False
kleshie,1,One of the best film that portrayed historical revisionism and manipulation.,2022-08-05T05:58:07.807Z,0,0,watch,False
krespekreme,1,didn't watch but doing god's work to bomb this,2022-08-05,0,1,watch,False
mdavid0824,1,All the information were false. Poorly researched.,2022-08-05,0,0,rewatch,False
analeeyela,1,🤮y’all need Jesus,2022-08-05,0,0,watch,False
bianx,1,Comedy of the year - it has fascists shaking and crying and throwing up while facing the consequences of their actions!P.S. I hope Darryl Yap and everyone who love this movie cease from existing ♥️,2022-08-05,5,0,watch,False
soleilonly,,ulol,2022-08-05,0,0,watch,False
parfaits,2,pangit #NoToHistoricalDistortion #NeverAgain #NeverForget #NoToHistoricalRevisionism,2022-08-05,1,0,watch,False
kurt890,1,Pedofile director gross,2022-08-05T10:07:38.643Z,5,0,watch,False
houdinad,1,"Political agendas aside, the film is another badly-paced and badly-scripted Darryl Yap trademark. Aside from the powerful performance of Cristine Reyes, none of the other actors seem to work well with the unclear tone and direction of the movie. The film is a failed attempt to get the sympathy of viewers through an already controversial if not suspicious source material.",2022-08-04,2,0,watch,False
punkran,1,shit ass movie..,2022-08-05,0,0,watch,False
rordofthefries,1,Barbie: A Fairy Secret (2011) is a much more enjoyable movie,2022-08-05,1,0,watch,False
joannahermosa,1,mid in malacañang,2022-08-05,10,0,watch,False
saymacaroni,1,bat nawala na yung average rating hahahah,2022-08-05T11:51:37.172Z,0,0,watch,False
lyntian,1,garbage film,2022-08-05,0,0,watch,False
gunwooooooooook,1,go to fucking hell darryl yap,2022-08-05,2,0,watch,False
charliwastaken,1,The crew didn't researched about the real history. They really thought they ate that??? lol,2022-08-05,1,0,watch,False
sainteri,1,no ❤️,2022-08-05,2,0,watch,False
peachskies,1,simula nung pinalabas sa sinehan ‘tong Maid in Malacañang hindi na umaraw,2022-08-05,67,3,watch,False
ln_ze,1,???? bro the shoe scene with 2022 i cackled,2022-08-05,0,0,watch,False
arseneaux,1,haven't watched this movie and i definetly won't but i want to do my part in lowering its average rating,2022-08-06,1,0,watch,False
cowboylikep,,mid in malacañang,2022-08-05T23:53:50.845Z,1,0,watch,False
cowboylikep,,darryl yap tama na,2022-08-05T23:54:11.189Z,0,0,watch,False
cowboylikep,,darryl yap may mangyayaring masama sau,2022-08-05T23:57:20.948Z,0,0,watch,False
lvclv,1,The worst film ever. Darryl Yap pedophile. Putangina mo.,2022-08-06T02:44:23.417Z,0,0,watch,False
curbs,1,"FUCK YOU DARYL YAP, FUCK YOU MGA MARCOS, FUCK YOU SA MGA APOLOGISTS!",2022-08-06,2,0,watch,False
faitharanas,,I don’t have to watch this to know that this is garbage. A pathetic attempt to twist the truth and revise our history. 🤮,2022-08-06,2,0,watch,False
tarasque,1,nice historical revisionism you got there,2022-08-06T03:54:58.229Z,0,0,watch,False
jnmrgt,1,didnt watch but i know it's the rating that it deserves!,2022-08-06,0,0,watch,False
xianxz,1,basura,2022-08-06,1,0,watch,False
nathangarcia065,1,"I had high expectations for this film because of Daryl Yap the director of ""Jowable"" and ""Ang Babaeng Walang Pakiramdam"", but this was a catastrophe. It was long, featured corny language, and was largely wrong. The movie focuses less on the real story and more on making the viewers hate ""the other side"". This movie is just so jam-packed with content that it is a complete mess. Regarding the cinematography and plot, It was decent but still not enough. A Marcos movie had so much promise, yet this was a tremendous waste.",2022-08-06,1,0,rewatch,True
themere,,Booo,2022-08-06,0,0,watch,False
marcapple,,"was able to watch this. definitely deserve to be on top 10 list of worst, infamous, and historically inaccurate films that has ever released in mainstream media. couldn't say more or less but this shit can definitely be surpassed by any high schools/colleges' short films.",2022-08-06,1,0,watch,False
basuraangmim,1,"Panget, di worth it, sayang pera at oras ko, historical revisionism at its finest, overrated, corny ng mga linya",2022-08-06,1,0,watch,False
astrainverse,1,"In an article titled ""Recovery of the Marcos Assets,"" former PCGG Commissioner Jaime Bautista recalls that the William Saunders-Jane Ryan accounts were closed by 1970 but its balances were transferred to the Xandy Foundation, which was later transferred to Fides Trust Co. and then to Avertina Foundation. This is only one of several foreign foundations that the Marcoses established as supposed cover-up for their money deposited in the Swiss banking system.The Swiss Federal Supreme Court ruled that the secret Marcos account hidden in Swiss banks had criminal provenance. The high court ordered its transfer to the Republic of the Philippines and placed it under escrow with the Philippine National Bank. In 1998, Switzerland turned over to the Philippines bank deposits worth $627 million in accordance with the Swiss Federal Supreme Court.The Marcos foundations appealed to prevent the transfer of bank deposits to the Philippines but the Swiss Federal Supreme Court ruled that the foundations were mere creations of Marcos and that they had participated in his bad faith.",2022-08-06T07:52:25.069Z,0,0,watch,False
cruzsuzanne,1,don't need to watch it to know it's garbage #NoToHistoricalRevisionism #NeverAgain #NeverForget #NotMyPresident,2022-08-06T08:19:19.257Z,3,0,watch,False
laginalangumuul,1,"INAMO DARYLL YAP, ASS LICKER, MAHILIG KA DIN PALA SA PWET KALA KO SA BATA LANG",2022-08-06T08:37:00.703Z,0,0,watch,False
clarenceken,1,Wow ang ganda....Ang ganda ng ideya na sakalin si Daryl Yap. 🤮,2022-08-06,1,0,watch,False
namjoonswifeu,1,"Ampanget. Kahit ano pa ipalabas mo Darryl Yap, magnanakaw pa din ang mga Marcos.",2022-08-06T09:04:14.304Z,0,0,watch,False
wellybeannn,,BASURAAAAAAAAA,2022-08-06,0,0,watch,False
faebody,1,iyak na naman mga PINKLAWAN #AMAZEBALLS #ANONGAYONPINKLAWAN,2022-08-06,1,0,watch,False
faebody,1,"Senpai!!￼ you did it again (✧ω✧) chotto matte pinakawalans, did my senpai make you cry? Awe🥺😂😅 arigato gozaimasu for fighting for what is right senpai🥺 i can see you’re like ayanokouji-kun❤️",2022-08-06,1,0,rewatch,False
fivesixth,1,syempre di ko naman pinanood hehehe pakyu ka daryl yap heheheh katips na lang panoodin nio guyse,2022-08-06,1,0,watch,False
strawreos,1,robin padilla feeling mcu cameo amputa,2022-08-06T09:29:38.852Z,3,0,watch,False
icedteaa,1,even if I were held at gunpoint I would never watch this movie. this rating is an act of my Filipino patriotism,2022-08-06,8,0,watch,False
paulaang,1,yuck!,2022-08-06,1,0,watch,False
charliecockx,1,"pagtitiisan ko pa ang 10inch na tt sa loob ng 2hrs kahit masakit sa panga,tuhod at pwet kesa sayangin ang oras sa movie nato",2022-08-06,5,0,watch,False
hanguang_jun,2,"My cousin was forced to watch it with her parents - who are both apologists, mind you - and I had to stop her from bleaching her eyes after that. One star.",2022-08-06T11:20:15.193Z,1,0,watch,False
area51escapee,1,"Bakit hindi mahaba ang baba ng actor na nagpoportray kay Imee Marcos? SMH, I expected better of this movie. I am thoroughly disappointed and thus, I will give a .5 star. (That’s me being generous.)",2022-08-06T11:26:14.963Z,1,0,watch,False
nkhr_chuunya,1,"When I went to pay for the movie ticket, I realized that I am poor. I am now upset. One star. 🙂(i did not - nor will i ever - watch the movie)",2022-08-06T11:29:25.098Z,2,0,watch,False
justraphh,1,mandatory darryl yap hate post sa letterboxd,2022-08-06,2,0,rewatch,False
kunrong19,1,"The acting was okay. The directing, pacing and editing of the film left a lot to be desired.. A student in university could do better than this 😕",2022-08-06,0,0,rewatch,False
cubaohoodrat,,musical score: goodstorytelling: very bad (classic darryl yap monologue style that tells everything through lines and not through visuals)damn this family’s vain af they got gigantic portraits of themselves in every roomps. marion aunor should get copyrighted by paloma faith for traydor na pagibig,2022-08-06,1,0,watch,False
lnalp1,1,Di ko pa to napapanood pero putangina mo darryl yap.,2022-08-06,0,0,watch,False
chleareal,2,"I'm telling you guys, don't even watch this crap. They just want people to believe their lies.",2022-08-06T13:07:39.629Z,0,0,watch,False
depthberry,1,This is the first movie I will never watch (not even pirate) but rate it with the lowest score possible because it's the biggest piece of shit film by the biggest pieces of dogshit people in the country. I hope everyone who worked on this willingly and everyone who supports this fall off a cliff and stay there.,2022-08-06,0,0,watch,False
pysapie,1,"grabe damang-dama ko yung eksena kung saan huminga ng malalim si marcos, tumingin ng matindi sa camera at sinabi niyang ""It's stealin' time."" one of the movies ever!",2022-08-06,0,0,watch,False
zarinaxxiv,1,"Ang tao lamang ang namamatay, ang katotohanan ay habambuhay.Never forget and never again to historical distortion, to Marcos, and his false stories.",2022-08-06,4,0,watch,False
rayl_xd,1,"kwento mo yan eh, syempre mabuti ang mga marcos dyan",2022-08-06,2,0,watch,False
diseffinguy,1,Shit historical revisionism like this should be illegal. So of course Filipino politicians love it.,2022-08-06,0,0,watch,False
lovielyyy,1,will never watch this but fuck you,2022-08-07,4,0,watch,False
rbarried,1,putangina pangit basta gawa ni darryl yap,2022-08-07,1,0,watch,False
