username,rating,review_text,date,likes,comments,viewing_type,user_liked
francesizzy,1,"I was forced to watch this and I spent 114 minutes on Imee's anger issues. She should have been the one to run as president since the movie portrayed her as the brain and the main character of the Marcos family. Bongbong literally did nothing but wear a fucking uniform and wallow throughout the film.Majority of the scenes Imee was shouting but props to her outfits; they were all pretty, well, coming from the kaban ng bayan of course. Tho I have to say whoever Cristina's wardrobe director is... love the fits. Ang pretty rin masyado ni Cristina para matawag na Imee huhu TvT but my eardrums were annoyed with her constant screeches.Ang pogi rin ni Bonbong pero hindi siya morena na chinito with short hair. Si Irene naman they slayed the fact that I always forget she even existed even in the film walang may pake sakanya nasa gilid lang siya; waiting to be summoned. ""Wala kang alam, Irene! Wala kang alam!""ANYWAYThey tried to explain their side by glorifying their Father (who literally ruled for 14 years) using the weapon of pity. Hear me out with what Ferdie said""Galit sila sa'tin kasi hindi tayo nagmula sa isang elitistang pamilya"" UHM? HELLAUR?? UR FATHER AND GREAT GRAND FATHER HAD BEEN MINGLING WITH POLITICS BEFORE U WERE EVEN BORN?? ever since the Marcoses joined the nation's politics; it just birthed a whole dynasty as we can see in Ilocos Norte. This has been their name's family business. Your family encapsulated the very core of what an elitist is so I greatly beg to differ.""Galit sila sa'tin kasi probinsiyano tayo""Ako ren, probinsiyana ako pero galit ako sa'yo. And in the first place, out of all the 16 ex- presidents, si Estrada lang ang born as BGC kid dito. Don't use that ""probinsiyano"" card as a decoy for pity because there is nothing wrong with being a probinsiyano. Magsaysay was from Zambales and he proved to be a great president so I don't know why you have to bring your ancestry up when it's not even a good factor to be considered. Try better.""Galit sila sa'tin kasi mahal nila tayo""There's a literal revolution outside your house.. so uhm... yeah.. Also, I expected this would be a film in honor of the Malacañang maids but.. Jesus Christ... I should have expected their tremendous ego beforehand. I mean they tried to pan the attention back to the maids but the actual ""Maid in Malacañang"" is none other than Imee herself. You figure how the fuck that happened. Not to mention the sex-ish scene dedicated to Imelda and her 3000 shoes.. No idea where that came from but God was that weird. There was also this scene where as the Marcoses were about to leave, Imee ordered her maids to tear a piece of her Mother's gown and make a bandana of some sort so they could pretend like their part of the riot and get out of the mansion safely. That was witty actually but also overdramatically stupid. A GOWN? OF ALL THE GARMENTS??? A GOOOWN????? AND YOU'RE TELLING ME THIS REALLY HAPPENED???There's also this scene with Cory Aquino and the Carmelite nuns. Cory acted like fucking Kris Aquino on this movie, with the accent and all. It's supposed to be a form of mockery, I assume but they really didn't leave the nuns out of this. Their form of mockery is to have pink linen on their HABIT? Bravo for the audacity! Sacrilegious Blasphemy! And for the historical inaccuracy! There's literally a book completely denouncing this fabricated claims so congratulations for that.Ay gago may biglaang cameo pa pala dito ni Robin Padilla parang Stan Lee jusko. Am I supposed to gasp in surprise and awe because owemji that's my top 1? fuck off ^-^All in all, cinematography and the script itself is idfk?? because you can literally see the camera shaking in the first few scenes and again the weird intimate scene with Imelda and her shoe collection.. comedic relief lang nila is 'yung the actual maids of malacañang and they really relied on hearsays here as they portrayed their katulongs as ""marites"" which is offensive with the people working the same field. Ayon lang.",2022-08-09,25,0,watch,False
nicocaine,,this is the worst movie in the world (i haven't seen it),2022-08-09,1,0,watch,False
lncrxv,1,"honestly watched this for free thanks to the vouchers that they have been giving to government offices.if i were a marcos voter who somehow trusted and believed in him and his family, like the rest of the 31 million, i would have loved this. it tried to gain further sympathy and humanize a family who has been under siege by forces who either betrayed them or wanted to take the malacañang for their own benefit. never mind the fact that the palace and the presidency weren't and shouldn't be permanently belong to them. this shows drama, like how teleseryes try to do so, and the marcoses (especially imee) as the protagonists who are dealing with a huge threat.but, as someone who knows my history, this is a fucking propaganda film that has been used to humanize a family who plundered billions of dollars and plunged our country to debt and disaster after more than 20 years in power. i laughed at how marcos sr. asked irene (played by chismosang ella cruz) if he was a bad person. imee, acting all high and mighty, tried to be the family's savior all while bonget just wants to make his father proud (i remembered that four sisters scene). it sought to clearly wipe their sins out and make the people forget how they made our country suffer. MIM reorients the supposed ""goons"" of the country to the yellows and all of their elites and cohorts that wanted to take the power away from the besieged marcoses. this film failed to highlight the most important part as the story of 1986 unfolded: it was the filipino people who ousted the marcoses. edsa was not about cory or macoy, it was about us at that time in history when we took the matters to the streets. so i commend darryl yap as a staunch marcos propagandist, especially in trying to protagonize imee rather than her brother. but as a filipino who will never forget the marcos atrocities, i'll continue to long for a day in my lifetime where he will eventually pay his sins for brainwashing our people.",2022-08-10,1,0,watch,False
titodadbod,1,Shittiest movie ever. Daryl Yap should rot in jail/,2022-08-09,0,0,watch,False
jodi_suarez,1,fuck yall enablers,2022-08-10,0,0,watch,False
dilfilms,1,"ampangit na nga nung direktor, ampangit pa ng movie. pick a struggle pdf wag mong nilalahat.edit: hinatak lang ako ng mama ko manuod i was held at gunpoint as some would say, wala ako magawa dalawang ticket binili e. parang kahit siya napangitan kasi nung tinanong ko kumusta ang sagot lang sakin, ""okay lang""",2022-08-09,6,0,watch,False
shinmentakezo0o,1,source: baba ni imee,2022-08-10,0,0,watch,False
freqx,1,pure trash,2022-08-10T05:26:25.521Z,0,0,watch,False
kcgutz,2,"its higher than .5 because i like the production or cinematography, ite good actually— the camera filming spinning around emotional scenes are kinda annoying but ok. now in discussion of the film, its considered as a documentary but its biased? its a documentary but made into a comedy? it really is just about the marcoses, therefore not considered as a documentary.",2022-08-07,0,0,watch,False
teddiekonakaya,,fangit,2022-08-10,0,0,watch,False
macjohnearl,1,the trolls have re-reiniltrated letterboxd. we must log it again to preserve the ratio. (Letterboxd doesn’t count any logs before august 8),2022-08-10,4,0,watch,False
giancarloco_,1,"didnt watch, forda filler sa boxd reviews ko🤭",2022-08-10,0,0,watch,False
misterhyde15,,Basurang direktor = Basurang Pelikula,2022-08-10,1,0,watch,False
joshclaude,1,"San ka punta To the moonRoadtrip broom broomSkrrr skrr zoom zoomSa fake no roomMga mata namumulaAsan ang trees nadala mo baBawal ang tuss at peke sa byaheKung isa ka jan ika'y bumabaSan ka punta To the moonRoadtrip broom broomSkrrr skrr zoom zoomSa fake no roomMga mata namumulaAsan ang trees nadala mo baBawal ang tuss at peke sa byaheKung isa ka jan ika'y bumabaFanget, shunga. Kasalanan ng mga pumila para rito kung ba’t muntikan akong naleyt sa Top Gun: Maverick nung isang araw ehh. Buti pa si Tom Cruise, bukod sa naniniwala niyang hindi kailangan ng political statement sa movie, mainit pa rin kahit 60 na siya. Samantalang, yung bida niyo rito, mukhang paa. Mga marites talaga…naniniwalang tsimis lang ang history. Chz",2022-08-10,3,0,watch,False
gabsaulog,1,Historical revisionism has no place to be marketed as entertainment or even classified as a “work of art that’s meant to disturb.”,2022-08-10,0,1,watch,False
marilynmonhoe,1,tangina mo talaga Darryl Yap pangit ng palabas mo kahit bakla ako mas gusto ko pang mag jabol kesa manuod sa pangit mong palabas,2022-08-10,0,0,rewatch,False
pixcallie,1,nice fiction,2022-08-09,1,0,watch,False
riogibo35,1,it's marcosin' time,2022-08-10T16:14:25.317Z,0,0,watch,False
bonniewatches,1,i didnt watch this i just wanted to give a bad review,2022-08-11,0,0,watch,False
jetriii,1,FUCK U RATIO!!!!,2022-08-11,1,0,rewatch,False
alrded,1,basura,2022-08-11,0,0,watch,False
gaylebelv,1,fuck off darryl yap,2022-08-11,1,0,watch,False
